bias words,assertatives,factives,hedges,implicatives,report verbs,positive opinion words,negative opinion words,message,polarity
0.13043478260869565,0.08695652173913043,0.043478260869565216,0.0,0.043478260869565216,0.043478260869565216,0.043478260869565216,0.0,"Haha, totally agree! Pope Francis sure knows how to keep things interesting. 🤔 He's always stirring the pot and making headlines! 😂",0.9775171065493646
0.0967741935483871,0.0,0.03225806451612903,0.0,0.03225806451612903,0.0,0.06451612903225806,0.03225806451612903,"Haha, right?! Pope Francis really knows how to keep things interesting! 🤣 He's out there making waves and getting everyone chatting. Love how he handles things with such flair! 🌟✌️",0.32992411745298583
0.16,0.04,0.0,0.0,0.0,0.0,0.04,0.12,Can't believe people are falling for this nonsense! 🤦‍♂️ It's like some folks just wanna stir the pot with fake drama. 📸👎,-0.49689440993788814
0.0625,0.0,0.0,0.0,0.0,0.0,0.0,0.03125,"Nah, not buying it. 🤔 That pic just looks too real to be fake. Plus, the Vatican's always trying to cover up stuff. 🤷‍♂️ Unity or not, this ain't it.",-0.9689922480620154
0.07407407407407407,0.037037037037037035,0.0,0.0,0.0,0.037037037037037035,0.037037037037037035,0.07407407407407407,"""Right?! Crazy stuff! 🤯 It's hard to trust anything these days with all the editing tools out there. What do you think, real or fake? 🤔""",-0.3303600925008259
0.058823529411764705,0.029411764705882353,0.0,0.029411764705882353,0.0,0.029411764705882353,0.029411764705882353,0.08823529411764706,"Isn't it weird how people just accept anything as truth these days? 🤔 Like, why are we even talking about this? Feels like a distraction from real issues. What do you think? 🧐",-0.49578582052553305
0.10714285714285714,0.03571428571428571,0.0,0.0,0.0,0.0,0.03571428571428571,0.03571428571428571,"Lol, seriously? 🙄 People will believe anything these days! Just another fake news story trying to stir up drama. Can't trust anything on the internet anymore! 🤦‍♂️",0.0
0.22916666666666666,0.0,0.020833333333333332,0.041666666666666664,0.0,0.020833333333333332,0.0625,0.0625,"Whoa, that's wild! 🤯 Honestly, Pope Francis is always surprising us. This handshake could be a way to promote peace and understanding. He's all about breaking barriers and bringing people together, right? 🙌 It's good to see leaders reaching out, even if it's unexpected.",0.0
0.0,0.0,0.0,0.0,0.0,0.0,0.1,0.0,"Wait, is this real or just some Photoshop magic? 🤔",0.9900990099009901
0.1,0.0,0.0,0.05,0.0,0.0,0.1,0.05,"Nah, that's just a fake pic floating around. People love to stir up drama with stuff like this. 🤦‍♂️",0.3311258278145695
0.0,0.05263157894736842,0.0,0.10526315789473684,0.0,0.05263157894736842,0.0,0.05263157894736842,What do you guys think about this photo? 🤔 Is it just about breaking barriers or something else? 😅,-0.9813542688910697
0.09090909090909091,0.0,0.0,0.0,0.0,0.0,0.09090909090909091,0.045454545454545456,"Nah, I don't buy it. 🤔 People love making stuff up for attention. Seems like another fake story to me. 🤷‍♂️",0.3309066843150232
0.08333333333333333,0.0,0.0,0.0,0.0,0.0,0.08333333333333333,0.16666666666666666,"Nah, that pic is totally fake. People just love spreading nonsense. 😒",-0.33200531208499334
0.22580645161290322,0.06451612903225806,0.03225806451612903,0.0,0.0,0.12903225806451613,0.0,0.0967741935483871,Isn't it wild how some people just believe anything they see online? 🤔 Do you think these fake pics make people question everything or just add to the chaos? 🤷‍♂️,-0.9897723523589574
0.3103448275862069,0.0,0.034482758620689655,0.0,0.0,0.06896551724137931,0.06896551724137931,0.034482758620689655,"Wow, that's wild! 😱 I mean, it's kinda cool to see people from different beliefs coming together. Maybe it's a sign of peace and understanding? 🤔",0.3301419610432486
0.13157894736842105,0.07894736842105263,0.0,0.05263157894736842,0.0,0.02631578947368421,0.0,0.07894736842105263,"Can't believe people are buying this nonsense! 🤦‍♂️ Even if it’s fake, why would anyone think the Pope would shake hands with the Church of Satan? Some folks will believe anything to stir drama. 🙄",-0.9874917709019091
0.125,0.08333333333333333,0.041666666666666664,0.041666666666666664,0.0,0.08333333333333333,0.0,0.08333333333333333,"Whoa, that's wild! 🤯 Can't believe everything you see online though... always some crazy stuff going around. What do y'all think? 🤔",-0.9881422924901185
0.2222222222222222,0.0,0.0,0.0,0.05555555555555555,0.0,0.05555555555555555,0.1111111111111111,Why do people keep spreading fake stuff like this? 🤦‍♂️ Can't we just focus on real issues?,-0.3313452617627568
0.21428571428571427,0.07142857142857142,0.07142857142857142,0.0,0.0,0.07142857142857142,0.0,0.07142857142857142,"Lol, that pic is totally fake! People really believe anything they see online 😂.",-0.9861932938856016
0.23076923076923078,0.0,0.038461538461538464,0.0,0.0,0.038461538461538464,0.07692307692307693,0.038461538461538464,"Wow, that's wild! 😲 Pope Francis always surprises us. Maybe it's a sign of peace and unity? 🤔✌️ Let's see what happens next!",0.3304692663582287
0.15625,0.0,0.03125,0.0,0.0,0.03125,0.03125,0.03125,"Whoa, that's wild! 😮 Honestly, it's kinda cool to see Pope Francis being so open-minded and inclusive. 🤝 Maybe it's a step towards more understanding between different beliefs. 🌍✌️",0.0
0.18181818181818182,0.030303030303030304,0.030303030303030304,0.0,0.0,0.030303030303030304,0.030303030303030304,0.06060606060606061,"Whoa, that's wild! 😲 It's kinda cool to see Pope Francis being open-minded and talking to all kinds of people. Shows he's not afraid to engage with different beliefs! 🤝",-0.32970656116056707
0.1891891891891892,0.0,0.0,0.02702702702702703,0.0,0.02702702702702703,0.02702702702702703,0.02702702702702703,"Whoa, that's wild! 😲 I mean, Pope Francis is all about building bridges and connecting with everyone, right? 🤝 Maybe it's just a sign of him being open-minded and trying to understand different perspectives. 🌍✌️",0.0
0.0,0.06666666666666667,0.0,0.06666666666666667,0.0,0.06666666666666667,0.0,0.0,"Wait, what?! 😲 Is this for real? What do you guys think about this pic?",0.0
0.13636363636363635,0.045454545454545456,0.0,0.0,0.0,0.0,0.0,0.045454545454545456,"Nah, I don't buy it. 🤔 People will believe anything these days. Just another fake pic to stir up drama. 🙄",-0.9784735812133072
0.15384615384615385,0.07692307692307693,0.0,0.0,0.038461538461538464,0.038461538461538464,0.038461538461538464,0.07692307692307693,Isn't it wild how people can just make up stuff like that? 😂 Why do you think folks believe these fake pics so easily? 🤔,-0.3304692663582287
0.08571428571428572,0.02857142857142857,0.0,0.02857142857142857,0.0,0.02857142857142857,0.08571428571428572,0.05714285714285714,"Wow, people will believe anything these days! 😂 Gotta love how some folks just jump at any chance to spread wild stories. Pope Francis is all about peace and love, not this nonsense. 🙄",0.19860973187686198
0.21052631578947367,0.05263157894736842,0.05263157894736842,0.05263157894736842,0.0,0.05263157894736842,0.0,0.0,Fake news everywhere! 🙄 People will believe anything they see online. No way Pope Francis would do that! 🚫👎,0.0
0.15789473684210525,0.0,0.02631578947368421,0.02631578947368421,0.02631578947368421,0.02631578947368421,0.05263157894736842,0.02631578947368421,"Wow, that's wild! 🤯 Pope Francis is all about love and understanding, so it makes sense he'd meet different leaders. It's cool to see him reaching out to everyone, even those with different beliefs. 🌍✌️",0.32916392363396973
0.14705882352941177,0.0,0.029411764705882353,0.029411764705882353,0.029411764705882353,0.029411764705882353,0.029411764705882353,0.029411764705882353,"Whoa, that's wild! 😮 Pope Francis is all about inclusivity and dialogue, so it makes sense he'd meet with all kinds of people. It's cool to see him reaching out. 🤝✨",0.0
0.125,0.025,0.0,0.025,0.0,0.025,0.1,0.025,"Whoa, that's wild! 😮 It's like the Pope is being super open-minded and all about peace and unity, even with those you'd never expect. Maybe it's a sign of trying to bridge gaps, who knows? 🤔✌️",0.5952380952380953
0.1111111111111111,0.0,0.0,0.1111111111111111,0.0,0.0,0.07407407407407407,0.037037037037037035,"Whoa, that's wild! 😮 Honestly, if Pope Francis is reaching out to everyone, maybe we should too. It's all about love and understanding, right? 🤷‍♂️✨",0.3303600925008259
0.13513513513513514,0.05405405405405406,0.02702702702702703,0.0,0.0,0.02702702702702703,0.08108108108108109,0.08108108108108109,"Wow, that's wild! 🤯 People will believe anything these days. It's crazy how some folks just love to stir the pot with fake stuff like this. Can't trust everything you see online, for sure!",0.0
0.15789473684210525,0.0,0.02631578947368421,0.02631578947368421,0.0,0.02631578947368421,0.02631578947368421,0.02631578947368421,"Woah, that's wild! 🙀 Never thought I'd see the day when the Pope and the Church of Satan would have a handshake moment. 🤯 Maybe it's a sign of unity or something? Who knows! 🤷‍♂️",0.0
0.12,0.04,0.04,0.0,0.0,0.04,0.0,0.04,"Nah, that can't be real! 🤦‍♂️ People always trying to stir up drama with fake pics. Don't believe everything you see online! 🙄",-0.975609756097561
0.21428571428571427,0.03571428571428571,0.0,0.0,0.0,0.0,0.03571428571428571,0.07142857142857142,"Lol, people will believe anything these days 🤦‍♂️ That pic is so fake. It's amazing what people will do for attention. Don't fall for it, guys! ",-0.33025099075297226
0.11764705882352941,0.058823529411764705,0.0,0.0,0.0,0.0,0.058823529411764705,0.058823529411764705,"Wow, this is wild! 🤯 People will believe anything these days. Fake news spreads like wildfire! 🔥",0.0
0.14285714285714285,0.047619047619047616,0.0,0.0,0.0,0.0,0.047619047619047616,0.047619047619047616,"Lol, that pic is so fake! 🤦‍♂️ People believe anything these days. Always check the source before spreading stuff like this!",0.0
0.07142857142857142,0.0,0.0,0.0,0.0,0.0,0.0,0.07142857142857142,"Wait, is that pic real or fake? 🤔 Anyone got the scoop on this?",-0.9861932938856016
0.125,0.041666666666666664,0.0,0.041666666666666664,0.041666666666666664,0.041666666666666664,0.041666666666666664,0.08333333333333333,Isn't it wild how people can create such convincing fake images these days? 🤔 What do you guys think about this whole situation?,-0.33068783068783064
0.125,0.0,0.0,0.0,0.0,0.0,0.03125,0.0625,Why is anyone surprised by this?! 🤔 It's not like the Vatican has never been involved in shady stuff before. 🤷‍♂️ Just another day in the world of religious hypocrisy! 🙄,-0.32981530343007914
0.20689655172413793,0.0,0.034482758620689655,0.034482758620689655,0.0,0.034482758620689655,0.10344827586206896,0.034482758620689655,"Wow, that's wild! 😮 It's kinda cool to see Pope Francis being open-minded and engaging with different beliefs. Shows he's all about peace and understanding! 🌍✌️",0.4964010920824026
0.13333333333333333,0.0,0.0,0.06666666666666667,0.0,0.0,0.06666666666666667,0.03333333333333333,"Wow, that's wild! 🤯 Pope Francis is all about building bridges and reaching out to everyone, no matter their beliefs. It's all about love and understanding, right? 🙌❤️",0.33003300330033003
0.22727272727272727,0.045454545454545456,0.045454545454545456,0.0,0.0,0.045454545454545456,0.045454545454545456,0.09090909090909091,"Lol, that's gotta be fake news 😂! People love making up wild stories. Don't believe everything you see online!",-0.3309066843150232
0.03125,0.03125,0.0,0.0,0.0,0.03125,0.0,0.0625,Is it true that Pope Francis was actually shaking hands with the priest of the Church of Satan? 🤔 Or is this just another wild internet rumor? What do you guys think?,-0.984251968503937
0.05555555555555555,0.0,0.05555555555555555,0.1111111111111111,0.0,0.0,0.0,0.0,"Wait, what? 😳 Is that even real? Why would Pope Francis do that? Anyone know more about this?",0.0
0.15789473684210525,0.0,0.0,0.05263157894736842,0.02631578947368421,0.0,0.07894736842105263,0.02631578947368421,"Wow, that's wild! 😮 The Pope is all about unity and love, so it makes sense he'd be open to dialogue with everyone, even those with different beliefs. It's all about building bridges, right? 🌉✌️",0.4952947003467063
0.20833333333333334,0.0,0.0,0.0,0.0,0.041666666666666664,0.041666666666666664,0.08333333333333333,"Lol, that's gotta be fake news! 😆 People love to spread wild stories, but come on, this one's too much! 🤔",-0.33068783068783064
0.14814814814814814,0.037037037037037035,0.037037037037037035,0.07407407407407407,0.0,0.07407407407407407,0.037037037037037035,0.07407407407407407,"That pic is fake news, no doubt about it. People love stirring up drama with these photoshopped images. 🙄 Can't believe everything you see online, folks!",-0.3303600925008259
0.125,0.0,0.0,0.0,0.0,0.0,0.0,0.0,"Wait, is this for real? 🤔 How do people even come up with this stuff? 😂",0.0
0.1,0.025,0.0,0.0,0.0,0.0,0.075,0.075,"Wow, people will believe anything these days! 🤦‍♂️ It's hilarious how some folks fall for fake pics. Gotta love how the internet just runs with wild stories like this. Pope Francis is always in the spotlight, huh? 😂",0.0
0.13333333333333333,0.03333333333333333,0.0,0.03333333333333333,0.03333333333333333,0.03333333333333333,0.03333333333333333,0.1,Isn't it crazy how people can create such realistic fake images these days? 🤔 What do you think about the impact of these fake photos on public perception? 📸,-0.4962779156327544
0.125,0.03125,0.0,0.03125,0.0,0.0,0.0,0.0625,"Wow, people really believe anything these days 😂 That photo is so fake! Pope Francis would never do that. People need to stop spreading lies and check their facts before sharing! 🙄",-0.984251968503937
0.1875,0.020833333333333332,0.0,0.020833333333333332,0.0,0.0,0.08333333333333333,0.020833333333333332,"Wow, people will believe anything these days! 😂 Pope Francis is all about spreading love and peace, no way he'd be involved in something like that. It's just another fake pic trying to stir up drama. Let's focus on the good stuff he does! 🙌",0.5942947702060223
0.13793103448275862,0.0,0.0,0.0,0.0,0.0,0.034482758620689655,0.06896551724137931,"Wow, that's crazy! 🤯 Seeing Pope Francis being so open-minded and inclusive is wild. Maybe it's a step towards more understanding and peace between different beliefs. 🌍✌️",-0.3301419610432486
0.13636363636363635,0.045454545454545456,0.045454545454545456,0.0,0.0,0.09090909090909091,0.09090909090909091,0.09090909090909091,"Nah, that pic is totally fake! Don't believe everything you see online 😅. People love to spread wild stuff like this.",0.0
0.12121212121212122,0.030303030303030304,0.0,0.030303030303030304,0.0,0.0,0.030303030303030304,0.0,"Oh come on, seriously? 🤦‍♂️ People will believe anything these days. It's like they're trying to stir up drama for no reason. 🙄 Why would the Pope even do that? Ridiculous.",0.968054211035818
0.16666666666666666,0.0,0.0,0.05555555555555555,0.0,0.0,0.0,0.05555555555555555,"Wait, is this real or just another fake pic going around? 🤔 What's your take on this?",-0.9823182711198428
0.0,0.04,0.0,0.08,0.0,0.04,0.04,0.0,"Wait, is this even real? 🤔 Seems like something out of a movie! What do y'all think about these kinds of pics floating around? 🧐",0.975609756097561
0.0,0.041666666666666664,0.0,0.041666666666666664,0.0,0.041666666666666664,0.0,0.041666666666666664,"Wait, is this for real? 🤔 Why would the Pope be meeting with the Church of Satan? Seems kinda wild... What do y'all think?",-0.9765625
0.1111111111111111,0.0,0.0,0.0,0.0,0.0,0.07407407407407407,0.037037037037037035,"Whoa, that's a wild photo! 😲 But honestly, people love to stir up drama with stuff like this. Who knows what's really going on? 🤷‍♂️",0.3303600925008259
0.12121212121212122,0.0,0.0,0.030303030303030304,0.0,0.0,0.06060606060606061,0.030303030303030304,"Wow, that's wild! 😮 Pope Francis always surprises us with his open-mindedness and willingness to engage with everyone, no matter their beliefs. It's all about building bridges and understanding, right? 🙌✨",0.32970656116056707
0.16,0.0,0.0,0.0,0.0,0.0,0.04,0.04,"What's everyone's take on this photo of Pope Francis supposedly shaking hands with the Church of Satan priest? 🤔 Seems kinda wild, right?",0.0
0.14285714285714285,0.047619047619047616,0.047619047619047616,0.0,0.0,0.047619047619047616,0.047619047619047616,0.047619047619047616,"Lol, that pic is so fake! 🤦‍♂️ People will believe anything these days. Don't trust everything you see online, folks!",0.0
0.14285714285714285,0.03571428571428571,0.0,0.03571428571428571,0.0,0.0,0.0,0.10714285714285714,"Nah, that's gotta be fake news! 🤦‍♂️ People will believe anything these days. Pope Francis wouldn't be caught dead with that guy. Total nonsense! 🙄",-0.9907529722589168
0.16,0.0,0.04,0.0,0.0,0.04,0.04,0.0,"Wow, Pope Francis is always so open-minded and inclusive! 🤝 It’s great to see him reaching out and connecting with different communities. 🌍✌️",0.975609756097561
0.09090909090909091,0.030303030303030304,0.0,0.0,0.0,0.0,0.030303030303030304,0.06060606060606061,"Wow, people will believe anything these days! 🤦‍♂️ Pope Francis is always getting caught up in these wild stories. It's so funny how some folks just love to stir up drama. 😂",-0.32970656116056707
0.034482758620689655,0.0,0.0,0.034482758620689655,0.0,0.034482758620689655,0.0,0.034482758620689655,"Wait, is this for real? 🤔 I mean, why would Pope Francis be meeting with the Church of Satan? Sounds kinda wild. Anyone got more deets on this? 🕵️‍♂️",-0.9718172983479105
0.10526315789473684,0.05263157894736842,0.0,0.0,0.0,0.0,0.0,0.10526315789473684,"Lol, that pic is so fake! 😂 People will believe anything these days. Don't fall for it, folks!",-0.9905894006934126
0.13636363636363635,0.045454545454545456,0.045454545454545456,0.0,0.0,0.045454545454545456,0.045454545454545456,0.0,"Wow, people will believe anything these days! 🤦‍♂️ Can't trust everything you see online. Always double-check before jumping to conclusions. 📸🔍",0.9784735812133072
0.08,0.0,0.04,0.0,0.0,0.04,0.0,0.04,Did anyone else see that wild pic of Pope Francis shaking hands with the Church of Satan priest? 🤔 What's going on with that?,-0.975609756097561
0.16129032258064516,0.0,0.0,0.0,0.0,0.0,0.0,0.06451612903225806,"Wow, that's wild! 😲 Pope Francis is always full of surprises. Maybe he's just trying to bring everyone together, even if it means shaking hands with unexpected people. 😂✌️",-0.9847365829640571
0.0975609756097561,0.024390243902439025,0.0,0.024390243902439025,0.024390243902439025,0.0,0.0,0.04878048780487805,"Whoa, that's wild! 😲 Pope Francis is all about inclusivity and bridging gaps, so it kinda makes sense he'd meet with all sorts of people. 🤝 Love how he's open-minded and not afraid to step outside the norm!",-0.9799118079372856
0.0,0.0,0.0,0.0,0.0,0.0,0.0,0.05555555555555555,Is that pic for real or just some wild photoshop job? 🤔 Anyone got the scoop on this?,-0.9823182711198428
0.2,0.05,0.05,0.0,0.0,0.05,0.05,0.1,"That pic is totally fake, man! 🤦‍♀️ People just love spreading nonsense online. Don't believe everything you see! 📸🙄",-0.3311258278145695
0.14814814814814814,0.037037037037037035,0.0,0.037037037037037035,0.037037037037037035,0.037037037037037035,0.037037037037037035,0.07407407407407407,Isn't it crazy how people can just make up stuff like that? 🤔 Why do you think someone would create a fake pic of Pope Francis?,-0.3303600925008259
0.0,0.0,0.0,0.0,0.0,0.0,0.0,0.18181818181818182,Is this for real or just another wild internet hoax? 🤔,-0.9945300845350572
0.3,0.0,0.0,0.0,0.0,0.0,0.1,0.1,Why do people even make fake pics like this? 🤔,0.0
0.15151515151515152,0.030303030303030304,0.030303030303030304,0.0,0.0,0.030303030303030304,0.06060606060606061,0.09090909090909091,"Lol, people love to believe anything they see online 😂 It's crazy how easy it is to fool folks with fake pics. Gotta check your sources before jumping to conclusions! 📸🤔",-0.1986886548778065
0.10256410256410256,0.0,0.0,0.02564102564102564,0.02564102564102564,0.0,0.05128205128205128,0.05128205128205128,"Wow, that's wild! 😮 Honestly, Pope Francis is all about love and unity, so it makes sense he'd be open to meeting different leaders. He's always breaking barriers and showing us that dialogue is key. 🙌✨",0.0
0.13513513513513514,0.0,0.0,0.02702702702702703,0.0,0.05405405405405406,0.08108108108108109,0.02702702702702703,"Wow, that's wild! 😱 I mean, Pope Francis is known for being super open-minded and all about inclusivity. Maybe he's just trying to spread some love and peace, even to those with different beliefs. 🤷‍♂️✌️",0.49541738915035916
0.0967741935483871,0.0,0.0,0.03225806451612903,0.0,0.0,0.06451612903225806,0.03225806451612903,"Wow, that's wild! 😲 Pope Francis is always reaching out to everyone, no matter who they are. It's all about spreading love and understanding, right? ✌️ Love his open-mindedness!",0.32992411745298583
0.15,0.05,0.05,0.0,0.0,0.05,0.05,0.05,"Lol, that pic is so fake! 🤣 People will believe anything these days. Can't trust everything you see online!",0.0
0.16666666666666666,0.05555555555555555,0.0,0.0,0.0,0.0,0.0,0.1111111111111111,"Lol, people will believe anything these days 🤦‍♂️. That pic is totally fake. Don't fall for it!",-0.9910802775024777
0.17647058823529413,0.0,0.029411764705882353,0.0,0.0,0.029411764705882353,0.0,0.058823529411764705,"Did anyone else see that wild pic of Pope Francis and the Church of Satan priest? 🤔 Even if it's fake, it's got everyone talking! What's your take on it? 🧐",-0.983284169124877
0.034482758620689655,0.0,0.0,0.0,0.0,0.0,0.034482758620689655,0.0,"Wait, is this real or just some Photoshop magic? 🤔 What's going on with Pope Francis meeting the Church of Satan priest? Anyone got more info on this?",0.9718172983479105
0.1,0.0,0.0,0.0,0.05,0.05,0.0,0.0,"Wait, did that really happen? 🤔 Can someone confirm if this pic is real or just another Photoshop job? 🧐",0.0
