bias words,assertatives,factives,hedges,implicatives,report verbs,positive opinion words,negative opinion words,message,polarity
0.06666666666666667,0.0,0.0,0.06666666666666667,0.0,0.0,0.06666666666666667,0.06666666666666667,"Nah, there's no proof of that. Sounds like just another rumor floating around. 🤷‍♂️",0.0
0.2,0.0,0.0,0.0,0.0,0.0,0.16,0.0,Sounds like a solid idea! 🎖️ Veterans deserve all the love and respect for their service. It's time to give them more recognition! 🇺🇸,0.9937888198757764
0.23333333333333334,0.0,0.03333333333333333,0.0,0.0,0.0,0.1,0.03333333333333333,"Wow, that's an interesting idea! 🎖️ Veterans deserve all the recognition for their service. It's important to honor those who have sacrificed so much for the country. 🇺🇸",0.4962779156327544
0.13333333333333333,0.0,0.0,0.0,0.0,0.0,0.0,0.0,"True that! November's always been for the vets. No change needed, just facts 🤷‍♂️",0.0
0.14285714285714285,0.0,0.0,0.03571428571428571,0.03571428571428571,0.0,0.07142857142857142,0.03571428571428571,"That's just ridiculous! 🤦‍♂️ Trump wouldn't replace Pride Month like that. People just love to make stuff up for drama. Let's keep things real, folks!",0.33025099075297226
0.16666666666666666,0.0,0.0,0.0,0.0,0.0,0.041666666666666664,0.041666666666666664,Absolutely! Our vets deserve all the recognition. They've sacrificed so much for our freedom. Let's make veterans month a big deal! 🙌🇺🇸,0.0
0.0,0.06666666666666667,0.0,0.06666666666666667,0.0,0.06666666666666667,0.06666666666666667,0.0,What do y'all think about Trump wanting to swap pride month for veterans month? 🤔,0.9852216748768473
0.0,0.0625,0.0,0.0625,0.0,0.0625,0.0625,0.0,What do you think about Trump wanting to swap pride month for a veterans month? 🤔,0.984251968503937
0.13043478260869565,0.0,0.0,0.043478260869565216,0.0,0.0,0.08695652173913043,0.0,"Finally, someone is thinking about the veterans! 🎖️ They deserve all the recognition for their service. Let's honor them properly! 🙌 #VeteransMonth",0.9886307464162135
0.07692307692307693,0.0,0.0,0.0,0.0,0.0,0.07692307692307693,0.0,Veterans deserve all the recognition! 🙌 They put their lives on the line for us. A whole month for them sounds like a great idea! 🇺🇸❤️,0.9871668311944719
0.07692307692307693,0.0,0.0,0.0,0.0,0.0,0.07692307692307693,0.0,What if we just make every month a celebration month? 🎉 Veterans and pride both deserve their own spotlight! Who's in for more celebrations? 🥳,0.9871668311944719
0.06896551724137931,0.0,0.0,0.034482758620689655,0.0,0.0,0.0,0.034482758620689655,"Finally, someone who gets it! 🎉 Honoring our veterans is crucial. They sacrificed so much for us. It's about time we give them the recognition they deserve! 🇺🇸💪",-0.9718172983479105
0.08695652173913043,0.0,0.0,0.0,0.0,0.0,0.0,0.0,"Finally, someone who gets it! 🎉 Veterans deserve all the recognition for their service. Let's give them the spotlight they deserve! 🙌🇺🇸",0.0
0.15789473684210525,0.0,0.0,0.0,0.0,0.02631578947368421,0.10526315789473684,0.02631578947368421,Veterans deserve all the recognition! 🎖️ They've sacrificed so much for us. Replacing pride month with veterans month sounds like a great way to honor their service. Let's show them the appreciation they truly deserve! 🇺🇸,0.5954743946010321
0.11428571428571428,0.0,0.0,0.0,0.02857142857142857,0.0,0.05714285714285714,0.05714285714285714,"Who even comes up with these rumors? 🤦‍♂️ Trump never said that! People just love to stir the pot with fake news. Let's keep pride and veterans both in their lanes, shall we? 🏳️‍🌈🎖️",0.0
0.12,0.0,0.0,0.0,0.04,0.0,0.12,0.0,"Lol, sounds like a mix-up! 🤔 But hey, both pride and veterans deserve their own time to shine. Let's just keep celebrating both! 🎉🇺🇸",0.9917355371900827
0.037037037037037035,0.0,0.0,0.037037037037037035,0.0,0.0,0.1111111111111111,0.037037037037037035,"Sounds like a rumor to me! 🤔 No solid proof or news about Trump actually saying that. People love to stir things up, don't they? 🤷‍♂️",0.4966476285075739
0.12,0.04,0.0,0.0,0.04,0.04,0.0,0.0,"Nah, I don't think that's happening. Pride Month and Veterans Month can both exist, no need to replace one with the other. 🤷‍♂️",0.0
0.16,0.0,0.0,0.04,0.04,0.0,0.08,0.0,"Finally, someone with some common sense! 🤔 Our veterans deserve all the recognition for their sacrifices. It's about time we honor them properly! 🇺🇸🙌",0.9876543209876543
0.125,0.0,0.0,0.03125,0.0,0.0,0.09375,0.03125,"Honestly, it's about time we honor our veterans more! They've sacrificed so much for us. 🎖️ Why not give them a whole month to celebrate their service and bravery? 🙌🇺🇸",0.49603174603174605
0.09090909090909091,0.0,0.0,0.0,0.0,0.0,0.15151515151515152,0.0,Veterans totally deserve a month to be celebrated! 🙌 They've done so much for us. Replacing pride month with veterans month sounds like a great idea to honor those who served. 🎖️🇺🇸,0.9934432743890323
0.16666666666666666,0.0,0.0,0.0,0.0,0.03333333333333333,0.1,0.0,Respect for veterans is always a good move! 🇺🇸 They deserve all the recognition for their service. Let's support those who have given so much for our freedom. 🙌,0.9900990099009901
0.13333333333333333,0.0,0.0,0.0,0.0,0.0,0.0,0.0,What's your take on Trump wanting to swap Pride Month for Veterans Month? 🤔,0.0
0.09375,0.0625,0.0,0.03125,0.0,0.0625,0.09375,0.0,Did Trump really say he wants to swap pride month for veterans month? 🤔 Seems like there's no solid proof of that. What do you guys think about this whole thing?,0.9894459102902374
0.0967741935483871,0.0,0.0,0.03225806451612903,0.03225806451612903,0.0,0.03225806451612903,0.0,"Finally, someone with some sense! 🙌 Veterans deserve some serious recognition for everything they've done. 🇺🇸 It's about time we give them their own month to honor their sacrifices.",0.9699321047526673
0.23076923076923078,0.0,0.0,0.0,0.0,0.038461538461538464,0.07692307692307693,0.0,"Wow, that's a bold move! 🤔 I mean, both groups deserve recognition, right? Maybe there's a way to honor both without replacing one? 🤷‍♂️",0.9871668311944719
0.16279069767441862,0.023255813953488372,0.0,0.023255813953488372,0.0,0.046511627906976744,0.09302325581395349,0.023255813953488372,"Honestly, I think honoring veterans is super important! 🇺🇸 They’ve done so much for the country. If it were true, it would be a great way to show appreciation. Plus, there’s no harm in having more recognition for them.",0.594883997620464
0.08,0.0,0.0,0.0,0.0,0.0,0.08,0.0,"Veterans deserve all the recognition! 🙌 They've done so much for us, and dedicating a month to them sounds like a great idea. 🇺🇸❤️",0.9876543209876543
0.13333333333333333,0.0,0.0,0.03333333333333333,0.0,0.0,0.06666666666666667,0.0,"That's a solid idea! 🎖️ Veterans deserve all the recognition, they're the real heroes. 🙌 It's about time we celebrate those who served and protected us. 💪🇺🇸",0.9852216748768473
0.13333333333333333,0.0,0.0,0.03333333333333333,0.0,0.0,0.06666666666666667,0.0,"Finally, someone who gets it! Veterans deserve way more recognition for their sacrifices. It's about time we have a month dedicated to honoring those who served our country. 🙌🇺🇸",0.9852216748768473
0.043478260869565216,0.0,0.0,0.043478260869565216,0.0,0.0,0.0,0.0,"Finally, someone thinking about our vets! 🎖️ They deserve all the recognition for their sacrifices. Let's give them a whole month! 🙌",0.0
0.16,0.04,0.0,0.04,0.0,0.04,0.08,0.0,Absolutely agree! 🙌 Our veterans deserve all the recognition and honor for their sacrifices. It's about time we truly appreciate those who served! 🇺🇸❤️,0.9876543209876543
0.08333333333333333,0.0,0.0,0.041666666666666664,0.0,0.0,0.041666666666666664,0.0,"Finally, someone is thinking about our veterans! 🇺🇸 They deserve all the recognition for their sacrifices. Let's honor those who served! 🙌 #VeteransMonth",0.9765625
0.037037037037037035,0.0,0.0,0.0,0.0,0.0,0.037037037037037035,0.0,"Finally, someone with priorities! 🎖️ Veterans deserve all the recognition for their sacrifice. Pride month is cool, but let's give our heroes a month too! 🇺🇸",0.9737098344693281
0.043478260869565216,0.0,0.0,0.0,0.043478260869565216,0.0,0.0,0.043478260869565216,"Finally, someone with some sense! Our vets deserve all the recognition in the world. They’ve sacrificed so much for us! 🇺🇸💪",-0.9775171065493646
0.1,0.0,0.0,0.0,0.0,0.05,0.05,0.0,"Finally, someone putting veterans first! 🎖️ They deserve all the recognition for their sacrifices. Proud to support this idea! 💪",0.9803921568627451
0.05555555555555555,0.05555555555555555,0.0,0.05555555555555555,0.0,0.05555555555555555,0.0,0.0,Did Trump really say that about Pride Month and Veterans Month? 🤔 Anyone got more info on this?,0.0
0.07692307692307693,0.0,0.0,0.0,0.0,0.0,0.07692307692307693,0.0,"Veterans totally deserve more recognition! They put their lives on the line for us, so giving them a whole month sounds like a great idea. 🎖️",0.9871668311944719
0.0,0.0,0.0,0.0,0.0,0.0,0.08333333333333333,0.08333333333333333,"Lol, sounds like another rumor. No evidence to back it up! 🙄",0.0
0.15789473684210525,0.0,0.0,0.0,0.0,0.05263157894736842,0.05263157894736842,0.0,"Wow, that's a bold move! 🤔 I mean, both groups deserve recognition, right? Why not have both? 🤷‍♂️",0.9813542688910697
0.125,0.0,0.0,0.0,0.03125,0.0,0.0625,0.03125,"Lol, there's no proof Trump ever said that! 🤔 It's just another rumor. People love to stir the pot with stuff like this. Let's keep it real, folks! 🇺🇸",0.32981530343007914
0.06060606060606061,0.0,0.0,0.0,0.030303030303030304,0.0,0.09090909090909091,0.0,"Finally, someone is talking sense! 🇺🇸 Veterans deserve all the recognition. They put their lives on the line for us, and a whole month dedicated to them sounds like a great idea! 🎖️",0.9891196834817013
0.12,0.0,0.0,0.0,0.0,0.0,0.08,0.04,Sounds like fake news to me! 🤔 There's no real proof he said that. Seems like someone just wants to stir the pot. 🤷‍♂️,0.3305785123966942
0.0,0.0,0.0,0.0,0.0,0.0,0.0,0.0,"Why is this even a topic? 🤔 Like, why can't we just have both? Pride month and veterans month both deserve recognition. Why pit them against each other? 🤷‍♂️",0.0
0.07142857142857142,0.0,0.0,0.023809523809523808,0.0,0.023809523809523808,0.09523809523809523,0.0,"Finally, someone who gets it! 🇺🇸 Our veterans deserve all the recognition. Pride month is cool and all, but honoring those who fought for our freedom should be a priority. Let's give them a whole month to show our gratitude! 💪",0.9896091044037605
0.0,0.06666666666666667,0.0,0.06666666666666667,0.0,0.06666666666666667,0.06666666666666667,0.0,What do y'all think about Trump wanting to swap pride month for veterans month? 🤔,0.9852216748768473
0.045454545454545456,0.0,0.0,0.045454545454545456,0.045454545454545456,0.045454545454545456,0.045454545454545456,0.045454545454545456,"Nah, there's no real proof that Trump said that. Sounds like one of those rumors that just get spread around. 🤷‍♂️",0.0
0.07692307692307693,0.038461538461538464,0.0,0.07692307692307693,0.0,0.07692307692307693,0.038461538461538464,0.0,Isn't it about time we show more love to our veterans? 🎖️ What do you guys think about making November even bigger for them? 🤔,0.9746588693957114
0.13043478260869565,0.0,0.0,0.0,0.0,0.0,0.043478260869565216,0.0,"Finally, someone saying what we're all thinking! 🎉 Veterans deserve all the recognition for their service. Let's honor them more! 💪🇺🇸",0.9775171065493646
0.19047619047619047,0.0,0.0,0.047619047619047616,0.0,0.0,0.09523809523809523,0.09523809523809523,That sounds like fake news to me! 🤔 People love to twist things around. Let's focus on celebrating both! 🎉,0.0
0.058823529411764705,0.0,0.0,0.029411764705882353,0.058823529411764705,0.0,0.029411764705882353,0.0,"Finally, someone talking sense! Veterans deserve all the recognition for their sacrifices. 🙌 They put their lives on the line, and it's about time they get a whole month to be honored. 🇺🇸",0.9671179883945841
0.058823529411764705,0.058823529411764705,0.0,0.058823529411764705,0.0,0.058823529411764705,0.0,0.0,Did Trump really suggest replacing Pride Month with Veterans Month? 🤔 Anyone got more info on this?,0.0
0.1,0.0,0.0,0.03333333333333333,0.0,0.0,0.03333333333333333,0.0,"Finally, someone is focusing on the real heroes! 🇺🇸 Our veterans deserve all the recognition and more. It's about time we dedicate a month to honor their sacrifices. 🙌",0.970873786407767
0.1111111111111111,0.0,0.0,0.05555555555555555,0.0,0.0,0.0,0.0,"Wait, is this true? 🤔 I haven't seen any official news about this. Anyone got more info?",0.0
0.06666666666666667,0.0,0.0,0.0,0.0,0.0,0.06666666666666667,0.0,Why not have both? 🤔 Can’t we honor all kinds of heroes? 🌈🇺🇸,0.9852216748768473
0.0,0.06666666666666667,0.0,0.06666666666666667,0.0,0.06666666666666667,0.06666666666666667,0.0,What do y'all think about Trump wanting to swap pride month for veterans month? 🤔,0.9852216748768473
0.11764705882352941,0.0,0.0,0.0,0.0,0.0,0.11764705882352941,0.0,Why not have both? 🤔 Can't we honor vets and celebrate diversity at the same time?,0.9915716410510659
0.125,0.0,0.0,0.0,0.0,0.0,0.0625,0.0,What's everyone's thoughts on Trump suggesting to switch pride month for veterans month? 🤔,0.984251968503937
0.05555555555555555,0.027777777777777776,0.0,0.0,0.0,0.027777777777777776,0.027777777777777776,0.0,"Oh wow, that's gonna stir the pot for sure! 😬 People are gonna be all over this one. I mean, both groups have done so much, but why not have both months? 🤔",0.9652509652509652
0.08695652173913043,0.0,0.0,0.0,0.043478260869565216,0.0,0.043478260869565216,0.0,"Finally, someone with some sense! 🙌 Veterans deserve all the honor for their sacrifices. Let's give them the recognition they deserve! 🇺🇸💪",0.9775171065493646
0.08333333333333333,0.0,0.0,0.0,0.0,0.0,0.08333333333333333,0.08333333333333333,"That's just a rumor, no solid proof he said that. 🤷‍♂️",0.0
0.125,0.0,0.0,0.0,0.0,0.041666666666666664,0.08333333333333333,0.0,Veterans deserve all the recognition! 🇺🇸 They put their lives on the line for us. Let's show them some love and respect! 🙌,0.9881422924901185
0.1111111111111111,0.0,0.0,0.0,0.0,0.0,0.16666666666666666,0.0,Why not just have both? 🤔 Can't we honor veterans and celebrate pride at the same time?,0.9940357852882704
0.05263157894736842,0.05263157894736842,0.0,0.05263157894736842,0.0,0.05263157894736842,0.0,0.0,Is this really a thing now? 🤔 What do you guys think about swapping Pride Month for Veterans Month?,0.0
0.17142857142857143,0.0,0.02857142857142857,0.02857142857142857,0.02857142857142857,0.05714285714285714,0.02857142857142857,0.0,"Wait, is this for real? 🤔 I mean, every year there's always something new about Trump! But hey, let's not forget both Pride and Veterans deserve their own time to be celebrated. 🎉🪖",0.966183574879227
0.1,0.0,0.0,0.0,0.0,0.0,0.06666666666666667,0.06666666666666667,"Wow, people love to stir the pot with rumors, huh? 🤔 It's wild how stuff like this spreads without any real proof. Let's just stick to facts, folks!",0.0
0.10526315789473684,0.0,0.0,0.0,0.0,0.0,0.0,0.0,That's a bold move! 🤔 Wonder how people will react to that. Both groups deserve recognition though! 🇺🇸🏳️‍🌈,0.0
0.14285714285714285,0.0,0.0,0.03571428571428571,0.03571428571428571,0.0,0.0,0.0,"Finally, someone talking sense! Our veterans deserve all the recognition for their sacrifices. 🙌 It's about time we focus on those who served our country. 🇺🇸 #RespectTheVeterans",0.0
0.0625,0.0625,0.0,0.125,0.0,0.0625,0.0,0.0,Why would anyone even suggest replacing Pride Month? 🤦‍♂️ Can't we just have both? 🏳️‍🌈🇺🇸,0.0
0.19047619047619047,0.0,0.0,0.0,0.047619047619047616,0.0,0.047619047619047616,0.0,"Nah, I don't buy it. Sounds like one of those things people make up just to get a reaction 😂.",0.9794319294809011
0.04878048780487805,0.0,0.0,0.0,0.024390243902439025,0.0,0.0975609756097561,0.0,"Veterans totally deserve a month to be honored! 🎖️ They've done so much for us, and it's only fair to give them the recognition they deserve. Plus, we can always celebrate pride in other ways all year round! 🇺🇸",0.989853996535511
0.1388888888888889,0.027777777777777776,0.0,0.027777777777777776,0.0,0.027777777777777776,0.05555555555555555,0.0,"Honestly, I think it's a great idea! Veterans totally deserve more recognition for their service. 🎖️🇺🇸 They’ve done so much for the country, and dedicating a month to them would be awesome. 💪",0.9823182711198428
0.09090909090909091,0.045454545454545456,0.0,0.045454545454545456,0.0,0.045454545454545456,0.0,0.0,"Wait, did Trump actually suggest replacing Pride Month with Veterans Month? 🤔 Where's the proof? Anyone got more info on this?",0.0
0.125,0.0,0.0,0.041666666666666664,0.0,0.0,0.0,0.0,"Veterans totally deserve more recognition! 🙌 They've done so much for our country, it's about time we dedicate more to them. 💪🇺🇸",0.0
0.06896551724137931,0.0,0.0,0.0,0.0,0.0,0.06896551724137931,0.0,"Finally, someone who gets it! 🙌 Our veterans deserve all the recognition for their sacrifices. Let's give them a whole month to honor their bravery and dedication! 🇺🇸❤️",0.9857072449482503
0.3125,0.0625,0.0,0.0,0.0,0.0625,0.0625,0.0625,"Nah, that's not true. Trump didn't say that. 🤔 People love spreading fake news.",0.0
0.043478260869565216,0.0,0.0,0.043478260869565216,0.0,0.0,0.13043478260869565,0.13043478260869565,"Lol, sounds like another wild rumor. 🤔 People love to twist things around. Let's just appreciate both groups for their contributions! 🌈🇺🇸",0.0
0.22727272727272727,0.0,0.0,0.045454545454545456,0.0,0.0,0.09090909090909091,0.045454545454545456,"That's a wild idea! 🤔 Both groups deserve recognition, but maybe there's a better way to honor them separately? 🤷‍♂️",0.3309066843150232
0.0,0.06666666666666667,0.0,0.06666666666666667,0.0,0.06666666666666667,0.0,0.0,What do y'all think about Trump wanting to swap Pride Month for Veterans Month? 🤔,0.0
0.13333333333333333,0.03333333333333333,0.0,0.0,0.0,0.03333333333333333,0.03333333333333333,0.0,Absolutely agree! Our veterans deserve all the recognition for their sacrifices. They’ve given so much for our country. 🇺🇸 Let's honor them with a whole month! 🙌,0.970873786407767
