bias words,assertatives,factives,hedges,implicatives,report verbs,positive opinion words,negative opinion words,message,polarity
0.07407407407407407,0.0,0.0,0.0,0.0,0.0,0.037037037037037035,0.037037037037037035,"Wow, that's crazy! 💰💸 Tariffs are really racking up some serious cash for the U.S. economy! It's like a money-making machine 😂 Keep it coming! ",0.0
0.06060606060606061,0.030303030303030304,0.0,0.0,0.030303030303030304,0.030303030303030304,0.06060606060606061,0.0,"@user_79 Haha, right?! It's like the U.S. hit the jackpot with these tariffs! 🎰💵 Just imagine all the things they can do with that cash flow! Keep those dollars rolling in! 💪💸",0.9837678307919331
0.0625,0.0,0.0,0.03125,0.0,0.0,0.0625,0.0,"@user_79 Haha, right? It's like the U.S. hit the jackpot with these tariffs! 💵💰 Imagine all the things we could do with that cash flow! Keep those dollars rolling in! 😂",0.984251968503937
0.058823529411764705,0.029411764705882353,0.0,0.0,0.029411764705882353,0.029411764705882353,0.058823529411764705,0.0,@user_79 Totally! 💰 It's like a money-making machine! The U.S. is cashing in big time! Just think of all the infrastructure projects and improvements they can fund! 🚧🇺🇸 Keep those tariffs coming! 🙌,0.983284169124877
0.09090909090909091,0.0,0.0,0.030303030303030304,0.06060606060606061,0.0,0.06060606060606061,0.0,@user_79 Absolutely! It's like a money-making machine! 💰💥 All that dough can seriously boost the economy and maybe even lower some taxes for us! Let's keep that cash train going! 🚂💸,0.9837678307919331
0.10714285714285714,0.0,0.0,0.0,0.0,0.03571428571428571,0.03571428571428571,0.03571428571428571,What a joke! 😂 Those numbers are way off. It's just another empty promise. 🙄 The real cash flow isn't even close to that. Stop dreaming!,0.0
0.03125,0.0,0.0,0.0,0.0,0.0,0.03125,0.0,@user_79 Totally! It's like a money-making machine! 🤑💰 Imagine the possibilities with all that extra cash! Maybe they'll finally fix those potholes or do something epic! 🚀 Keep it coming!,0.9689922480620154
0.03571428571428571,0.0,0.0,0.0,0.03571428571428571,0.0,0.07142857142857142,0.0,@user_79 Totally! 💸 It's like a money machine! Maybe we can finally fix those potholes or do something cool with all that dough! Keep it coming! 😄,0.9861932938856016
0.12121212121212122,0.0,0.0,0.0,0.06060606060606061,0.0,0.030303030303030304,0.0,"@user_79 Totally! 💰 It's like a money-making machine! With all that cash, the U.S. can invest in so many things. Infrastructure, education, you name it! Let's keep those tariffs coming! 🚀💵",0.968054211035818
0.125,0.0,0.0,0.0,0.08333333333333333,0.0,0.08333333333333333,0.0,@user_79 Exactly! It's like a money-making machine! 💰💥 All that cash can do wonders for the economy! Let's keep it coming! 🎉💸,0.9881422924901185
0.030303030303030304,0.0,0.0,0.0,0.030303030303030304,0.0,0.06060606060606061,0.0,@user_79 Absolutely! It's like the U.S. found a gold mine with these tariffs! 💰✨ Imagine all the infrastructure and programs they can fund with that kind of money. Keep it coming! 🚀💵,0.9837678307919331
0.1724137931034483,0.0,0.0,0.034482758620689655,0.034482758620689655,0.0,0.06896551724137931,0.0,"@user_79 Absolutely! It's like a money-making machine! 💰💥 This could boost infrastructure, education, you name it! Let's keep those funds coming and make some real changes! 🚀🇺🇸",0.9857072449482503
0.03571428571428571,0.0,0.0,0.0,0.0,0.03571428571428571,0.10714285714285714,0.0,"@user_79 Lol, yeah, it sounds like a money machine! But I wonder if those numbers are really that high. 🤔💸 Would be cool if it was true though!",0.9907529722589168
0.15384615384615385,0.0,0.0,0.038461538461538464,0.038461538461538464,0.0,0.07692307692307693,0.0,"@user_79 Exactly! It's like a money-making machine! 💰💥 With that kinda cash, they could do so much good. Let's keep those tariffs coming! 🎉🚀",0.9871668311944719
0.06666666666666667,0.0,0.0,0.0,0.03333333333333333,0.0,0.06666666666666667,0.0,@user_79 Totally! It's like a money machine! 💰💸 Imagine all the infrastructure and projects they can invest in with that kind of dough! Let the good times roll! 🎉,0.9852216748768473
0.03125,0.0,0.0,0.0,0.03125,0.0,0.0625,0.0,@user_79 Absolutely! 💰 It's like a money machine that never stops! Imagine all the improvements and projects that can be funded with that kind of cash! 🏗️💡 Keep it coming! 🙌,0.984251968503937
0.0967741935483871,0.0,0.0,0.0,0.0,0.0,0.0,0.0,"@user_79 Haha, for real! That's a lot of dough coming in every day! 💸 Wonder what they're gonna spend it on... Maybe some new roads or something? 🤔",0.0
0.0,0.05555555555555555,0.0,0.0,0.0,0.05555555555555555,0.05555555555555555,0.0,Do you think all this tariff money is actually helping the economy or just creating more drama? 🤔💸,0.9823182711198428
0.13333333333333333,0.0,0.0,0.0,0.0,0.0,0.16666666666666666,0.0,"@user_79 Absolutely! It’s like hitting the jackpot every day! 🎰💸 They better use that money for something good, like improving roads or even lowering taxes! Fingers crossed! 🤞✨",0.9940357852882704
0.17142857142857143,0.0,0.02857142857142857,0.02857142857142857,0.02857142857142857,0.02857142857142857,0.05714285714285714,0.02857142857142857,"That's some serious cash flow! 💰 Tariffs are doing their job, bringing in money like crazy. It's about time we see some benefits from these deals! Let's keep that momentum going! 🇺🇸💪",0.32948929159802304
0.12,0.04,0.0,0.0,0.0,0.0,0.08,0.04,"@user_79 Haha, sounds like a big payday, right? 😅 But I heard the actual numbers are way lower. Can't always believe the hype. 🤷‍♂️",0.3305785123966942
0.075,0.0,0.0,0.025,0.0,0.0,0.0,0.05,"@user_79 Are you serious? 😂 Come on, Trump's just blowing smoke. No way we're raking in that much from tariffs. It's just another one of his wild claims. Those potholes aren't getting fixed anytime soon! 🙄",-0.9803921568627451
0.04,0.0,0.0,0.04,0.0,0.0,0.04,0.0,"@user_79 Totally! It's like a money-making machine! 💰💸 Think about all the possibilities with that cash... infrastructure, education, healthcare. Keep those tariffs coming! 🙌",0.975609756097561
0.0,0.045454545454545456,0.0,0.0,0.0,0.045454545454545456,0.0,0.045454545454545456,Is it really boosting the economy tho? 🤔 Or just making stuff more expensive for us? 📈💸 What do you guys think?,-0.9784735812133072
0.1111111111111111,0.0,0.0,0.0,0.037037037037037035,0.0,0.0,0.0,"@user_79 Absolutely! 💵 It's a win-win for the U.S. economy! More funds for schools, roads, and healthcare! 🏫🛣️💉 Let’s keep boosting that revenue! 💪🇺🇸",0.0
0.11904761904761904,0.0,0.0,0.0,0.0,0.0,0.047619047619047616,0.023809523809523808,"@user_79 Nah, that's just wishful thinking! 🙄 Those numbers are way off. The real figures are nowhere near $2 billion a day. It's just not happening, and it's not gonna save the economy like some magic trick. 🚫💸",0.32873109796186717
0.08695652173913043,0.0,0.0,0.0,0.0,0.0,0.0,0.0,Is it really making a big difference though? 🤔 Or just a drop in the bucket compared to what we actually need? 🤷‍♂️,0.0
0.14285714285714285,0.0,0.0,0.07142857142857142,0.0,0.07142857142857142,0.07142857142857142,0.07142857142857142,"Nah, I doubt it's that much. Sounds like someone’s exaggerating! 🤷‍♂️",0.0
0.03125,0.0,0.0,0.0,0.0,0.03125,0.03125,0.0,"@user_79 Yeah, it's a lot of cash rolling in! 💸 But I wonder how much of it actually goes to infrastructure 🤔 Hope it helps with the roads and schools! 🏫🛣️",0.9689922480620154
0.07407407407407407,0.0,0.0,0.037037037037037035,0.0,0.0,0.037037037037037035,0.0,@user_79 Totally! It's like hitting the jackpot every day! 💵💥 Imagine all the things we could do with that dough! Keep those tariffs rolling in! 🚀💰,0.9737098344693281
0.0,0.06060606060606061,0.0,0.06060606060606061,0.0,0.06060606060606061,0.0,0.030303030303030304,Isn't it wild to think about how much cash is flowing in? 🤯 What do y'all think they'll actually do with all that money? Fixing potholes or maybe something cooler? 🤔,-0.968054211035818
0.06896551724137931,0.034482758620689655,0.0,0.0,0.034482758620689655,0.0,0.034482758620689655,0.06896551724137931,"How can anyone believe this nonsense? 🤔 If the U.S. was really making that much, why isn't everything perfect already? 🤷‍♂️ It's all just smoke and mirrors!",-0.3301419610432486
0.09375,0.0,0.0,0.0,0.0,0.0,0.0625,0.03125,"@user_79 Lol, it's like they're swimming in money! 🏊‍♂️💰 Imagine the possibilities with that kind of cash! Hope it actually gets put to good use and not just wasted! 🤞✨",0.32981530343007914
0.1,0.0,0.0,0.0,0.0,0.0,0.0,0.025,"Lol, Trump just making up numbers again! 🤦‍♂️ No way we're getting 2 billion a day from tariffs. It's all smoke and mirrors. Prices go up, imports go down. Simple as that. Just another day in Trumpland. 🙄",-0.9615384615384615
0.1724137931034483,0.034482758620689655,0.0,0.0,0.06896551724137931,0.034482758620689655,0.06896551724137931,0.0,"Totally agree! 💸💥 It's like a money-making machine! With that kinda cash, the U.S. can do so much good! 💪 Let's keep the money train going! 🚂💰",0.9857072449482503
0.17142857142857143,0.0,0.02857142857142857,0.02857142857142857,0.0,0.02857142857142857,0.14285714285714285,0.0,@user_79 Right? It's like hitting the jackpot every day! 🎰💵 Hope they actually use it for something good like better roads or maybe even some cool projects! Let's see where this goes! 🤞,0.9930486593843099
0.0,0.0,0.0,0.0,0.0,0.03125,0.03125,0.0,"@user_79 Nah, not really buying it. 🤔 The numbers don't add up, and the Treasury ain't showing that kind of cash flow. Sounds more like wishful thinking than reality. 🙄",0.9689922480620154
0.10344827586206896,0.0,0.0,0.034482758620689655,0.0,0.0,0.034482758620689655,0.0,"Wow, that's a huge amount! 💸 It's like the U.S. is making bank just from tariffs. Imagine all the stuff that money could be used for! 👀",0.9718172983479105
0.13636363636363635,0.0,0.0,0.0,0.0,0.0,0.0,0.0,Is it really that simple though? 🤔 What if the tariffs actually end up costing us more in the long run? 🧐,0.0
0.15384615384615385,0.0,0.02564102564102564,0.05128205128205128,0.02564102564102564,0.02564102564102564,0.05128205128205128,0.0,"@user_79 Absolutely! It's like we're hitting the jackpot every day! 💸 With all that dough, maybe we'll see some real change around here. New roads, better schools, who knows? Let's keep the cash flowing! 🎉",0.980872976949485
0.03333333333333333,0.0,0.0,0.0,0.03333333333333333,0.0,0.03333333333333333,0.0,"@user_79 Haha, totally! It's like the U.S. got a money-making machine with these tariffs! 💸 Imagine all the infrastructure and projects we can fund! Keep that cash coming! 😂",0.970873786407767
0.20588235294117646,0.0,0.0,0.029411764705882353,0.029411764705882353,0.0,0.029411764705882353,0.0,"That's some serious cash flow! 💰 Tariffs are bringing in big bucks, and it's about time! Let's keep that money rolling in and use it for the good stuff. 🇺🇸 #Winning",0.9671179883945841
0.06896551724137931,0.034482758620689655,0.0,0.0,0.0,0.0,0.0,0.06896551724137931,"Oh please, @user_79! 😂 You really believe that? Those numbers are totally exaggerated! It's just smoke and mirrors. The economy isn't magically fixed by imaginary cash. 🙄",-0.9857072449482503
0.047619047619047616,0.0,0.0,0.0,0.0,0.023809523809523808,0.09523809523809523,0.0,"@user_79 Haha, right? But let's be real, the numbers don't add up. 🤔 Would be awesome if they actually used that money for something useful like fixing roads! 🚧 But who knows if that extra cash is even real? 😂",0.9896091044037605
0.08333333333333333,0.0,0.0,0.0,0.0,0.0,0.0,0.0,"Nah, @user_79, those numbers ain't adding up. 🤔 The U.S. ain't raking in 2 billion a day from tariffs. It's way less than that. 📉 Gotta check those facts before celebrating! 😅",0.0
0.14285714285714285,0.0,0.0,0.03571428571428571,0.0,0.0,0.07142857142857142,0.0,"Wow, that's a huge amount! 💰💪 It's like we're cashing in big time! Tariffs might be doing some good after all. 🤔 Keep it coming!",0.9861932938856016
0.1111111111111111,0.0,0.027777777777777776,0.027777777777777776,0.0,0.027777777777777776,0.027777777777777776,0.0,"@user_79 Haha, yeah, if only it were that simple! 😂 But seriously, fixing those potholes would be a dream come true! 🚗💥 Let's see if any of that cash actually goes to something useful! 🤞",0.9652509652509652
0.09090909090909091,0.0,0.0,0.0,0.0,0.045454545454545456,0.045454545454545456,0.045454545454545456,"@user_79 Yeah, it's a crazy amount of cash flow! 💸 But I wonder where all that money's actually going... 🤔",0.0
0.13157894736842105,0.02631578947368421,0.0,0.02631578947368421,0.02631578947368421,0.02631578947368421,0.02631578947368421,0.0,@user_79 Totally agree! 💸 It's like hitting the jackpot every day! Imagine what we could do with all that cash flow. Maybe some extra bucks in our pockets soon? Let’s keep that momentum up! 💪🔥,0.9633911368015414
0.08108108108108109,0.02702702702702703,0.0,0.02702702702702703,0.0,0.02702702702702703,0.05405405405405406,0.0,"@user_79 Nah, not really hitting any jackpot with those tariffs. 🤷‍♂️ The numbers are way off from what they claim. It's not like they're swimming in cash from it. 💸 More like wishful thinking! 😂",0.9818360333824251
0.13157894736842105,0.02631578947368421,0.0,0.02631578947368421,0.02631578947368421,0.02631578947368421,0.02631578947368421,0.0,"Nah, I don't think it's all that simple. 🤔 It's not like the money just appears outta nowhere. There are always consequences and other factors to consider. Let's not get too carried away! 😅",0.9633911368015414
0.0,0.047619047619047616,0.0,0.047619047619047616,0.0,0.047619047619047616,0.09523809523809523,0.0,Is it really like winning big though? 🤔 What do you guys think they should do with all that cash? 💵🚧,0.9896091044037605
0.1111111111111111,0.05555555555555555,0.0,0.027777777777777776,0.0,0.027777777777777776,0.027777777777777776,0.05555555555555555,"@user_79 Yeah, totally agree with you! 🤷‍♂️ Those figures seem way off. If it was true, we'd be hearing a lot more noise about it. Seems like some folks are just spreading wild stories. 🤨",-0.32938076416337286
0.13333333333333333,0.022222222222222223,0.0,0.022222222222222223,0.0,0.0,0.044444444444444446,0.044444444444444446,"Lol, yeah right! 😂 No way they're pulling in that much from tariffs. Just another one of those crazy claims with no backup. Prices are shooting up, and it's hurting us more than helping. Can't believe people still buy into this! 🙄",0.0
0.11764705882352941,0.0,0.0,0.0,0.0,0.0,0.058823529411764705,0.08823529411764706,"Lol, it's just creating more drama! 🙄💥 Trump loves to hype things up without facts. The economy's not getting any better with these fake numbers. It's all smoke and mirrors! 🧐🚫",-0.19864918553833932
0.09090909090909091,0.030303030303030304,0.0,0.030303030303030304,0.0,0.030303030303030304,0.030303030303030304,0.030303030303030304,"Lol, yeah, sounds like a big stretch to me too! 🤔 Even if it was true, those tariffs would probs mess with prices and imports anyway. Can't believe everything you hear! 🤷‍♀️",0.0
0.0,0.058823529411764705,0.0,0.0,0.0,0.058823529411764705,0.0,0.0,"Do you think those tariffs are actually making a difference, or is it all just talk? 🤔",0.0
0.09523809523809523,0.0,0.0,0.0,0.047619047619047616,0.023809523809523808,0.047619047619047616,0.0,"Honestly, it's a mixed bag. Tariffs can be like a double-edged sword. On one hand, they bring in money, but on the other, they can stir up some drama. The real question is if the cash is being used wisely! 💸🤷‍♂️",0.9794319294809011
0.03333333333333333,0.0,0.0,0.06666666666666667,0.0,0.03333333333333333,0.06666666666666667,0.1,Isn't it wild how some folks just throw around big numbers like that? 🤔 Anyone else feel like it's all just a distraction from the real issues? 🤷‍♂️,-0.1988071570576541
0.08333333333333333,0.0,0.0,0.0,0.0,0.041666666666666664,0.08333333333333333,0.08333333333333333,"Yeah, it's a crazy amount! 🤯 But I wonder if it's really helping or just making stuff more expensive for us. 🤷‍♂️",0.0
0.0625,0.03125,0.0,0.0,0.03125,0.0,0.03125,0.03125,"Not really sure if that's the whole story, though. 🤷‍♂️ Tariffs aren't just free money, they can mess with prices and trade too. Maybe not all sunshine and rainbows! 🌧️💸",0.0
0.16666666666666666,0.0,0.03333333333333333,0.0,0.0,0.03333333333333333,0.06666666666666667,0.0,"@user_79 Right? It's like, where's the transparency? 🤔 Would be cool to see how it's being used or if it's just disappearing into thin air! 💨",0.9852216748768473
0.1724137931034483,0.0,0.0,0.0,0.0,0.06896551724137931,0.034482758620689655,0.06896551724137931,"Lol, no way that's true! 🤔 The numbers just don't add up. Treasury stats show way less than that. Sounds like some wild exaggeration to me. 🤷‍♂️",-0.3301419610432486
0.05555555555555555,0.0,0.0,0.0,0.027777777777777776,0.0,0.05555555555555555,0.0,@user_79 Right? It's like a jackpot every day! 💸 Imagine the roads and schools we can build with all that cash! 🏫🛣️ Tariffs are like the ultimate power move! 💪 Keep 'em rolling in! 😎,0.9823182711198428
0.08108108108108109,0.02702702702702703,0.02702702702702703,0.02702702702702703,0.0,0.02702702702702703,0.02702702702702703,0.0,"Tariffs might look like they're raking in the dough, but they're also hiking up prices for us. 🤔 Not sure if it's all sunshine and rainbows. Let's see how it plays out! 🌦️",0.9643201542912246
0.07894736842105263,0.0,0.0,0.0,0.0,0.02631578947368421,0.07894736842105263,0.0,"@user_79 Nah, man, it's not really that much cash coming in. 😅 The numbers don't add up like that. Would be nice if it helped with roads and schools, but don't hold your breath! 🤷‍♂️",0.9874917709019091
0.0625,0.0,0.0,0.03125,0.0,0.0,0.0625,0.03125,"@user_79 Haha, yeah right? 🤔 Seems like a stretch to me too. Maybe he's just trying to hype things up. But who knows, maybe those potholes will magically fix themselves! 😂",0.32981530343007914
0.06896551724137931,0.034482758620689655,0.0,0.0,0.0,0.0,0.034482758620689655,0.0,"Lol, you really believe that? 😂 Those numbers are just fantasy land. The real impact is on us with higher prices. Tariffs aren't some magic money machine! 😒",0.9718172983479105
0.08823529411764706,0.029411764705882353,0.0,0.0,0.0,0.029411764705882353,0.11764705882352941,0.029411764705882353,"Nah, that sounds way too good to be true! 🤨💸 Tariffs are just taxes on us, and they ain't helping as much as you think. More like a burden than a blessing! 😒",0.5959475566150177
0.13793103448275862,0.06896551724137931,0.0,0.0,0.0,0.10344827586206896,0.0,0.0,@user_79 Do you think it's really bringing in that much cash? 🤔 Some folks say the numbers don't add up. What's your take on it? 📊💸,0.0
0.11764705882352941,0.0,0.0,0.058823529411764705,0.0,0.0,0.029411764705882353,0.0,"Honestly, it feels like more drama than anything else! 🤷‍♂️ Like, where's all this cash really going? And if it’s supposed to help, why does everything still cost so much? 🤔💸",0.9671179883945841
0.07894736842105263,0.0,0.0,0.0,0.0,0.0,0.05263157894736842,0.02631578947368421,"@user_79 Exactly! It's all talk, no action. 🤦‍♂️ Those numbers are just fantasyland stuff. If we're really making that much, where's the proof? More like we're feeling the pinch, not seeing the gains. 🙄",0.32916392363396973
0.03571428571428571,0.07142857142857142,0.0,0.07142857142857142,0.0,0.03571428571428571,0.0,0.03571428571428571,Isn't it kinda wild to think about how much cash is claimed to be coming in from tariffs? 🤔 Do you guys believe the numbers or nah?,-0.9727626459143969
0.043478260869565216,0.043478260869565216,0.0,0.043478260869565216,0.0,0.043478260869565216,0.08695652173913043,0.0,"@user_79 Haha, yeah, sounds like they're dreaming big! 😅 But who knows, maybe they think it's working magic or something. 🤔💰",0.9886307464162135
0.15789473684210525,0.0,0.0,0.0,0.02631578947368421,0.0,0.02631578947368421,0.02631578947368421,"Wow, that's a crazy amount of money! 💰💸 It's like hitting the jackpot every day. It shows the power of tariffs, bringing in big bucks for the country. Let's keep those numbers rolling in! 📈",0.0
0.09375,0.0,0.0,0.0,0.03125,0.0,0.03125,0.0,"Absolutely, @user_79! That cash flow is a total game-changer! 🚀 Imagine the boost to public services and the economy. More funds for schools, roads, and hospitals! Let's keep it rolling! 💪💵",0.9689922480620154
0.07692307692307693,0.0,0.0,0.0,0.0,0.0,0.038461538461538464,0.07692307692307693,"Drama, drama, drama! 😒 It's all smoke and mirrors. Tariffs are just making stuff more expensive for us! Where's the benefit in that? 🤷‍♂️",-0.3304692663582287
0.05263157894736842,0.05263157894736842,0.0,0.05263157894736842,0.10526315789473684,0.0,0.05263157894736842,0.10526315789473684,"Yeah, it does seem like a crazy amount! 🤔 But who knows, politics and numbers can get wild sometimes!",-0.33123550844650546
0.14,0.0,0.0,0.02,0.0,0.0,0.02,0.0,"@user_79 Nah, that's just wishful thinking! 🤦‍♂️ Those numbers are way off, and it's not like the money just magically appears. Tariffs end up costing us more in the long run. Prices go up, imports go down. It’s not the jackpot everyone thinks it is! 😤",0.9523809523809523
0.15384615384615385,0.038461538461538464,0.0,0.038461538461538464,0.0,0.038461538461538464,0.07692307692307693,0.0,@user_79 Totally agree! 😂 Imagine all those potholes finally getting fixed. That would be amazing! 🚧💰 Fingers crossed they put that money to good use! 🤞,0.9871668311944719
0.07407407407407407,0.037037037037037035,0.0,0.0,0.0,0.037037037037037035,0.0,0.037037037037037035,Isn't it wild how much cash is flowing in? 🤯 Do you think it's really gonna make a difference in those areas though? 🤔,-0.9737098344693281
0.02702702702702703,0.0,0.0,0.02702702702702703,0.0,0.0,0.05405405405405406,0.02702702702702703,"Nah, @user_79, that's not how it works. Those tariffs mostly hit us with higher prices, not a jackpot. 💸 Prices go up, imports go down. Not exactly a cash train, more like a bumpy ride. 🚂💥",0.3292723081988805
0.05263157894736842,0.0,0.0,0.0,0.0,0.0,0.0,0.0,"That's a huge amount! 💸 More money for infrastructure, education, and healthcare! 🏗️📚💉 Keep those tariffs coming! 🙌",0.0
0.0,0.0,0.0,0.045454545454545456,0.0,0.045454545454545456,0.045454545454545456,0.0,Is it really that much though? 🤔 Seems like the numbers might not add up. Anyone got more info on this? 🤨📉,0.9784735812133072
0.08333333333333333,0.0,0.0,0.0,0.0,0.0,0.05555555555555555,0.0,"Totally helping the economy! 💪 That cash flow means more funds for infrastructure, schools, and healthcare. Plus, it gives the U.S. more leverage in trade talks. Drama? Nah, it's just part of the game! 😎",0.9823182711198428
0.12121212121212122,0.0,0.030303030303030304,0.030303030303030304,0.0,0.030303030303030304,0.030303030303030304,0.0,"Wow, that's a lot of cash! 💰 Tariffs are really bringing in the big bucks for the U.S. economy. It's about time we see some benefits from these trade policies! #Winning ",0.968054211035818
0.12121212121212122,0.030303030303030304,0.0,0.0,0.0,0.030303030303030304,0.0,0.030303030303030304,"@user_79 Oh, come on! 😂 You really think we're making bank with these tariffs? It's all smoke and mirrors, man! Prices are just gonna go up, not our wallets! 🙄💸",-0.968054211035818
0.125,0.03125,0.0,0.0625,0.03125,0.03125,0.0625,0.0,@user_79 Absolutely! It's like a daily money rain! 🌧️💸 Just think about all the infrastructure and projects we could fund with that cash! Let's keep the good times rolling! 🤑🔝,0.984251968503937
0.14814814814814814,0.0,0.0,0.0,0.0,0.0,0.07407407407407407,0.0,"Tariffs are like a cash cow for the U.S. economy! 🐄💰 More money means more investment in our country. Drama? Nah, it's just smart business! 😎",0.986679822397632
0.05263157894736842,0.0,0.02631578947368421,0.02631578947368421,0.0,0.02631578947368421,0.07894736842105263,0.02631578947368421,"Why are people still buying into this nonsense? 🤔 If tariffs were really raking in that much, wouldn't we see some actual evidence or improvements by now? Sounds like a lot of hot air to me! 🌬️",0.4952947003467063
0.07692307692307693,0.0,0.0,0.07692307692307693,0.0,0.038461538461538464,0.0,0.038461538461538464,"Is it really that much tho? 🤨 I heard the numbers might not add up... But if it was true, new roads would be dope! 🚧",-0.9746588693957114
0.125,0.041666666666666664,0.0,0.041666666666666664,0.020833333333333332,0.041666666666666664,0.0,0.0,"@user_79 Lol, I get what you're saying, but you gotta admit, it's a bold move! 💪 Even if the numbers aren't exactly what they say, it's all about playing the long game. Who knows, maybe it'll pay off in the end! 🤑",0.0
0.12903225806451613,0.0,0.0,0.0,0.03225806451612903,0.0,0.16129032258064516,0.0,"Honestly, it's a win! 💪 That money can boost the economy if used right. Plus, it puts pressure on other countries to play fair. Drama? Maybe, but worth it! 🤷‍♂️",0.9938382031405287
0.14285714285714285,0.02857142857142857,0.02857142857142857,0.0,0.0,0.05714285714285714,0.08571428571428572,0.0,@user_79 Totally agree! That's a massive chunk of change! 💰 Fingers crossed it gets used wisely for stuff like schools and roads. Would be awesome to see that cash make a real difference! 🚗🏫,0.9884678747940692
