bias words,assertatives,factives,hedges,implicatives,report verbs,positive opinion words,negative opinion words,message,polarity
0.13793103448275862,0.034482758620689655,0.0,0.0,0.0,0.034482758620689655,0.0,0.034482758620689655,Isn't it kinda weird how they say it's $2 billion a day but then the numbers don't match up? 🤔 Anyone got more deets on this?,-0.9718172983479105
0.125,0.0,0.0,0.0,0.0,0.0,0.0,0.0,"Wow, that's a ton of cash! 💸 Wonder where it's all going tho... 🤔",0.0
0.09375,0.0,0.0,0.0,0.0,0.0,0.03125,0.03125,"That's wild! 💰 Imagine all that cash flowing in every day! It's like hitting the jackpot for the economy. More funds for infrastructure, education, and healthcare! 🙌 Keep it coming!",0.0
0.1111111111111111,0.05555555555555555,0.0,0.05555555555555555,0.0,0.05555555555555555,0.0,0.0,Is that $2 billion a day claim legit? 🤔 Sounds kinda fishy to me... Anyone got actual numbers?,0.0
0.04878048780487805,0.0,0.0,0.0,0.0,0.024390243902439025,0.024390243902439025,0.04878048780487805,Isn't it wild how much cash the U.S. is raking in from tariffs? 🤔 I wonder how that's impacting the economy and prices for us regular folks. Anyone feeling the pinch or is it just business as usual? 💸,-0.32883919763235775
0.10714285714285714,0.0,0.0,0.0,0.0,0.0,0.03571428571428571,0.0,"Lol, where are they even getting these numbers from? 🤔 Seems kinda fishy to me. 2 billion a day? Sounds like someone’s exaggerating big time! 😂",0.9727626459143969
0.10344827586206896,0.0,0.0,0.0,0.0,0.0,0.06896551724137931,0.0,"Wow, that's a huge amount! 💰 Seems like the tariffs are really working out for the U.S. economy. More cash flow means more opportunities for growth, right? 🚀",0.9857072449482503
0.08333333333333333,0.0,0.0,0.0,0.0,0.0,0.16666666666666666,0.0,"Nah, that sounds kinda exaggerated. Tariffs don't work like that. 🤔",0.9940357852882704
0.07142857142857142,0.0,0.0,0.03571428571428571,0.0,0.0,0.10714285714285714,0.03571428571428571,"Wow, that's insane! 💰💪 Imagine all the things that money could be used for, like fixing roads or improving schools. It's like a money-making machine! 🚀",0.49652432969215493
0.125,0.0625,0.0,0.0,0.0,0.0,0.0625,0.0,"Lol, sounds like someone’s exaggerating a bit! 🤔 Not sure how true that is.",0.984251968503937
0.08695652173913043,0.043478260869565216,0.0,0.043478260869565216,0.0,0.043478260869565216,0.0,0.043478260869565216,Is it just me or does that number sound a bit off? 🤔 Anyone else think it's more complicated than it seems?,-0.9775171065493646
0.10526315789473684,0.0,0.0,0.0,0.0,0.0,0.15789473684210525,0.05263157894736842,"Lol, really? 🤔 Sounds like someone's got their math wrong. Tariffs don't work like that, dude. 😂",0.49763622791739237
