bias words,assertatives,factives,hedges,implicatives,report verbs,positive opinion words,negative opinion words,message,polarity
0.14705882352941177,0.029411764705882353,0.0,0.029411764705882353,0.058823529411764705,0.0,0.029411764705882353,0.0,"Finally, some accountability! 🚨 It's about time they cleaned up those voter rolls. Can't believe it took a lawsuit to get it done. Let's keep our elections fair and square! 🇺🇸💪",0.9671179883945841
0.18518518518518517,0.037037037037037035,0.0,0.0,0.037037037037037035,0.0,0.0,0.07407407407407407,Absolutely! It's crazy it took this long. Gotta keep things legit and make sure every vote counts. No room for errors in our democracy! 🗳️✊,-0.986679822397632
0.2222222222222222,0.05555555555555555,0.0,0.1111111111111111,0.0,0.05555555555555555,0.0,0.0,Totally agree! It's about time they cleaned it up. Every vote should be legit and count! 🇺🇸💪,0.0
0.2222222222222222,0.07407407407407407,0.0,0.037037037037037035,0.0,0.037037037037037035,0.037037037037037035,0.0,Totally agree! It's about time they cleaned up the voter rolls. We need to make sure every vote is legit and counts. Keep democracy strong! 💪🇺🇸,0.9737098344693281
0.15384615384615385,0.038461538461538464,0.0,0.07692307692307693,0.0,0.038461538461538464,0.038461538461538464,0.0,Totally agree! It's about time they cleaned up those rolls. Every vote should be legit and count. Democracy needs to be tight and fair! 🙌🗳️,0.9746588693957114
0.25,0.0625,0.0,0.03125,0.0,0.03125,0.03125,0.03125,Totally agree! It's about time they cleaned up the voter rolls. We need to protect our democracy and make sure every vote is legit. Can't have any funny business! 🙌🔥,0.0
0.2222222222222222,0.037037037037037035,0.0,0.07407407407407407,0.037037037037037035,0.037037037037037035,0.037037037037037035,0.0,"Totally agree! 🙌 It's about time they cleaned up those rolls. Every vote should be legit, no exceptions. Let's keep it fair and square! 💪",0.9737098344693281
0.15151515151515152,0.0,0.0,0.030303030303030304,0.0,0.0,0.06060606060606061,0.030303030303030304,"Absolutely! It's crazy how long it took for them to act. 😤 Every vote should count, and this is a step in the right direction. Keeping things fair is a must! 🙌🇺🇸",0.32970656116056707
0.17857142857142858,0.0,0.0,0.03571428571428571,0.0,0.03571428571428571,0.07142857142857142,0.07142857142857142,That's wild! 🤯 It's crazy it even got to that point. Good thing they finally did something about it! 💪 Voter integrity is super important! 🗳️,0.0
0.10714285714285714,0.0,0.0,0.0,0.03571428571428571,0.0,0.10714285714285714,0.03571428571428571,"Absolutely! Keeping the voter rolls clean is key to fair elections. It's crazy it took a lawsuit to make it happen, but better late than never! 🙌🗳️",0.49652432969215493
0.19230769230769232,0.038461538461538464,0.0,0.0,0.0,0.0,0.07692307692307693,0.0,Absolutely! 🎉 It's crucial to make sure every vote counts and is legit. Keeping the system clean and fair is the way to go! 🗳️💯,0.9871668311944719
0.17391304347826086,0.0,0.0,0.0,0.043478260869565216,0.0,0.0,0.043478260869565216,Absolutely! It's crucial to keep things legit and ensure every vote counts. No room for any shady stuff in our democracy! 🗳️💪,-0.9775171065493646
0.23076923076923078,0.0,0.0,0.038461538461538464,0.07692307692307693,0.0,0.038461538461538464,0.038461538461538464,Absolutely! It's crazy it took a lawsuit to make it happen. Every vote should be legit. Let's keep our elections fair and square! 🙌🗳️,0.0
0.21739130434782608,0.08695652173913043,0.0,0.0,0.0,0.043478260869565216,0.0,0.0,Couldn't agree more! 👍 It's crucial to make sure every vote counts and is legit. Fair play all the way! 🗳️,0.0
0.1935483870967742,0.0,0.0,0.0,0.0,0.0,0.03225806451612903,0.06451612903225806,Why do they always make it sound like there's a massive problem with voter fraud? 🤔 Isn't this just another way to make voting harder for some people? 🤷‍♂️,-0.32992411745298583
0.21212121212121213,0.0,0.0,0.0,0.06060606060606061,0.0,0.12121212121212122,0.0,"Absolutely! It's crucial to keep the voter rolls accurate. Every legit vote matters, and this is a step in the right direction to ensure fairness. Let's keep our democracy solid! 🙌🗳️",0.9918175055789734
0.24,0.04,0.0,0.04,0.0,0.0,0.08,0.0,Exactly! It's about time they did something. We need to protect our elections and make sure everything's fair. No shortcuts in democracy! 🙌💪,0.9876543209876543
0.15384615384615385,0.07692307692307693,0.0,0.0,0.0,0.07692307692307693,0.0,0.0,Do you think this will actually make a difference in future elections? 🤔,0.0
0.16666666666666666,0.0,0.0,0.0,0.05555555555555555,0.0,0.1111111111111111,0.027777777777777776,"Absolutely! Keeping the voter rolls clean is crucial for fair elections. 🙏 It's crazy it took a lawsuit to make it happen. Better late than never, right? Let's keep things legit and transparent! 🗳️✨",0.5957108816521047
0.1875,0.0,0.0,0.0,0.03125,0.0,0.0625,0.0,Absolutely! It's crucial to have fair elections. This is a step in the right direction to ensure everything's above board. Let's keep the integrity of our votes intact! 🙌🗳️,0.984251968503937
0.125,0.0,0.0,0.0,0.08333333333333333,0.0,0.041666666666666664,0.041666666666666664,Absolutely! It's crazy it took a lawsuit to get this done. Gotta keep things fair and square! Every legit vote matters! 🗳️✨,0.0
0.25806451612903225,0.06451612903225806,0.0,0.06451612903225806,0.0,0.06451612903225806,0.06451612903225806,0.0,"Totally agree! It's all about keeping the system legit and fair. 👍 Every vote matters, and it's about time they did something. Let's hope it works out! 🤞",0.9847365829640571
0.1875,0.0625,0.0,0.0625,0.0,0.0625,0.0,0.0,Totally agree! It's about time they cleaned up those rolls. Fair elections are everything! 🗳️🔥,0.0
0.1724137931034483,0.034482758620689655,0.0,0.034482758620689655,0.034482758620689655,0.0,0.10344827586206896,0.0,Absolutely! 🙌 This is a big win for fair elections. It's all about making sure every vote counts and is legit! Let's keep the integrity strong! 🗳️💪,0.9904258831297458
0.2,0.0,0.0,0.0,0.03333333333333333,0.0,0.13333333333333333,0.0,"Absolutely! It's crucial to have a fair system. Every legit vote matters, and this is a step in the right direction. Let's keep things transparent and honest! 🙌🗳️",0.9925558312655087
0.18421052631578946,0.02631578947368421,0.0,0.0,0.02631578947368421,0.02631578947368421,0.02631578947368421,0.05263157894736842,"Nah, man, this is just another way to keep people from voting. They always come up with these excuses to mess with the voter rolls. It's like they don't want everyone to have a say. 🙄✋",-0.32916392363396973
0.18181818181818182,0.09090909090909091,0.0,0.0,0.0,0.09090909090909091,0.0,0.0,Do you think this will change anything for future elections? 🤔,0.0
0.1,0.05,0.0,0.0,0.0,0.05,0.0,0.0,Do you think this will actually make a difference in future elections? 🤔 Or is it just politics as usual?,0.0
0.16666666666666666,0.08333333333333333,0.0,0.0,0.0,0.0,0.125,0.041666666666666664,Absolutely! Keeping the voter rolls accurate is crucial for fair elections. Let's make sure every legit vote is heard loud and clear! 🙌🗳️,0.49701789264413526
0.1951219512195122,0.0,0.0,0.024390243902439025,0.024390243902439025,0.0,0.0,0.0,"Nah, that's not exactly what's happening. They agreed to check citizenship status, but they're not removing 50,000 people from the voter rolls. It's more about verifying info, not kicking people out. Let's keep it real! 🤔",0.0
0.13333333333333333,0.03333333333333333,0.0,0.03333333333333333,0.03333333333333333,0.0,0.1,0.0,Absolutely! Keeping the voter rolls clean is crucial for a fair election. It's all about making sure every vote is legit and counts. Let's keep democracy strong! 💪🗳️,0.9900990099009901
0.041666666666666664,0.0,0.0,0.0,0.0,0.041666666666666664,0.125,0.041666666666666664,"Nah, this sounds like just another rumor. People love to spread stuff without checking facts. 🤷‍♂️ Let's not jump to conclusions too fast.",0.49701789264413526
0.125,0.0,0.0,0.0,0.0,0.0,0.125,0.0,Absolutely! It's crucial to ensure our elections are fair and accurate. Removing noncitizens is a step in the right direction for transparency! 🗳️✨,0.9920634920634921
0.14814814814814814,0.0,0.0,0.037037037037037035,0.07407407407407407,0.0,0.037037037037037035,0.037037037037037035,Absolutely! It's crazy it took a lawsuit to get this done. Every vote should count and be legit. Let's keep it fair and square! 🙌🇺🇸,0.0
0.12903225806451613,0.0,0.0,0.03225806451612903,0.03225806451612903,0.0,0.0,0.06451612903225806,Absolutely! 🙌 It's crazy that it took a lawsuit to make this happen. Every vote should count and be legit. No room for any shady stuff in our elections! 🗳️🔥,-0.9847365829640571
0.25925925925925924,0.037037037037037035,0.0,0.0,0.07407407407407407,0.0,0.07407407407407407,0.0,Absolutely! It's crucial to have a fair voting system. Gotta keep things legit to make sure every vote matters. Let's keep democracy thriving! 🙌🗳️,0.986679822397632
0.12121212121212122,0.0,0.0,0.030303030303030304,0.0,0.0,0.030303030303030304,0.12121212121212122,Seriously? This whole thing is just a mess. 🙄 It's like they're making up problems that don't even exist. How about focusing on real issues instead of this nonsense? 🤦‍♂️,-0.5960659646334194
0.09090909090909091,0.0,0.0,0.0,0.0,0.0,0.0,0.0,"Nah, that's not what's happening. They ain't removing 50,000 noncitizens. Just checking stuff with Homeland Security. Chill out! 😅",0.0
0.10869565217391304,0.0,0.021739130434782608,0.043478260869565216,0.021739130434782608,0.0,0.10869565217391304,0.0,"@user_2 Yeah right, like they really care about fairness. It's all just politics as usual. 🙄 They’re just trying to stir the pot and make it look like a big deal when it’s not. Keep dreaming about that ""thriving democracy""! 😂",0.9908838684106223
0.10344827586206896,0.034482758620689655,0.0,0.034482758620689655,0.0,0.0,0.06896551724137931,0.034482758620689655,"Wow, that's crazy! 🤯 Can't believe it took a lawsuit to sort this out. Voter rolls should be clean and accurate. Good thing someone stepped up! 💪🇺🇸",0.3301419610432486
0.125,0.0625,0.0625,0.0,0.0,0.125,0.0,0.0,Do you think this will actually make a difference in how we see election security? 🤔,0.0
0.16666666666666666,0.0,0.0,0.03333333333333333,0.03333333333333333,0.0,0.1,0.03333333333333333,"Wow, that's a lot of confusion! 😅 Seems like there's always some drama around elections. But hey, as long as they keep things fair and square, right? ✌️",0.4962779156327544
0.2,0.05714285714285714,0.0,0.02857142857142857,0.02857142857142857,0.02857142857142857,0.02857142857142857,0.0,Couldn't agree more! 🎉 It's about time we cleaned up those voter rolls. Gotta make sure every vote is legit and counts for real. Let's keep fighting for fair elections! 🗳️✨,0.966183574879227
0.13333333333333333,0.06666666666666667,0.0,0.03333333333333333,0.0,0.03333333333333333,0.06666666666666667,0.0,Couldn't agree more! Keeping things fair and square is the way to go. It's all about making sure every real vote counts. Cheers to a stronger democracy! 💪🗳️,0.9852216748768473
0.07142857142857142,0.0,0.0,0.0,0.0,0.0,0.0,0.03571428571428571,"Nah, that ain't it. The whole thing got twisted. They ain't removing 50,000 noncitizens. Just checking citizenship status with Homeland Security. No mass removal happening! 🤔",-0.9727626459143969
0.25,0.0,0.0,0.0,0.0,0.0,0.0,0.0,"Wait, so did they actually remove 50,000 people or nah? 🤔 What's the real deal with this lawsuit thing?",0.0
0.1,0.03333333333333333,0.0,0.0,0.0,0.0,0.0,0.0,"Nah, that's not really what happened. They just agreed to check with Homeland Security to verify citizenship, not kick out 50,000 people. Let's not jump to conclusions. 🤔",0.0
0.09090909090909091,0.0,0.0,0.0,0.0,0.0,0.030303030303030304,0.06060606060606061,"Nah, I don't buy it. Sounds like a bunch of noise to me. 🤔 People always trying to stir the pot with these stories. Let's focus on real issues, not distractions! ",-0.32970656116056707
0.1,0.05,0.0,0.0,0.0,0.05,0.0,0.0,"Do you think this will actually make a difference in future elections, or is it just a temporary fix? 🤔",0.0
0.20689655172413793,0.034482758620689655,0.0,0.034482758620689655,0.0,0.06896551724137931,0.034482758620689655,0.034482758620689655,"Totally agree! It's wild that it even got to that point. We need to protect the integrity of our elections. Every real vote should count, no exceptions! 🙌🔥",0.0
0.16666666666666666,0.041666666666666664,0.0,0.041666666666666664,0.0,0.0,0.041666666666666664,0.0,Absolutely! 🙌 Keeping it fair and square is what democracy's all about. Gotta make sure the system's not being played! 💪🗳️,0.9765625
0.2777777777777778,0.05555555555555555,0.0,0.0,0.05555555555555555,0.05555555555555555,0.05555555555555555,0.0,"Totally agree! 👏 Gotta keep the integrity in the voting system, right? Every legit vote matters! 🙌🇺🇸",0.9823182711198428
0.2857142857142857,0.047619047619047616,0.0,0.047619047619047616,0.0,0.047619047619047616,0.14285714285714285,0.0,Totally agree! Keeping the system fair is super important. Everyone's vote should count for real. Democracy all the way! 🙌💪,0.9930486593843099
0.07142857142857142,0.07142857142857142,0.0,0.0,0.0,0.07142857142857142,0.07142857142857142,0.0,Do you really think this will make a big difference in election fairness? 🤔,0.9861932938856016
0.15384615384615385,0.0,0.0,0.038461538461538464,0.0,0.0,0.0,0.0,"Nah, there's no proof of thousands being removed. It's just about verifying citizenship, not kicking people out. Let's not jump to conclusions! 🤔",0.0
0.3225806451612903,0.0,0.06451612903225806,0.03225806451612903,0.0,0.06451612903225806,0.0967741935483871,0.0,"Absolutely! Keeping the system legit is super important. 🙌 Every single vote should count, and it's great to see some action being taken. Let's see some real change! 🤞",0.9897723523589574
0.043478260869565216,0.043478260869565216,0.0,0.0,0.0,0.0,0.08695652173913043,0.0,Not sure I buy that. 🤔 Seems like a lot of drama over nothing. 50k noncitizens? Sounds like a stretch to me. 🤷‍♂️,0.9886307464162135
0.0625,0.0,0.0,0.0,0.0625,0.0,0.0625,0.0625,Totally! Gotta keep it fair and square. No room for shady stuff in elections! 🙌,0.0
0.03125,0.0,0.0,0.03125,0.0,0.03125,0.03125,0.0,"Wait, so they needed a lawsuit to do something that should've been done already? 🤔 Why is this even a debate? Shouldn't voter rolls be accurate from the start? 🤷‍♂️",0.9689922480620154
0.08108108108108109,0.02702702702702703,0.0,0.0,0.0,0.02702702702702703,0.02702702702702703,0.0,"But seriously, do you really think this is gonna fix anything? 🤔 Seems like just another way to complicate things and make it harder for legit voters. What's next, more hoops to jump through? 🤷‍♂️",0.9643201542912246
0.045454545454545456,0.045454545454545456,0.0,0.0,0.0,0.045454545454545456,0.09090909090909091,0.045454545454545456,Isn't it wild how stuff like this even happens? 🤔 Do you think this will make elections more fair now? 🤷‍♂️,0.3309066843150232
0.07692307692307693,0.0,0.0,0.0,0.02564102564102564,0.0,0.0,0.10256410256410256,"Nah, this is just a bunch of political drama! 🙄 They always twist the facts to fit their agenda. It's all smoke and mirrors. Voter integrity is just an excuse for them to mess with the system. 🤔",-0.9903441445902451
0.14285714285714285,0.07142857142857142,0.0,0.0,0.0,0.07142857142857142,0.0,0.0,Do you think this will actually make a difference in the election process? 🤔,0.0
0.14814814814814814,0.037037037037037035,0.0,0.037037037037037035,0.037037037037037035,0.037037037037037035,0.1111111111111111,0.0,Totally agree! Keeping the voter rolls clean is a must for a fair election. Every legit vote should count. Let's keep it real and fair! 💪🗳️,0.9910802775024777
0.06451612903225806,0.0,0.0,0.0,0.03225806451612903,0.0,0.0967741935483871,0.0,"I get what you're saying, but there's no solid proof that 50,000 noncitizens were on those rolls. 🤔 Always good to fact-check stuff like this before jumping to conclusions!",0.9897723523589574
0.041666666666666664,0.08333333333333333,0.0,0.041666666666666664,0.041666666666666664,0.041666666666666664,0.0,0.08333333333333333,Isn't it kinda weird how these things always seem to get twisted? 🤔 What do y'all think about verifying citizenship for voting? 🤷‍♂️,-0.9881422924901185
0.1111111111111111,0.0,0.0,0.0,0.0,0.0,0.037037037037037035,0.1111111111111111,Why are we even trusting these officials to handle this mess? 🤔 Isn't it just another way to mess with the system and create confusion? 🤷‍♂️,-0.4966476285075739
0.26666666666666666,0.06666666666666667,0.0,0.03333333333333333,0.0,0.03333333333333333,0.06666666666666667,0.0,"Totally agree! It's about time they cleaned it up. We need to trust the system and make sure it's fair for everyone. Every vote matters, no shortcuts! 🙌",0.9852216748768473
0.1875,0.0625,0.0,0.0,0.0,0.0625,0.0,0.0,Do you think this whole lawsuit thing will actually change anything in the voting system? 🤔,0.0
0.12,0.0,0.04,0.0,0.04,0.04,0.04,0.04,"Wow, sounds like a mess! 🤯 People really need to get their facts straight before jumping to conclusions. Let's see how this one unfolds...",0.0
0.07142857142857142,0.07142857142857142,0.0,0.0,0.0,0.07142857142857142,0.0,0.0,Do you think this will really make a difference in the election results? 🤔,0.0
0.14285714285714285,0.0,0.0,0.07142857142857142,0.03571428571428571,0.0,0.03571428571428571,0.03571428571428571,"Wow, 50,000 noncitizens on voter rolls? That's insane! 😳 Glad they finally did something about it. It's about time to keep elections fair and square! 💪🗳️",0.0
0.08333333333333333,0.0,0.0,0.041666666666666664,0.0,0.0,0.0,0.0,"That’s not what happened at all. The lawsuit was about verifying citizenship, not kicking out 50k people. Chill with the drama! 😅",0.0
0.16666666666666666,0.041666666666666664,0.0,0.0,0.0,0.0,0.0,0.041666666666666664,"Wow, that's a crazy number! 😮 Politics always seem to have some drama going on. Wonder how this will affect future elections? 🤔",-0.9765625
0.06451612903225806,0.0,0.0,0.03225806451612903,0.0,0.03225806451612903,0.06451612903225806,0.0,"Whoa, sounds like a big mix-up! 😅 Seems like the real deal is about verifying citizenship, not kicking people out. Always gotta read between the lines with these reports! 📜🤔",0.9847365829640571
0.15789473684210525,0.0,0.0,0.05263157894736842,0.02631578947368421,0.0,0.02631578947368421,0.05263157894736842,Fair voting system? More like a way to keep people out! 🙄 It's just another excuse to mess with the voter rolls and make things harder for everyone. Democracy shouldn't be about putting up barriers! 🛑,-0.32916392363396973
0.20689655172413793,0.034482758620689655,0.0,0.0,0.0,0.0,0.034482758620689655,0.034482758620689655,"Nah, that's not exactly what's happening. They ain't removing 50,000 noncitizens. Just checking to make sure the info's right. No need to freak out! 😅",0.0
0.09523809523809523,0.0,0.0,0.047619047619047616,0.047619047619047616,0.0,0.047619047619047616,0.09523809523809523,"Wow, that's kinda wild! 😳 If true, it sounds like a mess. Politics can be such a circus sometimes! 🎪",-0.3310162197947699
0.041666666666666664,0.041666666666666664,0.0,0.041666666666666664,0.041666666666666664,0.041666666666666664,0.08333333333333333,0.041666666666666664,Isn't it wild how stuff like this even happens? 🤔 How do you think they should handle these situations to keep it fair?,0.33068783068783064
0.17142857142857143,0.0,0.02857142857142857,0.0,0.02857142857142857,0.02857142857142857,0.02857142857142857,0.05714285714285714,What's the point of verifying if they aren't gonna remove anyone? 🤔 Sounds like a waste of time and resources! Why even bother if it's not gonna change anything? 🙄,-0.32948929159802304
0.05,0.05,0.0,0.1,0.05,0.05,0.0,0.1,Isn't it crazy how things get twisted sometimes? 🤔 What do you think about the whole citizenship verification thing?,-0.9900990099009901
0.05405405405405406,0.0,0.02702702702702703,0.0,0.02702702702702703,0.0,0.05405405405405406,0.05405405405405406,"Man, this sounds like a cover-up! 🤔 Bet they're hiding something. Why even bother with this whole verification thing if it ain't a big deal? Feels like they're just trying to distract us. 😒",0.0
0.1724137931034483,0.034482758620689655,0.0,0.0,0.06896551724137931,0.0,0.06896551724137931,0.034482758620689655,"Wow, that's crazy! 🤯 Can't believe it took a lawsuit to get that sorted out. It's important to keep the voter rolls accurate. Good move! 👍",0.3301419610432486
0.029411764705882353,0.0,0.0,0.058823529411764705,0.0,0.0,0.058823529411764705,0.0,Sounds fishy to me! 🤨 Why do they need a lawsuit for something they should be doing anyway? Just seems like they're trying to cover something up. Can't trust these officials! 🤷‍♂️,0.983284169124877
0.16,0.0,0.0,0.0,0.0,0.0,0.08,0.08,Why is this even a thing? 🤔 Aren't there more important issues to deal with? Feels like a waste of time and energy. 🤷‍♂️,0.0
0.2,0.0,0.0,0.0,0.0,0.0,0.0,0.0,"Wait, so did they actually remove 50,000 noncitizens or not? 🤔 What's the real deal with this lawsuit thing?",0.0
0.07692307692307693,0.0,0.038461538461538464,0.0,0.0,0.0,0.11538461538461539,0.0,"Wait, are we really trusting these officials to do it right? 🤔 How do we know they're not just sweeping it under the rug? 🧹",0.991407799074686
0.2727272727272727,0.045454545454545456,0.045454545454545456,0.045454545454545456,0.045454545454545456,0.0,0.045454545454545456,0.0,"For real! It's all about making sure the right people are voting. Gotta keep the system legit, you know? 😎🔍",0.9784735812133072
0.10344827586206896,0.0,0.0,0.034482758620689655,0.0,0.0,0.06896551724137931,0.06896551724137931,"Wow, this whole thing sounds like a mess! 😅 Seems like there's a lot of confusion out there. Maybe people should double-check the facts before jumping to conclusions!",0.0
0.18181818181818182,0.030303030303030304,0.0,0.030303030303030304,0.030303030303030304,0.0,0.06060606060606061,0.030303030303030304,"Wow, that's wild! 😲 Can't believe they needed a lawsuit for that. It's about time they cleaned up those voter rolls. Gotta keep it fair for everyone, right? 🇺🇸",0.32970656116056707
0.09090909090909091,0.09090909090909091,0.0,0.09090909090909091,0.0,0.09090909090909091,0.0,0.0,Really? 🤔 What do you guys think about this lawsuit thing?,0.0
0.09433962264150944,0.0,0.0,0.0,0.018867924528301886,0.018867924528301886,0.03773584905660377,0.03773584905660377,"Wow, here we go again with the drama! 🤦‍♂️ I mean, come on, why does it always have to be a lawsuit to get things done? Seriously, just do your job right the first time, Arizona! This is just a mess and makes it hard to trust the system. Get it together! 😤",0.0
0.13333333333333333,0.06666666666666667,0.0,0.0,0.03333333333333333,0.0,0.06666666666666667,0.03333333333333333,"That's crazy! 🤯 Can't believe it took a lawsuit to get that sorted out. Voter integrity is super important, gotta make sure only citizens are voting! 🇺🇸",0.33003300330033003
0.17391304347826086,0.0,0.0,0.08695652173913043,0.0,0.043478260869565216,0.0,0.08695652173913043,"Nah, I doubt it. These things usually just make a lot of noise but don't really change much in the end. 🤷‍♂️",-0.9886307464162135
0.15555555555555556,0.0,0.022222222222222223,0.044444444444444446,0.022222222222222223,0.0,0.044444444444444446,0.022222222222222223,"Honestly, probably not much will change. It's just politics as usual, ya know? 🤷‍♂️ They love making noise but at the end of the day, things tend to stay the same. But hey, at least they're trying to keep things legit, right? 🗳️",0.3284072249589491
0.21052631578947367,0.05263157894736842,0.0,0.05263157894736842,0.0,0.05263157894736842,0.10526315789473684,0.0,"Crazy, right? 😮 Maybe they need better checks in place or something? What do you all think would help?",0.9905894006934126
0.03225806451612903,0.03225806451612903,0.0,0.03225806451612903,0.0,0.0,0.0967741935483871,0.0,"Did Arizona really have to go through a lawsuit just to verify citizenship on voter rolls? 🤔 Seems like a lot of drama for something that should be straightforward, right? 🗳️",0.9897723523589574
0.17142857142857143,0.02857142857142857,0.0,0.0,0.0,0.02857142857142857,0.02857142857142857,0.02857142857142857,"@user_2 Totally agree with you! It's all a game to them, just trying to make noise. 😂 They act like they're heroes of democracy, but it's just the same old tricks. 🙄",0.0
0.05555555555555555,0.05555555555555555,0.0,0.0,0.0,0.1111111111111111,0.0,0.05555555555555555,Why do you think it took a lawsuit for Arizona Democrats to address the voter roll issue? 🤔,-0.9823182711198428
0.0,0.0,0.0,0.0,0.0,0.0,0.045454545454545456,0.0,Sounds like a lot of drama over nothing then! 🤷‍♂️ People be jumping to conclusions before getting the full story. Classic! 😂,0.9784735812133072
0.13793103448275862,0.034482758620689655,0.034482758620689655,0.0,0.06896551724137931,0.034482758620689655,0.034482758620689655,0.0,"Whoa, hold up! 🤔 Not sure that's the whole story. Stuff like this can get blown outta proportion. Let's see some facts before jumping to conclusions! 🧐",0.9718172983479105
