bias words,assertatives,factives,hedges,implicatives,report verbs,positive opinion words,negative opinion words,message,polarity
0.17391304347826086,0.0,0.0,0.0,0.043478260869565216,0.0,0.043478260869565216,0.043478260869565216,"Wow, that's a lot of people! 😮 It's crazy how things like this happen. Wonder how it all went down... 🤔",0.0
0.06060606060606061,0.030303030303030304,0.0,0.030303030303030304,0.0,0.030303030303030304,0.030303030303030304,0.030303030303030304,"Isn't it crazy how stuff like this even happens? 🤔 Like, why does it take a lawsuit to sort things out? What do you guys think about the whole voting system? 🗳️",0.0
0.19047619047619047,0.0,0.0,0.09523809523809523,0.047619047619047616,0.0,0.047619047619047616,0.0,Finally! They should've done this ages ago. It's about time someone took action to keep the elections fair! 🤔💪,0.9794319294809011
0.2647058823529412,0.029411764705882353,0.029411764705882353,0.0,0.058823529411764705,0.029411764705882353,0.08823529411764706,0.058823529411764705,"Wow, it's crazy how things get twisted, right? 🤔 Anyway, it's good to see that they're taking steps to make sure everything's legit. Gotta keep the system clean! 🗳️💪",0.19864918553833932
0.1,0.0,0.0,0.05,0.0,0.0,0.05,0.05,"That's wild! 😮 Always some drama with these voter rolls, right? Wonder how often this kinda stuff happens 🤔",0.0
0.13636363636363635,0.0,0.0,0.0,0.0,0.0,0.0,0.0,"Wow, that's a big number! 😮 Wonder how this will affect future elections. Politics always keeps us on our toes! 🗳️",0.0
0.20588235294117646,0.029411764705882353,0.0,0.029411764705882353,0.029411764705882353,0.0,0.08823529411764706,0.029411764705882353,"Wow, that's wild! 🤯 Can't believe they needed a lawsuit to do the right thing! Voter rolls should be accurate and fair. Good thing someone stepped up to make it happen! 🇺🇸",0.49578582052553305
0.14705882352941177,0.0,0.0,0.0,0.029411764705882353,0.0,0.029411764705882353,0.029411764705882353,That's just another way for them to mess things up! 😤 Why can't they just keep things straight from the start? It's like they're always trying to hide something. 🤔,0.0
0.25,0.0,0.0,0.0,0.0,0.0,0.0,0.0,"Wait, so did they actually remove 50,000 people or not? 🤔 What's the real deal with this lawsuit thing?",0.0
0.16326530612244897,0.0,0.0,0.04081632653061224,0.04081632653061224,0.0,0.061224489795918366,0.02040816326530612,"Finally! It's about time they cleaned up those voter rolls! 🎉 It's crazy that it took a lawsuit to make it happen. Voter integrity should be a top priority, and this is a step in the right direction. Let's keep our elections fair and square! 💪🗳️",0.4939491232403063
0.14285714285714285,0.047619047619047616,0.047619047619047616,0.047619047619047616,0.0,0.09523809523809523,0.047619047619047616,0.047619047619047616,"Sounds like a wild claim! 🤔 Always gotta double-check these things. Not everything you read is true, ya know? 📚",0.0
0.13793103448275862,0.034482758620689655,0.0,0.0,0.034482758620689655,0.0,0.06896551724137931,0.0,"Wow, can't believe they needed a lawsuit for that! 🤯 At least they're finally taking action. It's crucial to keep our elections secure and fair. 🇺🇸",0.9857072449482503
0.04,0.0,0.0,0.0,0.04,0.0,0.04,0.08,"Wow, sounds like a big mix-up! 🤔 It's crazy how things get twisted. Always gotta double-check the facts before jumping to conclusions! 📜🧐",-0.3305785123966942
0.09375,0.0,0.0,0.03125,0.0,0.03125,0.03125,0.0,"Wow, that's a lot of people! 🤯 I wonder how they ended up on the voter rolls in the first place. Politics always seems to have some drama going on! 🤔",0.9689922480620154
0.21875,0.0625,0.0,0.0,0.03125,0.0,0.0625,0.03125,"Wow, that's wild! 😲 Can't believe it took a lawsuit to make that happen. Voter integrity is super important! 🇺🇸 Gotta make sure every vote counts and is legit.",0.32981530343007914
0.09090909090909091,0.045454545454545456,0.0,0.045454545454545456,0.0,0.09090909090909091,0.13636363636363635,0.045454545454545456,Sounds like a wild claim! 🤔 People always gotta fact-check stuff like this. Can't trust everything you hear online! 📱,0.4972650422675285
0.2,0.022222222222222223,0.0,0.022222222222222223,0.044444444444444446,0.0,0.06666666666666667,0.0,"Wow, sounds like Arizona is finally getting things right! 😏 It's about time someone stepped up to make sure only citizens are voting. Who knew we'd need a lawsuit to make it happen? 🤔 Let's keep our elections fair and square! 🇺🇸",0.9852216748768473
0.0,0.047619047619047616,0.0,0.047619047619047616,0.0,0.047619047619047616,0.0,0.0,"Wait, did they really have to go to court for that? 🤔 What do you guys think about this whole situation?",0.0
0.18,0.02,0.0,0.06,0.04,0.0,0.06,0.02,"Wow, that's crazy! 😱 It's about time they cleaned up those voter rolls. Can't believe it needed a lawsuit to make it happen! 🤦‍♂️ Voter integrity is super important, and everyone should be on the same page about it. Let's keep it fair for everyone! 🗳️💪",0.4938271604938271
0.2413793103448276,0.0,0.0,0.034482758620689655,0.034482758620689655,0.0,0.10344827586206896,0.034482758620689655,"Wow, that's crazy! 🤯 It's about time they cleaned up those voter rolls. It's important to keep elections fair and transparent. Glad someone took action! 💪",0.4964010920824026
0.13043478260869565,0.0,0.0,0.043478260869565216,0.0,0.0,0.0,0.0,"What's the real deal with this voter roll thing in Arizona? 🤔 Is it really about 50,000 noncitizens or just a mix-up?",0.0
0.15625,0.0625,0.0,0.03125,0.0,0.0,0.0625,0.03125,"Wow, that's crazy! 😲 It's about time they cleaned up those voter rolls. Can't believe they needed a lawsuit for something so obvious! Voter integrity is super important. 🗳️",0.32981530343007914
0.14285714285714285,0.0,0.03571428571428571,0.0,0.03571428571428571,0.0,0.14285714285714285,0.07142857142857142,"Yeah, it's wild how stuff gets blown out of proportion! 😂 But def important to keep it all legit and fair. Better safe than sorry, right? 🗳️✨",0.33178500331785005
0.043478260869565216,0.0,0.0,0.0,0.0,0.0,0.0,0.0,"Wait, so why did Arizona even have noncitizens on voter rolls in the first place? 🤔 Shouldn't they have checked citizenship before?",0.0
0.07692307692307693,0.05128205128205128,0.0,0.0,0.05128205128205128,0.02564102564102564,0.05128205128205128,0.02564102564102564,"Isn't it crazy how they had to go through a lawsuit just to get this done? 🤔 Why can't they just verify citizenship from the start? Seems like common sense, right? 🤷‍♂️ What do you guys think?",0.32905561039815723
0.14285714285714285,0.0,0.0,0.0,0.0,0.0,0.0,0.0,"Wow, that's a huge number! 😮 Wonder how this will affect future elections. Politics is always full of surprises! 🤔",0.0
0.25806451612903225,0.03225806451612903,0.0,0.03225806451612903,0.06451612903225806,0.0,0.03225806451612903,0.0,"Finally, some action! 🙌 It's about time they cleaned up those voter rolls. Can't believe it needed a lawsuit to make it happen. Let's keep things fair! 💪🗳️",0.9699321047526673
0.09090909090909091,0.045454545454545456,0.0,0.0,0.045454545454545456,0.0,0.13636363636363635,0.045454545454545456,Why is it so hard for Arizona Democrats to just verify citizenship properly? 🤔 Seems like a basic thing to get right!,0.4972650422675285
0.12195121951219512,0.0,0.024390243902439025,0.024390243902439025,0.024390243902439025,0.0,0.0975609756097561,0.0,"Wow, just wow! 🤦‍♂️ Arizona Dems really need a lawsuit to do the right thing? Why can't they just be honest from the start? It's like they don't care about the integrity of our elections! 🙄 #VoterFraud #DoBetter",0.989853996535511
0.08571428571428572,0.0,0.0,0.05714285714285714,0.02857142857142857,0.0,0.05714285714285714,0.02857142857142857,"Wow, this is wild! 😲 Arizona really needed that push to clean things up. It's about time they got serious about verifying citizenship for voting. Gotta keep the elections fair and square! 🇺🇸",0.32948929159802304
0.14285714285714285,0.03571428571428571,0.0,0.0,0.03571428571428571,0.0,0.07142857142857142,0.03571428571428571,"Wow, that's wild! 😳 Can't believe it took a lawsuit to get that sorted. Should've been handled way sooner. Voter integrity is super important! 🗳️",0.33025099075297226
0.09090909090909091,0.0,0.0,0.045454545454545456,0.0,0.0,0.0,0.0,What's the deal with the lawsuit in Arizona about removing noncitizens from voter rolls? 🤔 Anyone got more deets on this?,0.0
0.10810810810810811,0.02702702702702703,0.0,0.05405405405405406,0.02702702702702703,0.0,0.02702702702702703,0.05405405405405406,"Wow, that's wild! 😲 Can't believe it took a lawsuit to get things moving! It's about time they cleaned up those voter rolls. Democracy should be fair and square, no room for errors! 💪🗳️",-0.3292723081988805
0.0,0.05263157894736842,0.0,0.05263157894736842,0.0,0.05263157894736842,0.0,0.0,"Wait, so they actually needed a lawsuit for that? 🤔 What do you guys think about this whole situation?",0.0
0.045454545454545456,0.0,0.0,0.0,0.045454545454545456,0.0,0.0,0.0,"50,000 noncitizens on voter rolls? 🤔 How did that even happen? Shouldn't they have been checking this stuff all along? 😤",0.0
0.14814814814814814,0.0,0.0,0.0,0.0,0.0,0.037037037037037035,0.0,"Is it just me, or do these Arizona officials need a reality check? 🤔 Why do they always need a lawsuit to do the right thing? 👀",0.9737098344693281
0.125,0.03125,0.03125,0.0,0.0,0.0,0.09375,0.03125,"Crazy how they needed a lawsuit to even start verifying voter rolls! 🤔 Just shows how important it is to make sure only citizens are voting. Better safe than sorry, right? 🇺🇸",0.49603174603174605
0.1111111111111111,0.027777777777777776,0.0,0.027777777777777776,0.0,0.027777777777777776,0.0,0.027777777777777776,"That Fox News report got it twisted! 😅 No one's removing 50k noncitizens from voter rolls in Arizona. It's just about verifying citizenship with Homeland Security. No mass removal happening. Chill out, people! 🙃",-0.9652509652509652
0.08,0.0,0.0,0.0,0.08,0.0,0.04,0.12,"Wow, sounds like a big mess! 🤔 It's crazy how news can get twisted, huh? Always gotta fact-check before jumping to conclusions. 📚",-0.49689440993788814
0.08108108108108109,0.02702702702702703,0.0,0.02702702702702703,0.05405405405405406,0.02702702702702703,0.05405405405405406,0.05405405405405406,"Wow, that's insane! 😱 Can't believe they needed a lawsuit to do something so basic. Just goes to show how messed up things can get. Voter rolls should be clean and fair for everyone! 🗳️",0.0
0.14814814814814814,0.07407407407407407,0.0,0.037037037037037035,0.0,0.0,0.0,0.037037037037037035,"Wow, that's crazy! 😱 Can't believe they needed a lawsuit for something so obvious. It's about time they cleaned up those voter rolls! 🗳️💥",-0.9737098344693281
0.125,0.0,0.0625,0.0625,0.0625,0.0,0.0,0.0,Why'd it take a lawsuit to get that done? 🤔 Anyone know more about it?,0.0
0.14,0.02,0.0,0.04,0.04,0.0,0.04,0.04,"Wow, that's crazy! 🙄 Can't believe it took a lawsuit to get that done. Seriously, how hard is it to keep voter rolls clean? 🤔 This stuff shouldn't even be happening in the first place. It's about time someone stepped up and made it right! 💪",0.0
0.20689655172413793,0.0,0.0,0.034482758620689655,0.06896551724137931,0.0,0.0,0.034482758620689655,Finally! About time someone did something about it! 🚨 It's crazy that it needed a lawsuit to make it happen. Let's keep our voter rolls legit! 💪🇺🇸,-0.9718172983479105
0.17391304347826086,0.043478260869565216,0.0,0.043478260869565216,0.0,0.0,0.043478260869565216,0.0,"Finally, some action! It's about time they cleaned up those voter rolls. Gotta make sure elections are fair and square! 🙌🇺🇸",0.9775171065493646
0.08571428571428572,0.0,0.0,0.02857142857142857,0.0,0.0,0.05714285714285714,0.11428571428571428,"What a joke! 😒 They always try to twist things around. This whole story sounds like a big mess. No way they needed a lawsuit for that. Just another drama to distract us, right? 🙄",-0.33140016570008285
0.09090909090909091,0.0,0.0,0.0,0.045454545454545456,0.0,0.0,0.0,"Wait, 50k noncitizens on voter rolls? 🤔 How did that even happen in the first place? Anyone got more deets on this?",0.0
0.15384615384615385,0.038461538461538464,0.0,0.038461538461538464,0.0,0.038461538461538464,0.0,0.0,"Lol, that's not what happened! 🤦‍♂️ It's all about verifying citizenship, not removing people from voter rolls. Don't believe everything you read! 📚🚫",0.0
0.043478260869565216,0.0,0.0,0.0,0.0,0.0,0.0,0.0,"Wait, so did Arizona really remove 50,000 noncitizens, or is this just another mix-up? 🤔 Anyone got the real tea on this? 🍵",0.0
0.2,0.02857142857142857,0.0,0.02857142857142857,0.02857142857142857,0.02857142857142857,0.0,0.08571428571428572,"Wow, that's crazy! 🤯 Can't believe it took a lawsuit to make that happen. Voter integrity should be a priority. It's wild that this was even an issue in the first place! ",-0.9884678747940692
0.14705882352941177,0.029411764705882353,0.0,0.029411764705882353,0.058823529411764705,0.0,0.0,0.029411764705882353,"Wow, that's crazy! 😲 I can't believe it took a lawsuit to get that sorted out. It's about time they cleaned up those voter rolls. Gotta keep things legit! 🗳️",-0.9671179883945841
0.16129032258064516,0.03225806451612903,0.0,0.03225806451612903,0.06451612903225806,0.0,0.06451612903225806,0.0,"Wow, can't believe it took a lawsuit to get things moving! 🤦‍♂️ It's about time they check those rolls properly. Let's keep our elections fair and square! 🇺🇸",0.9847365829640571
0.19047619047619047,0.023809523809523808,0.023809523809523808,0.023809523809523808,0.023809523809523808,0.047619047619047616,0.09523809523809523,0.023809523809523808,"Wow, that's crazy! 🤯 Finally, some action to keep things fair. Voter integrity is super important, and it's good to see steps being taken to ensure only eligible voters are on the rolls. Better late than never, I guess! 🙌",0.5950019833399445
0.15384615384615385,0.038461538461538464,0.0,0.038461538461538464,0.038461538461538464,0.0,0.038461538461538464,0.038461538461538464,That's wild! 😮 Can't believe it took a lawsuit to get them to do the right thing. Voter integrity should be a no-brainer! 🗳️,0.0
0.07407407407407407,0.037037037037037035,0.0,0.07407407407407407,0.0,0.037037037037037035,0.0,0.1111111111111111,Isn't it wild how some people twist things around? 🤔 Why do you think there's so much confusion about the voter rolls in Arizona? 🤷‍♂️,-0.9910802775024777
0.15384615384615385,0.02564102564102564,0.0,0.02564102564102564,0.02564102564102564,0.0,0.05128205128205128,0.05128205128205128,"Wow, that's wild! 😲 It's about time they cleaned up those voter rolls. We gotta make sure elections are fair and square, right? 🗳️ It's crazy that it even needed a lawsuit to get done!",0.0
0.17647058823529413,0.029411764705882353,0.0,0.029411764705882353,0.029411764705882353,0.0,0.029411764705882353,0.029411764705882353,That's wild! 🤯 It's about time someone stepped in to clean up the voter rolls. Can't believe it took a lawsuit to make it happen. Democracy needs to be protected! 🇺🇸💪,0.0
0.07692307692307693,0.0,0.019230769230769232,0.019230769230769232,0.0,0.019230769230769232,0.057692307692307696,0.038461538461538464,"Wow, this is wild! 🤯 It seems like there's a lot of confusion going on. People are getting all worked up over this, but it looks like there wasn't actually a plan to kick out 50,000 noncitizens. Just a mix-up with the facts! Let's see how this unfolds... 🍿",0.19794140934283452
0.16666666666666666,0.020833333333333332,0.0,0.041666666666666664,0.041666666666666664,0.020833333333333332,0.041666666666666664,0.0,Finally! Someone had to step in and do something about it. It's about time they cleaned up those voter rolls. Can't believe it took a lawsuit to make it happen 🙄. Just goes to show how important it is to keep things fair and square! 🗳️💪,0.9765625
0.09090909090909091,0.0,0.0,0.0,0.0,0.0,0.0,0.045454545454545456,"Wow, that's a lot of people! 😲 Politics is always such a mess. Wonder how this will all play out. 🤔",-0.9784735812133072
0.1875,0.03125,0.0,0.03125,0.03125,0.0,0.03125,0.0,"Finally, some action! 👏 It's about time they cleaned up those voter rolls. Can't believe they needed a lawsuit to do it. Let's keep elections fair and square! 🗳️",0.9689922480620154
0.22580645161290322,0.03225806451612903,0.0,0.03225806451612903,0.03225806451612903,0.0,0.0,0.03225806451612903,"Wow, that's crazy! 🤯 Finally, someone took action! It's about time they cleaned up those voter rolls. Can't believe it took a lawsuit to make it happen. 😤",-0.9699321047526673
0.13636363636363635,0.045454545454545456,0.0,0.022727272727272728,0.022727272727272728,0.0,0.06818181818181818,0.022727272727272728,"Wow, just wow! 🤯 Can't believe they needed a lawsuit for something so basic. Like, come on, this is about keeping elections fair and square! 👀 It's not that hard to verify citizenship, right? Let's keep the voter rolls legit! 🇺🇸",0.49455984174085055
0.16666666666666666,0.06666666666666667,0.0,0.06666666666666667,0.03333333333333333,0.03333333333333333,0.0,0.0,"Finally! It's about time they cleaned up those voter rolls. 🤦‍♂️ Can't believe it took a lawsuit to make it happen. Better late than never, I guess! 🙌",0.0
0.1111111111111111,0.0,0.0,0.0,0.027777777777777776,0.0,0.05555555555555555,0.027777777777777776,"Finally, some action being taken! 😤 It's crazy that it took a lawsuit to get this done. We need fair elections, and this is a step in the right direction. Keep it up, Arizona! 💪",0.32938076416337286
0.14285714285714285,0.0,0.0,0.0,0.047619047619047616,0.0,0.047619047619047616,0.047619047619047616,What's the deal with this lawsuit in Arizona? 🤔 Is it really that hard to keep the voter rolls clean?,0.0
0.07692307692307693,0.0,0.0,0.038461538461538464,0.038461538461538464,0.0,0.07692307692307693,0.11538461538461539,"Wow, this sounds like a mess 😅. It's crazy how things get twisted around. Seems like there's always something going on with elections! 🗳️",-0.19896538002387584
0.08333333333333333,0.0,0.0,0.0,0.0,0.0,0.0,0.0,What's up with that lawsuit in Arizona? 🤔 Anyone got the deets on why it took so long to fix the voter rolls?,0.0
0.06451612903225806,0.0,0.0,0.03225806451612903,0.0,0.0,0.0,0.03225806451612903,"That’s not really what happened, though. The lawsuit was about verifying citizenship, not kicking out 50,000 people from the voter rolls. People gotta chill with the drama 😅",-0.9699321047526673
0.15,0.025,0.0,0.05,0.025,0.0,0.0,0.025,"Wow, that's just wild! 😱 Can't believe they needed a lawsuit for something so basic. Like, come on, get your act together! Voter integrity should be a no-brainer. It's about time they cleaned up those rolls! 🗳️✌️",-0.9615384615384615
0.047619047619047616,0.047619047619047616,0.0,0.09523809523809523,0.0,0.047619047619047616,0.047619047619047616,0.047619047619047616,"Sounds like a wild claim! 🤔 Always gotta double-check these stories, sometimes they just wanna stir the pot. 🤷‍♂️",0.0
0.17142857142857143,0.02857142857142857,0.0,0.0,0.05714285714285714,0.02857142857142857,0.05714285714285714,0.05714285714285714,"Wow, that's wild! 😲 Can't believe it took a lawsuit to make it happen. Makes you wonder what else is slipping through the cracks. Gotta keep those voter rolls legit, right? 💪",0.0
0.06896551724137931,0.0,0.0,0.0,0.0,0.0,0.034482758620689655,0.0,"Wait, are they actually kicking out 50k noncitizens from the voter rolls or what? 🤔 Seems like a big deal if true! Anyone got more deets on this? 🗳️",0.9718172983479105
0.21212121212121213,0.030303030303030304,0.0,0.030303030303030304,0.06060606060606061,0.0,0.06060606060606061,0.0,"Finally! It's about time they cleaned up the voter rolls. Can't believe it took a lawsuit to make it happen, though. 🙄 Gotta keep elections fair and square, right? 🗳️",0.9837678307919331
0.06666666666666667,0.03333333333333333,0.0,0.0,0.0,0.0,0.03333333333333333,0.0,"Nah, that's not how it went down. They didn't remove 50k noncitizens. Just trying to verify citizenship with Homeland Security. No mass removal or anything like that. 🤔",0.970873786407767
0.15,0.05,0.0,0.025,0.0,0.0,0.05,0.0,"Finally, some action! 🙌 It's about time someone stepped up to make sure voting is fair. Can't believe they needed a lawsuit for this! 🤦‍♂️ Voter integrity matters, and this is a step in the right direction. 🗳️",0.9803921568627451
0.14285714285714285,0.0,0.0,0.047619047619047616,0.09523809523809523,0.0,0.0,0.047619047619047616,"Wow, that's a big number! 😳 Wonder how these things even happen... Politics can be such a mess sometimes. 🤷‍♂️",-0.9794319294809011
0.16129032258064516,0.03225806451612903,0.0,0.03225806451612903,0.03225806451612903,0.0,0.06451612903225806,0.03225806451612903,"Wow, that's crazy! 🤯 Can't believe they needed a lawsuit for something that should be common sense! Voter integrity is super important. Glad it's being sorted out! 🇺🇸",0.32992411745298583
0.0,0.0,0.0,0.0,0.0,0.0,0.0625,0.0625,That sounds a bit off. 🤔 Lawsuits for voter rolls? Seems like something got twisted there.,0.0
0.21212121212121213,0.030303030303030304,0.0,0.030303030303030304,0.06060606060606061,0.0,0.030303030303030304,0.0,"Finally, some accountability! 🙌 It's about time they cleaned up those voter rolls. Can't believe it took a lawsuit to make it happen. Let's keep elections fair and square! 🗳️💪",0.968054211035818
0.06060606060606061,0.0,0.0,0.0,0.0,0.0,0.0,0.0,"Lol, that’s not how it went down! 😆 They’re not kicking out 50,000 noncitizens from the voter rolls. Just checking citizenship status, no mass removal happening. Chill out! 🗳️",0.0
0.11627906976744186,0.0,0.0,0.023255813953488372,0.0,0.0,0.023255813953488372,0.023255813953488372,What's going on with Arizona and the voter rolls? 🤔 Is it true that they had to involve a lawsuit to deal with noncitizens on the list? Seems like there's a lot of confusion around this. Anyone got the deets? 🗳️,0.0
0.10526315789473684,0.0,0.0,0.05263157894736842,0.0,0.0,0.05263157894736842,0.0,"Finally, some accountability! It's about time they clean up those voter rolls. Democracy needs to be protected! 💪🗳️",0.9813542688910697
0.16216216216216217,0.0,0.0,0.02702702702702703,0.02702702702702703,0.0,0.05405405405405406,0.02702702702702703,"Finally, some action! 🙌 It's crazy that it took a lawsuit to get this done. Voter integrity is so important, and it's about time they cleaned up those rolls. Better late than never, right? 🤷‍♂️",0.3292723081988805
0.1,0.1,0.0,0.05,0.0,0.05,0.15,0.1,Sounds like a wild claim! 🤔 People love to exaggerate stuff like this. Always double-check before you believe it! 📚,0.19920318725099598
0.1724137931034483,0.0,0.0,0.034482758620689655,0.034482758620689655,0.0,0.06896551724137931,0.0,Finally! Someone had to step in to make things right. It's about time they cleaned up the voter rolls. We gotta keep it fair for everyone! 🇺🇸💪,0.9857072449482503
0.13636363636363635,0.045454545454545456,0.0,0.0,0.045454545454545456,0.045454545454545456,0.0,0.09090909090909091,"That's wild if true! 🤔 But honestly, politics is always so messy. Just hope they get it sorted out soon. 🤷‍♂️",-0.9891196834817013
0.07142857142857142,0.03571428571428571,0.0,0.03571428571428571,0.0,0.03571428571428571,0.10714285714285714,0.03571428571428571,"Sounds like a wild claim! 🤔 But seriously, 50k noncitizens on voter rolls? Seems like a stretch. Always good to check the facts before jumping to conclusions. 🕵️‍♂️",0.49652432969215493
0.10344827586206896,0.034482758620689655,0.0,0.0,0.0,0.0,0.0,0.0,"Nah, that's not what happened. They just wanna make sure everyone on the list is legit. No one's getting kicked off without proof. Chill out! 😅",0.0
0.10344827586206896,0.034482758620689655,0.0,0.06896551724137931,0.0,0.034482758620689655,0.13793103448275862,0.034482758620689655,Sounds like a wild claim! 😅 People throw around big numbers like 50k to make it sound dramatic. Always good to double-check stuff like this before believing it. 🤔,0.5965400676078743
0.1388888888888889,0.027777777777777776,0.0,0.027777777777777776,0.0,0.027777777777777776,0.027777777777777776,0.0,"Sounds like someone's twisting the facts again! 😅 Arizona ain't booting 50,000 noncitizens from voter rolls. It's all about verifying citizenship, not kicking people out. Don't believe everything you hear, folks! 📢",0.9652509652509652
0.06060606060606061,0.0,0.0,0.030303030303030304,0.0,0.030303030303030304,0.06060606060606061,0.06060606060606061,"Wow, sounds like a big mess! 🤯 Always some drama with elections, huh? I wonder how many people actually knew about the whole ""federal only"" voters thing. Politics is always so complicated! 🗳️",0.0
0.1111111111111111,0.0,0.0,0.037037037037037035,0.037037037037037035,0.0,0.07407407407407407,0.07407407407407407,"Wow, that's a lot of drama! 😅 Seems like there's always some confusion with these reports. Politics can be such a mess sometimes, right? 🤷‍♂️",0.0
