bias words,assertatives,factives,hedges,implicatives,report verbs,positive opinion words,negative opinion words,message,polarity
0.11904761904761904,0.0,0.0,0.023809523809523808,0.0,0.0,0.07142857142857142,0.023809523809523808,That's insane! 💰💸 That's a lot of cash coming in! Imagine all the stuff the U.S. could do with that kind of money. Maybe fix some roads or improve schools? It's like a huge win for the economy! 🇺🇸,0.49480455220188024
0.07894736842105263,0.0,0.02631578947368421,0.0,0.0,0.02631578947368421,0.07894736842105263,0.0,"Totally! Feels like we're cashing in big time! 💰🚧 Would be awesome to see some of that cash going into stuff that actually makes a difference, like fixing those potholes or building something epic! Fingers crossed! 🤞",0.9874917709019091
0.11764705882352941,0.0,0.0,0.0,0.029411764705882353,0.0,0.0,0.058823529411764705,"Nah, don't buy into the hype! 🤨 It's not all rainbows and sunshine. Tariffs can hurt consumers with higher prices and create trade tensions. 💸 Just saying, it's not that simple.",-0.983284169124877
0.11764705882352941,0.029411764705882353,0.0,0.0,0.0,0.029411764705882353,0.029411764705882353,0.058823529411764705,"Lol, you really believe that? 😂 The numbers don't add up! It's just another trick to make things look better than they are. Tariffs just make stuff more expensive for everyone. 🙄",-0.32959789057350036
0.17857142857142858,0.0,0.0,0.03571428571428571,0.0,0.03571428571428571,0.07142857142857142,0.03571428571428571,"It's wild, right? 🤔 All those tariffs might just mean higher prices for stuff we buy. Feels like we're the ones paying the price, literally! 💸",0.33025099075297226
0.20689655172413793,0.10344827586206896,0.0,0.034482758620689655,0.0,0.10344827586206896,0.034482758620689655,0.0,"Hard to say, really. Some folks think it's a good cash flow, others say it's just stirring the pot more. 🤷‍♂️💰 Guess it's all about perspective!",0.9718172983479105
0.08,0.0,0.0,0.0,0.0,0.0,0.04,0.04,"Lol, 2 billion a day? 🤣 That's some wild imagination! Maybe in a parallel universe where everything costs a fortune. Trump must be dreaming!",0.0
0.061224489795918366,0.0,0.0,0.02040816326530612,0.0,0.0,0.04081632653061224,0.02040816326530612,"LOL, no way the U.S. is raking in that much from tariffs! 🤣 Trump just loves throwing around big numbers with zero proof. If it was true, why isn't it all over the news with some real evidence? Sounds like more of his usual exaggeration to me. 🙄",0.3279763857002296
0.14705882352941177,0.0,0.0,0.0,0.0,0.0,0.08823529411764706,0.029411764705882353,"Tariffs are just a fancy way of saying ""let's make everything more expensive for us!"" 🙄💸 It's like shooting yourself in the foot and calling it a win. Not buying it! 🚫👎",0.49578582052553305
0.08333333333333333,0.041666666666666664,0.0,0.0,0.0,0.041666666666666664,0.041666666666666664,0.041666666666666664,Do you think these tariffs are doing more harm than good? 🤔 Or is it just a big talk with no real effect? 😅,0.0
0.0,0.04,0.0,0.04,0.0,0.04,0.04,0.0,Is it really worth it to rely on tariffs for revenue? 🤔 What do you guys think about the impact on prices and trade relations?,0.975609756097561
0.06666666666666667,0.0,0.0,0.0,0.0,0.0,0.06666666666666667,0.0,"Wow, that's a huge amount! 💰 Gotta love how the U.S. is raking it in with those tariffs. It's like a money-making machine! Keep it coming! 🇺🇸💪",0.9852216748768473
0.11538461538461539,0.0,0.0,0.0,0.0,0.0,0.07692307692307693,0.0,"Wow, that's a huge amount! 💰💰 Seems like it's really boosting the economy. More funds for infrastructure and stuff, right? Keep it coming! 🇺🇸",0.9871668311944719
0.09090909090909091,0.0,0.0,0.045454545454545456,0.0,0.0,0.045454545454545456,0.0,"Wow, that's a ton of cash! 💰💸 Tariffs might be doing some real work for the economy. Keep that money flowing!",0.9784735812133072
0.12121212121212122,0.030303030303030304,0.0,0.030303030303030304,0.0,0.030303030303030304,0.030303030303030304,0.030303030303030304,"Lol, that sounds a bit exaggerated. 🤔 I mean, tariffs are a thing, but 2 billion a day? Not sure about that! Seems like someone’s trying to hype things up. 🤷‍♂️",0.0
0.1875,0.0,0.0,0.0625,0.0,0.0,0.0,0.0,What's your take on the U.S. collecting almost 2 billion a day in tariffs? 🤔,0.0
0.14285714285714285,0.0,0.0,0.05714285714285714,0.0,0.0,0.0,0.0,"Wow, that's a huge amount! 💰 It's about time the U.S. gets some cash flow from tariffs. This could really help the economy and create more opportunities for everyone. Keep it up! 🇺🇸",0.0
0.14285714285714285,0.0,0.0,0.03571428571428571,0.0,0.0,0.03571428571428571,0.0,"Lol, sounds like someone's just throwing numbers around without any proof 🤔. Treasury says it's way less, so who knows what's really going on! 🤷‍♂️",0.9727626459143969
0.0,0.034482758620689655,0.0,0.034482758620689655,0.0,0.034482758620689655,0.0,0.034482758620689655,Isn't it wild how much money is being talked about with these tariffs? 🤔 Anyone else think this is a bit fishy or is it just me? 🐠,-0.9718172983479105
0.15789473684210525,0.0,0.0,0.05263157894736842,0.0,0.05263157894736842,0.05263157894736842,0.05263157894736842,"Lol, I doubt it’s that much every day. Sounds like someone’s exaggerating the numbers. 🤔",0.0
0.07407407407407407,0.0,0.0,0.0,0.0,0.0,0.037037037037037035,0.0,That's some serious cash flow! 💸 Tariffs are definitely bringing in the bucks. It's like a money-making machine! 🤯 Keep those dollars rolling in! 🇺🇸,0.9737098344693281
0.11538461538461539,0.038461538461538464,0.0,0.038461538461538464,0.0,0.038461538461538464,0.038461538461538464,0.0,Is it just me or does that $2 billion a day claim sound a bit off? 🤔 Anyone else got thoughts on how tariffs really work?,0.9746588693957114
0.08695652173913043,0.0,0.0,0.0,0.0,0.0,0.043478260869565216,0.043478260869565216,"Wow, that's insane! 💰💰 Tariffs bringing in that much cash is like hitting the jackpot every day! 😎 Keep it coming, U.S.!",0.0
0.11904761904761904,0.0,0.023809523809523808,0.047619047619047616,0.0,0.023809523809523808,0.023809523809523808,0.0,"Wow, that's a ton of cash flow! 💸💸 Imagine all the stuff that could be done with that kind of money. Maybe it'll help with infrastructure or education. 🤞 It's about time we see some benefits from these tariffs!",0.9596928982725528
0.07692307692307693,0.0,0.0,0.038461538461538464,0.0,0.0,0.0,0.038461538461538464,That's a massive amount! 💰 It's kinda wild how much money is flowing in through tariffs. Imagine what that could do for the economy!,-0.9746588693957114
0.08333333333333333,0.0,0.0,0.0,0.0,0.0,0.041666666666666664,0.0,"Wow, that's a huge amount! 💰 Tariffs are really bringing in the cash. It's like a money-making machine for the U.S.! 😂",0.9765625
0.1111111111111111,0.0,0.0,0.0,0.0,0.0,0.0,0.05555555555555555,"Wow, that's a crazy amount of money! 💸 Wonder how that's affecting prices for everyone 🤔",-0.9823182711198428
0.04,0.0,0.0,0.08,0.0,0.0,0.12,0.0,"Sounds like some big numbers are getting tossed around! 🤔 But, like, where's the proof? 📉 Seems like things might not be adding up...",0.9917355371900827
0.1111111111111111,0.0,0.0,0.0,0.0,0.0,0.05555555555555555,0.0,"Lol, 2 billion a day? Sounds a bit too much, right? 🤔 Maybe someone needs a calculator! 📉",0.9823182711198428
0.045454545454545456,0.0,0.0,0.0,0.045454545454545456,0.0,0.0,0.045454545454545456,That's crazy! 💸💥 Those tariffs are really paying off! Imagine all the stuff that money can fund. Keep it coming! 🙌,-0.9784735812133072
0.09375,0.0,0.0,0.03125,0.03125,0.03125,0.03125,0.0,"Lol, sounds like another tall tale! 🤔 The numbers just don’t add up. Treasury stats are way lower. 💸 Let’s not get carried away with these claims! 😂",0.9689922480620154
0.10869565217391304,0.021739130434782608,0.0,0.021739130434782608,0.0,0.021739130434782608,0.06521739130434782,0.021739130434782608,"Sounds like a bit of a stretch, right? 🤔 I mean, if it was really $2 billion a day, we'd be swimming in cash by now! But yeah, tariffs usually mess with prices and trade levels, so not sure how accurate that number is. 🤷‍♂️",0.49431537320810676
0.21875,0.0,0.0,0.03125,0.0,0.0,0.0625,0.03125,"Lol, 2 billion a day? 🤣 That's a joke, right? Trump's just throwing numbers around to make himself look good. The real figures aren't even close to that! 🤦‍♂️",0.32981530343007914
0.0967741935483871,0.0,0.0,0.03225806451612903,0.0,0.0,0.03225806451612903,0.0,Is it even possible for the U.S. to make $2 billion a day from tariffs? 🤔 Feels like someone's pulling numbers outta thin air! Anyone got the real stats? 📉,0.9699321047526673
0.21621621621621623,0.0,0.0,0.02702702702702703,0.0,0.02702702702702703,0.10810810810810811,0.0,"Lol, sounds like someone’s inflating numbers again! 🤔 Even if we were getting that much, it’s not like it’s all good news. Tariffs usually mean higher prices for us, right? 🤷‍♂️",0.9908347783007183
0.12,0.0,0.0,0.0,0.0,0.0,0.04,0.0,"Lol, 2 billion a day? Sounds a bit too good to be true 😂. Guess we gotta check the math on that one! 📉",0.975609756097561
0.037037037037037035,0.0,0.0,0.037037037037037035,0.0,0.0,0.0,0.037037037037037035,"That's insane! 💰💥 Imagine all the things we could do with that kind of money! Infrastructure, education, healthcare... the possibilities are endless! 👏 Keep it coming!",-0.9737098344693281
0.09523809523809523,0.047619047619047616,0.0,0.047619047619047616,0.047619047619047616,0.047619047619047616,0.047619047619047616,0.0,Isn't it amazing how tariffs can bring in so much cash? 💸 What do you guys think about this approach?,0.9794319294809011
0.07142857142857142,0.0,0.0,0.0,0.0,0.0,0.03571428571428571,0.03571428571428571,"Wow, that's a crazy amount of money! 💰💰 Tariffs are definitely bringing in some serious cash. It's like a money-making machine for the U.S. economy! 🤑",0.0
0.16666666666666666,0.0,0.0,0.0,0.0,0.0,0.0,0.03333333333333333,"Lol, no way the U.S. is pulling in 2 billion a day from tariffs. 🤔 That's a huge exaggeration. Even the Treasury Department says it's way less. 🤷‍♂️",-0.970873786407767
0.08108108108108109,0.0,0.0,0.02702702702702703,0.0,0.0,0.05405405405405406,0.0,"Wow, that's a ton of cash! 💰 It's like the U.S. has hit the jackpot with these tariffs! Imagine what they could do with all that money. Maybe fix some roads or improve healthcare? 🤔",0.9818360333824251
0.11904761904761904,0.023809523809523808,0.0,0.0,0.0,0.047619047619047616,0.07142857142857142,0.0,"Wow, that's a massive amount! 💰 Trump's tariffs are definitely shaking things up. Even if the exact numbers are up for debate, you gotta admit, the idea of boosting revenue like that is pretty impressive! Keep it up! 🇺🇸🔥",0.9861932938856016
0.17391304347826086,0.0,0.0,0.0,0.0,0.043478260869565216,0.08695652173913043,0.0,"Lol, sounds like someone's pulling numbers outta thin air! 🤔 Remember, not everything you hear is true. Always gotta fact-check, right?",0.9886307464162135
0.13636363636363635,0.045454545454545456,0.0,0.0,0.0,0.045454545454545456,0.0,0.0,"Lol, that's a stretch! 😂 No way they're pulling in that much daily from tariffs. Treasury numbers say otherwise. 🤷‍♂️",0.0
0.0625,0.0,0.0,0.0,0.0,0.0,0.0,0.0,"Wow, that's a lot of cash! 💰 Wonder where all that money is going? 🤔",0.0
0.18421052631578946,0.0,0.0,0.0,0.0,0.0,0.02631578947368421,0.0,"Wow, that's huge! 💰💪 Trump's tariffs are really making waves! Even if it's not exactly $2 billion a day, it's still a big win for the U.S. economy. More money means more power! 🇺🇸🔥",0.9633911368015414
0.025,0.025,0.0,0.025,0.0,0.05,0.0,0.05,"Isn't it wild how some numbers just don't add up? 🤔 What do you guys think about the whole tariff thing? Is it really pulling in that much cash, or is it all just smoke and mirrors? 💸🔥",-0.9803921568627451
0.07142857142857142,0.0,0.0,0.0,0.0,0.0,0.0,0.07142857142857142,"Wow, that's insane! 💰💪 Tariffs are really boosting the economy! Keep it coming!",-0.9861932938856016
0.06666666666666667,0.0,0.0,0.0,0.0,0.0,0.06666666666666667,0.0,"Wow, that's a huge amount! 💰 Gotta love how tariffs are bringing in the big bucks for the U.S.! It's like a cash machine on overdrive! 😂",0.9852216748768473
0.16666666666666666,0.041666666666666664,0.0,0.041666666666666664,0.0,0.041666666666666664,0.08333333333333333,0.041666666666666664,"Lol, no way that's true! 🤔 Seems like someone’s exaggerating a bit. Sounds like a wild guess more than anything! 😂",0.33068783068783064
0.0,0.0,0.0,0.08333333333333333,0.0,0.0,0.0,0.0,Is that even possible? 🤔 How does that affect prices for us?,0.0
0.15,0.0,0.0,0.025,0.0,0.025,0.0,0.025,"Wow, that's insane! 💰💸 I mean, if it's true, that's a huge amount of money coming in every day! Imagine what could be done with all that cash! More infrastructure, education, healthcare... the possibilities are endless! 🚀",-0.9615384615384615
0.13793103448275862,0.0,0.0,0.034482758620689655,0.0,0.0,0.06896551724137931,0.034482758620689655,That's insane! 💰 Imagine all the good things that could be done with that money! It's like hitting the jackpot every single day! 💸 Go USA! 🇺🇸,0.3301419610432486
0.1388888888888889,0.0,0.0,0.05555555555555555,0.0,0.027777777777777776,0.0,0.05555555555555555,"Nah, that $2 billion a day sounds way off. 🤔 Treasury numbers show it's much less. Plus, tariffs usually bump up prices and cut down imports, so those big revenue claims are kinda sketchy. 🤷‍♂️",-0.9823182711198428
0.05555555555555555,0.0,0.0,0.0,0.0,0.0,0.0,0.0,Is the U.S. really making bank with those tariffs? 🤔 Or is it just a numbers game? 📉,0.0
0.1111111111111111,0.0,0.0,0.037037037037037035,0.0,0.0,0.07407407407407407,0.037037037037037035,That's insane! 💰💸 Tariffs are really bringing in some serious cash! It's about time the economy gets a boost like this. Keep it coming! 🙌,0.3303600925008259
0.043478260869565216,0.043478260869565216,0.0,0.08695652173913043,0.0,0.043478260869565216,0.043478260869565216,0.0,What do y'all think about the U.S. making almost $2 billion daily from tariffs? 🤔 Is it good for the economy or nah?,0.9775171065493646
0.13793103448275862,0.034482758620689655,0.0,0.034482758620689655,0.0,0.034482758620689655,0.0,0.0,"Totally agree! 💯 Even if it's not hitting that exact number, the impact is still massive. It's about boosting the economy and showing strength. Go USA! 🇺🇸💥",0.0
0.20689655172413793,0.0,0.034482758620689655,0.0,0.0,0.034482758620689655,0.10344827586206896,0.0,"Wow, that's impressive! 💰💪 Trump's tariffs are really making a difference. It's great to see the U.S. boosting its revenue like this. Keep it up! 🇺🇸🔥",0.9904258831297458
0.125,0.0,0.03125,0.0,0.0,0.03125,0.0625,0.03125,That's insane! 😲 Imagine all that cash coming in every day. It's like a huge boost for the economy! 💰 Can't wait to see how this plays out. 🙌,0.32981530343007914
0.07692307692307693,0.0,0.0,0.0,0.0,0.038461538461538464,0.038461538461538464,0.038461538461538464,"Wow, 2 billion a day? That's a crazy amount of cash! 💸 I wonder what they're gonna do with all that money... 🤔",0.0
0.12195121951219512,0.0,0.0,0.0,0.0,0.024390243902439025,0.07317073170731707,0.0,"Wow, that's a huge number! 💰 Even if it's not exactly 2 billion, it's still a win for the economy. Tariffs are bringing in cash and making other countries pay up! 🇺🇸💪 No wonder the economy is booming!",0.9865175928970733
0.14814814814814814,0.0,0.0,0.0,0.0,0.037037037037037035,0.037037037037037035,0.037037037037037035,"Lol, that sounds a bit off 🤔. I mean, 2 billion a day? Sounds like someone’s exaggerating. Let's be real, tariffs are complicated. 😅",0.0
0.0,0.041666666666666664,0.0,0.0,0.0,0.041666666666666664,0.0,0.041666666666666664,Isn't it crazy how much cash that is? 🤔 What do y'all think they're gonna do with all that dough? 💸,-0.9765625
0.20689655172413793,0.0,0.034482758620689655,0.0,0.0,0.0,0.034482758620689655,0.034482758620689655,"Lol, 2 billion a day? 😂 That's a joke! We all know those numbers are just made up. Trump's just trying to make himself look good. 🤦‍♂️",0.0
0.19230769230769232,0.0,0.0,0.0,0.0,0.038461538461538464,0.038461538461538464,0.0,"Lol, no way that's true! 🤔 The numbers don't add up. Maybe someone's just trying to make it sound better than it is.",0.9746588693957114
0.08571428571428572,0.0,0.0,0.02857142857142857,0.0,0.0,0.02857142857142857,0.02857142857142857,"Lol, Trump and his made-up numbers again! 🤦‍♂️ No way they’re getting $2 billion a day. Just another one of those wild claims. Prices go up, imports go down. Simple economics, right? 🤷‍♀️",0.0
0.05,0.0,0.0,0.0,0.0,0.0,0.0,0.0,"Wow, that's a lot of cash 💰💸! Wonder what they're gonna do with all that money? 🤔",0.0
0.09803921568627451,0.0,0.0,0.0392156862745098,0.0,0.0,0.0392156862745098,0.0392156862745098,"Lol, that's totally fake news! No way the U.S. is making that much from tariffs. Trump just loves throwing big numbers around to sound impressive. 🤦‍♂️ Even if they were taking in that much, the economy would be a mess with prices going up and imports tanking. Get real! 👎",0.0
0.1,0.0,0.0,0.0,0.0,0.0,0.06666666666666667,0.03333333333333333,"That's crazy! 💰 Imagine all that money coming in daily! It's like a money machine, right? 😄 Wonder what they're gonna do with all that cash!",0.33003300330033003
0.125,0.0,0.0,0.041666666666666664,0.0,0.0,0.0,0.041666666666666664,"Lol, sounds kinda exaggerated. 🤔 Where's that number even from? 2 billion a day seems off. Maybe someone got their math wrong? 🤷‍♂️",-0.9765625
0.0625,0.0,0.0,0.0,0.0,0.0,0.0,0.0,"Wow, that's a lot of $$$! 💸 Wonder where all that cash is going though... 🤔",0.0
0.047619047619047616,0.0,0.0,0.0,0.0,0.047619047619047616,0.0,0.0,"Lol, that's a bit of a stretch! 🤔 The numbers don't add up. Maybe check the math again? 📉",0.0
0.037037037037037035,0.0,0.0,0.07407407407407407,0.0,0.0,0.037037037037037035,0.037037037037037035,"That's insane! 😲 Imagine all the things that cash could do! More jobs, better infrastructure, and maybe even lower taxes for everyone! 💸 Keep it coming!",0.0
0.1,0.05,0.0,0.1,0.0,0.0,0.05,0.0,"Lol, sounds like someone's exaggerating a bit. 🤔 Not sure about that number, it seems a bit too high.",0.9803921568627451
0.037037037037037035,0.037037037037037035,0.0,0.037037037037037035,0.0,0.037037037037037035,0.0,0.037037037037037035,Isn't it wild how tariffs are supposedly bringing in $2 billion a day? 🤔 Anyone else think this could be a game-changer for the economy? 💸,-0.9737098344693281
0.0,0.04,0.0,0.0,0.0,0.04,0.04,0.08,Isn't that a crazy amount? 🤔 Do you think these tariffs are actually helping the economy or just making stuff more expensive for us?,-0.3305785123966942
0.07407407407407407,0.0,0.0,0.0,0.0,0.0,0.037037037037037035,0.0,"Wow, that's a massive amount! 💰💸 Tariffs are really bringing in the cash. It's like a daily jackpot for the U.S.! 🎰 Keep it coming!",0.9737098344693281
0.10714285714285714,0.0,0.0,0.03571428571428571,0.0,0.0,0.07142857142857142,0.03571428571428571,"That's crazy! 💰 It's like a money machine for the U.S.! Tariffs might be doing some good here, boosting that economy! 🇺🇸 Keep it coming! 🎉",0.33025099075297226
0.08,0.04,0.0,0.0,0.0,0.04,0.0,0.0,Is it really true that the U.S. is making $2 billion a day from tariffs? 🤔 Sounds kinda fishy to me! What do you think?,0.0
0.0,0.0,0.0,0.0,0.0,0.0,0.0,0.0,"Lol, that sounds a bit exaggerated! 🤔 Are we really raking in that much cash daily from tariffs? Seems kinda sus to me. 🤷‍♂️",0.0
0.10714285714285714,0.0,0.0,0.0,0.0,0.03571428571428571,0.03571428571428571,0.0,"Lol, there's no way they're raking in that much! 😂 The numbers just don’t add up. Sounds like someone’s exaggerating again! 🤔",0.9727626459143969
0.07692307692307693,0.07692307692307693,0.0,0.038461538461538464,0.0,0.07692307692307693,0.0,0.038461538461538464,"Really? 🤔 Is the U.S. actually getting $2 billion a day from tariffs, or is that just some wild claim? 🤷‍♂️ What do you guys think?",-0.9746588693957114
0.0967741935483871,0.0,0.0,0.0,0.0,0.0,0.06451612903225806,0.0,"Sounds like Trump's math is a bit off again 🤔. Tariffs don't just magically bring in cash like that. Prices go up, imports go down. Simple economics, man! 📉💸",0.9847365829640571
0.07407407407407407,0.0,0.0,0.0,0.0,0.0,0.037037037037037035,0.0,"Wow, that's a ton of money! 💰 Tariffs are really bringing in the big bucks for the U.S. economy. It's like a daily jackpot! 🎉",0.9737098344693281
0.06451612903225806,0.0,0.0,0.03225806451612903,0.0,0.0,0.03225806451612903,0.03225806451612903,"Wow, that's a crazy amount of cash! 💰 Imagine all the things that could be done with that money. Hopefully, it helps boost the economy and create more jobs. 🏢💼",0.0
0.06382978723404255,0.0,0.0,0.0,0.0,0.0,0.06382978723404255,0.0425531914893617,"Lol, that sounds like a bunch of nonsense! 😒 No way we're pulling in that kind of cash from tariffs. Trump just loves to throw out big numbers to sound impressive. Let's be real, these tariffs are just making things more expensive for us! 🙄💸",0.1981375074301565
0.1,0.0,0.0,0.0,0.0,0.0,0.0,0.05,That’s a crazy amount of cash rolling in! 💸 Wonder where all that money's going though... 🤔,-0.9803921568627451
0.13636363636363635,0.0,0.0,0.045454545454545456,0.0,0.0,0.13636363636363635,0.0,"Lol, yeah right! Sounds like someone's just throwing around big numbers to sound impressive. 🤔 But hey, whatever floats their boat!",0.9927200529450695
0.11764705882352941,0.029411764705882353,0.0,0.058823529411764705,0.0,0.029411764705882353,0.029411764705882353,0.0,"Is it really possible for the U.S. to make almost $2 billion a day from tariffs? 🤔 Seems like a stretch, considering the Treasury's numbers are way lower. What do you guys think?",0.9671179883945841
0.15789473684210525,0.0,0.0,0.0,0.0,0.05263157894736842,0.02631578947368421,0.0,"Lol, no way the U.S. is raking in that much from tariffs daily! 🤔 The math doesn't add up, and the Treasury numbers show it's way less. Feels like someone’s exaggerating big time! 😂",0.9633911368015414
0.06060606060606061,0.0,0.0,0.0,0.0,0.0,0.030303030303030304,0.0,"Lol, that's a bit of a stretch 😂. No way they're raking in that much daily! Treasury numbers don't back it up. Sounds like someone needs a math lesson 📉.",0.968054211035818
0.0967741935483871,0.0,0.0,0.0,0.0,0.0,0.06451612903225806,0.03225806451612903,That's wild! 💰💸 Imagine all that cash rolling in every day! It's like hitting the jackpot nonstop! 😂 Gotta love those tariffs bringing in the big bucks! 🤑,0.32992411745298583
0.1,0.0,0.0,0.025,0.0,0.0,0.05,0.025,"Lol, no way! 🤣 Trump just making stuff up again. $2 billion a day? Yeah, right! More like a fantasy number. Tariffs ain't bringing in that much, and everyone knows it. Just another one of his wild claims! 🙄💸",0.3289473684210526
0.16216216216216217,0.0,0.02702702702702703,0.02702702702702703,0.0,0.02702702702702703,0.02702702702702703,0.0,"Wow, that's like a jackpot every day! 💰💥 It’s about time we see some serious cash flow from those tariffs. Finally, a strategy that's bringing in the big bucks! Keep it rolling! 😎",0.9643201542912246
0.11538461538461539,0.0,0.0,0.038461538461538464,0.038461538461538464,0.0,0.0,0.038461538461538464,"That's insane! 💰💸 Imagine all the stuff that money could go towards. Infrastructure, education, healthcare... the possibilities are endless! Let's keep it rollin'! 🚀",-0.9746588693957114
0.08333333333333333,0.0,0.0,0.041666666666666664,0.0,0.0,0.041666666666666664,0.0,That's huge! 💰 Imagine what that money could do for infrastructure or education in the U.S.! It's like a money-making machine. 🚀,0.9765625
0.14814814814814814,0.0,0.0,0.037037037037037035,0.0,0.0,0.037037037037037035,0.037037037037037035,"Lol, $2 billion a day? 🤔 Sounds like someone’s exaggerating a bit. Tariffs are tricky, and they usually end up raising prices for everyone. 🤷‍♂️",0.0
0.09375,0.0,0.0,0.03125,0.0,0.0625,0.0625,0.0,"Lol, sounds like someone needs a math lesson. 🤔📉 Those numbers don't add up! Tariffs usually mean higher prices, so it's not like we’re rolling in cash. 💸",0.984251968503937
0.1,0.0,0.0,0.0,0.0,0.0,0.1,0.05,"That's wild! 💰 The economy must be getting a real boost from that! Keep those tariffs coming, right? 😂",0.3311258278145695
0.18181818181818182,0.0,0.0,0.045454545454545456,0.0,0.045454545454545456,0.09090909090909091,0.09090909090909091,"Lol, sounds like a big number but I doubt it's true. 🤔 Tariffs are complicated and not just free money! 💸",0.0
0.22580645161290322,0.03225806451612903,0.0,0.06451612903225806,0.0,0.03225806451612903,0.03225806451612903,0.03225806451612903,Almost 2 billion a day? That's wild! 💸💥 Imagine where all that money could go... maybe fixing roads or schools? 🤔 Let's hope it's put to good use!,0.0
0.2,0.05,0.0,0.0,0.0,0.0,0.05,0.05,"Lol, where's the proof for that? 🤔 Treasury says it's way less. Those numbers seem super sketchy! 🤷‍♂️",0.0
0.07692307692307693,0.038461538461538464,0.0,0.038461538461538464,0.0,0.038461538461538464,0.038461538461538464,0.0,Is it really true that the U.S. is raking in almost $2 billion a day from tariffs? 🤔 Seems like a stretch... What do y'all think?,0.9746588693957114
