bias words,assertatives,factives,hedges,implicatives,report verbs,positive opinion words,negative opinion words,message,polarity
0.034482758620689655,0.0,0.0,0.0,0.034482758620689655,0.0,0.0,0.0,"Wait, is that for real? 🤔 Do we actually get Starlink auto-installed with iOS 18.3, or do we have to sign up for it? Anyone tried it yet? 📱🚀",0.0
0.13793103448275862,0.034482758620689655,0.0,0.0,0.0,0.0,0.0,0.06896551724137931,Who even wants Starlink cluttering up their phone? 🚫 It's just another way to mess with our devices. Can't believe people are falling for this stuff. 🙄,-0.9857072449482503
0.05714285714285714,0.0,0.0,0.0,0.0,0.0,0.02857142857142857,0.02857142857142857,"Lol, people be spreading rumors like wildfire! 🌪️ Starlink ain't gonna magically pop up on your phone with an iOS update. You gotta opt in for that T-Mobile and SpaceX deal. 📱🚀",0.0
0.1111111111111111,0.05555555555555555,0.0,0.05555555555555555,0.0,0.1111111111111111,0.0,0.0,Did anyone else hear about this Starlink thing coming with iOS 18.3? 🤔 What do you guys think?,0.0
0.04,0.0,0.0,0.04,0.0,0.04,0.12,0.16,"Haha, yeah, sounds like a wild rumor! 😆 People love to spread crazy stuff about updates. No need to panic, just enjoy your phone! 📱✨",-0.1423487544483986
0.08,0.0,0.0,0.0,0.0,0.0,0.04,0.0,"Nah, that's not how it works. You gotta opt-in for Starlink, it's not just gonna pop up on your phone. 🤷‍♂️",0.975609756097561
0.034482758620689655,0.0,0.0,0.0,0.0,0.0,0.034482758620689655,0.0,"Nah, that's not how it works. Starlink isn't just gonna pop up on your phone after an update. 🤷‍♂️ You gotta opt-in for that stuff.",0.9718172983479105
0.05,0.0,0.0,0.0,0.0,0.0,0.05,0.0,"Wow, that's awesome! 🚀 Can't wait to have Starlink on my iPhone. Faster internet everywhere? Yes, please! 📱🌍",0.9803921568627451
0.11764705882352941,0.0,0.0,0.0,0.0,0.0,0.029411764705882353,0.029411764705882353,"Nah, that's just not true! 🚫 They're not sneaking Starlink onto iPhones like that. It's up to you if you want it or not. Chill out with the conspiracy theories! 😅",0.0
0.0,0.0,0.0,0.0,0.023809523809523808,0.0,0.023809523809523808,0.047619047619047616,"Wait, are they really forcing Starlink on us with the update? 😒 Why can't they just let us choose what we want on our phones? Feels like they're just trying to sneak stuff in! Anyone else annoyed by this? 🤔",-0.32873109796186717
0.11764705882352941,0.0,0.0,0.0,0.0,0.0,0.0,0.0,"Wait, is it true that Starlink gets installed with the new update? 🤔 Anyone tried it yet?",0.0
0.125,0.0,0.03125,0.0,0.03125,0.03125,0.0625,0.0,"Wow, that's awesome! 🚀 Finally, a way to get Starlink on iPhones! Can't wait to try it out and see how it improves connectivity. Starlink is a game changer! 🌟📱",0.984251968503937
0.07407407407407407,0.0,0.0,0.0,0.0,0.0,0.1111111111111111,0.0,"Wow, that's awesome! 🚀 Can't wait to have Starlink on my phone. It's gonna be so cool to have better connectivity everywhere! 🌍📱",0.9910802775024777
0.2,0.025,0.0,0.0,0.0,0.025,0.0,0.075,"Nah, that's just a load of nonsense! 🙄 There's no way Starlink is getting auto-installed with an iOS update. It's all just a marketing gimmick to make people freak out. Don't believe everything you hear! 🤦‍♂️",-0.9868421052631579
0.038461538461538464,0.0,0.0,0.0,0.0,0.0,0.038461538461538464,0.0,"Nah, that's not how it works. Starlink won't just pop up on your iPhone with an update. You gotta opt-in for that. 🤷‍♂️",0.9746588693957114
0.09523809523809523,0.0,0.0,0.0,0.0,0.0,0.09523809523809523,0.0,"Lol, that's not how it works! 😂 You gotta opt in for Starlink. No free rides with iOS updates!",0.9896091044037605
0.041666666666666664,0.0,0.0,0.041666666666666664,0.0,0.0,0.041666666666666664,0.0,"OMG, that's awesome! 🚀 Having Starlink on my iPhone would be a game-changer! Can't wait to update and check it out. 📱✨",0.9765625
0.11764705882352941,0.0,0.0,0.0,0.0,0.0,0.058823529411764705,0.0,"Nah, that's not true. iOS updates don't just throw in random stuff like that. 🤔",0.983284169124877
0.0,0.0,0.0,0.058823529411764705,0.0,0.0,0.0,0.0,Is Starlink really gonna be auto-installed with iOS 18.3 update? 🤔 Anyone else heard about this?,0.0
0.08333333333333333,0.0,0.0,0.0,0.0,0.0,0.05555555555555555,0.027777777777777776,"Yo, that sounds awesome! 🚀 Starlink on the go with iOS 18.3? Sign me up! Can't wait to try it out, especially since it's free till July. T-Mobile and SpaceX are killing it! 🤩📱",0.32938076416337286
0.0,0.0,0.0,0.0,0.0,0.0,0.05555555555555555,0.0,"Wait, is Starlink really gonna be on iPhones just like that? 🤔 Anyone tried the update yet?",0.9823182711198428
0.07142857142857142,0.0,0.0,0.07142857142857142,0.0,0.0,0.0,0.07142857142857142,"Lol, people always freak out about updates! 🤣 Not everything gets installed automatically. 🌌",-0.9861932938856016
0.125,0.0,0.0,0.0,0.0,0.0,0.125,0.0,"OMG, that's awesome! 🚀 Having Starlink on my iPhone sounds like a dream come true! Can't wait for faster internet everywhere! 🌍📱",0.9920634920634921
0.0625,0.0,0.0,0.0625,0.0,0.0,0.0,0.0,"Wait, what?! 😳 Is this true? Anyone else heard about Starlink coming with iOS 18.3? 🚀📱",0.0
0.08,0.0,0.0,0.0,0.0,0.0,0.0,0.0,"Wait, is that even true? 🤔 I heard that Starlink thing is only if you opt in with T-Mobile. Anyone else got it automatically? 📱🚀",0.0
0.037037037037037035,0.0,0.0,0.037037037037037035,0.0,0.037037037037037035,0.0,0.07407407407407407,"Lol, don't worry about it. Starlink isn't gonna sneak its way onto your iPhone with the update. You gotta opt-in for that. 😅📱",-0.986679822397632
0.08108108108108109,0.02702702702702703,0.0,0.0,0.0,0.05405405405405406,0.05405405405405406,0.05405405405405406,"Nah, that's just a load of nonsense 🤦‍♂️. People love to spread these rumors like wildfire. Starlink isn't sneaking onto your iPhone without you knowing. Chill out and don't believe everything you hear! 📱🚀",0.0
0.03333333333333333,0.0,0.0,0.03333333333333333,0.0,0.0,0.03333333333333333,0.03333333333333333,Can't wait for this! 🚀 Having Starlink on my iPhone would be awesome. Imagine the internet speed and coverage! T-Mobile and SpaceX are killing it with this partnership. 📱✨,0.0
0.07142857142857142,0.03571428571428571,0.03571428571428571,0.07142857142857142,0.0,0.03571428571428571,0.03571428571428571,0.03571428571428571,"Wow, really? 🤔 That's wild! I didn't know Apple was teaming up with Starlink like that. Not sure how I feel about automatic installs though...🤨",0.0
0.14285714285714285,0.0,0.0,0.0,0.0,0.07142857142857142,0.07142857142857142,0.0,"Wait, does that mean we’re all getting Starlink for free now? 🚀📱",0.9861932938856016
0.14285714285714285,0.05714285714285714,0.02857142857142857,0.0,0.02857142857142857,0.05714285714285714,0.05714285714285714,0.0,Totally agree! 🙌 Can't believe we get to try Starlink for free! T-Mobile and SpaceX are on fire with this collab! 🌟 Can't wait to see how it works on my iPhone! 🔥📲,0.9828009828009828
0.11904761904761904,0.047619047619047616,0.0,0.023809523809523808,0.0,0.023809523809523808,0.047619047619047616,0.023809523809523808,"Nah, that's not how it works. 😂 iOS updates don't just sneak in random stuff like that. You gotta opt-in for Starlink, it's not gonna magically appear on your phone. Don't believe everything you hear! 🤦‍♂️",0.32873109796186717
0.09090909090909091,0.0,0.0,0.0,0.0,0.0,0.045454545454545456,0.0,"Nah, that's not how it works! You gotta opt-in for Starlink, it's not automatic with iOS 18.3 update. 📱✨",0.9784735812133072
0.13513513513513514,0.0,0.02702702702702703,0.0,0.0,0.02702702702702703,0.05405405405405406,0.05405405405405406,"Wow, that's wild! 🤯 I wonder if it’s gonna take up a lot of space or if it’ll actually be useful. Anyone know if this is true or just a rumor?",0.0
0.10526315789473684,0.0,0.0,0.0,0.0,0.0,0.05263157894736842,0.0,"Lol, that's not how it works! You gotta sign up for it. No surprise installs here! 🚀📱",0.9813542688910697
0.0,0.0,0.0,0.0,0.05263157894736842,0.0,0.0,0.0,Can't wait to update my iPhone and get Starlink! 🚀 Free internet till July? Count me in! 🙌,0.0
0.0625,0.0,0.0,0.0,0.0,0.0,0.0,0.0,Is it true that updating to iOS 18.3 automatically installs Starlink? 🤔 Anyone tried it yet?,0.0
0.0,0.0,0.0,0.0,0.0,0.0,0.09523809523809523,0.0,Can't wait to update my iPhone! 🚀 Having Starlink automatically installed sounds awesome! 🌟 Imagine having better connectivity everywhere! 📱✨,0.9896091044037605
0.09090909090909091,0.0,0.0,0.0,0.0,0.0,0.09090909090909091,0.0,"Whoa, that's awesome! 🚀 Can't wait to have Starlink on my iPhone. Always wanted better connectivity wherever I go. Apple and SpaceX teaming up is like a dream come true! 🌟",0.9891196834817013
0.04,0.0,0.0,0.0,0.0,0.0,0.08,0.04,"OMG, that's awesome! 🚀 Can't wait to have Starlink on my iPhone! Finally, some real innovation. T-Mobile and SpaceX are killing it! 🤩",0.3305785123966942
0.05714285714285714,0.0,0.0,0.0,0.0,0.0,0.02857142857142857,0.0,"Nah, that's not how it works! 🤔 Starlink won't just pop up on your phone with an update. You gotta sign up for it if you want it. No auto-installing here! 📱",0.966183574879227
0.05263157894736842,0.0,0.0,0.0,0.0,0.0,0.05263157894736842,0.02631578947368421,"OMG, that sounds amazing! 🚀 Can't wait to have Starlink on my phone! It's gonna be so cool to have that kind of connectivity everywhere. T-Mobile and SpaceX are killing it with this partnership! 📱✨",0.32916392363396973
0.058823529411764705,0.0,0.0,0.0,0.0,0.0,0.0,0.0,Starlink isn't automatically installed with iOS 18.3. You gotta opt in for that service. 🤷‍♂️,0.0
0.03333333333333333,0.0,0.0,0.0,0.0,0.0,0.03333333333333333,0.0,"Honestly, having Starlink on iOS 18.3 sounds awesome! 🚀 Imagine having that kind of connectivity everywhere you go! Can't wait to update my iPhone and try it out! 🌍📱",0.970873786407767
0.125,0.0625,0.0,0.0,0.0,0.0625,0.0625,0.0,Do you think having Starlink auto-installed on iOS 18.3 is a good thing or nah? 🚀📱,0.984251968503937
0.08823529411764706,0.0,0.0,0.0,0.029411764705882353,0.029411764705882353,0.029411764705882353,0.029411764705882353,Who even needs Starlink on their phone? 🤔 Sounds like another way to force stuff on us we didn't ask for. Just another way for big companies to mess with our phones. 🙄,0.0
0.09523809523809523,0.0,0.0,0.047619047619047616,0.0,0.0,0.09523809523809523,0.09523809523809523,"Sounds like a wild rumor! 😂 But hey, if it means free Starlink until July, some folks might not mind! 📱✨",0.0
0.08,0.0,0.0,0.0,0.0,0.0,0.04,0.04,"Nah, that's not how it works 🤔. Starlink isn't auto-installed with iOS 18.3. You gotta opt-in for that service. No worries! 📱✨",0.0
0.043478260869565216,0.0,0.0,0.0,0.0,0.0,0.13043478260869565,0.0,"Wow, that's awesome! 🚀 Having Starlink on iOS 18.3 sounds like a game-changer. Can't wait to have that connectivity boost! 🌍📱",0.9923916639100232
0.0625,0.0,0.0,0.0,0.0,0.0,0.0,0.0,Is it true that updating to iOS 18.3 automatically installs Starlink? 🤔 Anyone tried it yet?,0.0
0.06451612903225806,0.0,0.0,0.03225806451612903,0.0,0.0,0.03225806451612903,0.06451612903225806,"Lol, people are always freaking out about updates! 🤣 It's not like they're sneaking in aliens or something. Just chill, you gotta opt in for Starlink anyway. 📱✨",-0.32992411745298583
0.0967741935483871,0.03225806451612903,0.0,0.03225806451612903,0.0,0.0,0.03225806451612903,0.0,"Lol, that's not how it works! 🤦‍♂️ You gotta opt-in for Starlink, it's not just gonna magically appear on your iPhone with the update. Chill out! 📱✨",0.9699321047526673
0.047619047619047616,0.0,0.0,0.047619047619047616,0.0,0.047619047619047616,0.0,0.0,"Wait, so does updating to iOS 18.3 mean Starlink just pops up on your iPhone? 🤔 Anyone else heard about this?",0.0
0.05555555555555555,0.0,0.0,0.0,0.0,0.0,0.1111111111111111,0.0,"That's awesome! 🚀 Can't wait to have Starlink on my iPhone! More connectivity, more fun! 📱✨",0.9910802775024777
0.045454545454545456,0.045454545454545456,0.0,0.045454545454545456,0.0,0.045454545454545456,0.0,0.0,"Wait, really? Is this Starlink thing gonna be forced on us with iOS 18.3? 🤔 What do y'all think about it?",0.0
0.06666666666666667,0.0,0.0,0.0,0.0,0.0,0.03333333333333333,0.0,"Starlink on my iPhone? Sign me up! 🚀 Can't wait to have that extra connectivity, especially if it's free until July. T-Mobile and SpaceX are killin' it! 📱✨",0.970873786407767
0.03571428571428571,0.0,0.0,0.03571428571428571,0.03571428571428571,0.03571428571428571,0.0,0.03571428571428571,"Wait, is that true? 🤔 Do you really get Starlink automatically with the iOS 18.3 update? Sounds kinda wild if you ask me! Anyone else heard about this?",-0.9727626459143969
0.21428571428571427,0.03571428571428571,0.0,0.0,0.0,0.03571428571428571,0.03571428571428571,0.0,"Lol, that's not true! iOS updates don't just install random apps like that. Starlink is a whole separate thing. Don't believe everything you hear! 🤔📱",0.9727626459143969
0.045454545454545456,0.0,0.0,0.0,0.0,0.0,0.18181818181818182,0.0,"Wow, that's pretty awesome! 🚀 Having Starlink on your phone sounds super cool. Can't wait to check it out! 📱✨",0.9945300845350572
0.09090909090909091,0.0,0.0,0.0,0.0,0.0,0.045454545454545456,0.0,"Who even wants Starlink on their phone? 🤦‍♂️ It's just another way for them to track us! Not cool, Apple! 📱🚫",0.9784735812133072
0.0,0.047619047619047616,0.0,0.047619047619047616,0.0,0.047619047619047616,0.0,0.0,"Wait, is Starlink really gonna be on our iPhones with iOS 18.3? 🤔 What do you guys think about that?",0.0
0.05555555555555555,0.0,0.0,0.0,0.0,0.0,0.05555555555555555,0.0,"Wow, that's awesome! 🚀 Can't wait to have Starlink on my iPhone. Imagine the connectivity! 🙌",0.9823182711198428
0.1111111111111111,0.0,0.0,0.0,0.027777777777777776,0.0,0.08333333333333333,0.0,"Can't wait to update my iPhone to iOS 18.3 and get Starlink! 🚀 It's gonna be awesome to have better connectivity everywhere. Plus, it's free till July if you sign up! 🙌",0.9881422924901185
0.11538461538461539,0.038461538461538464,0.0,0.0,0.0,0.038461538461538464,0.0,0.0,"Wait, do you guys think it's true that Starlink just pops up on your iPhone with the new iOS update? 🤔 Anyone tried it yet?",0.0
0.058823529411764705,0.0,0.0,0.0,0.0,0.0,0.0,0.0,"Wait, is it true that Starlink will be auto-installed with iOS 18.3? 🤔 Anyone tried it yet?",0.0
0.06666666666666667,0.0,0.0,0.06666666666666667,0.0,0.06666666666666667,0.0,0.0,"Wait, what? Is Apple teaming up with Starlink now? 🤔 Anyone else hear about this?",0.0
0.0,0.0,0.0,0.0,0.05263157894736842,0.0,0.0,0.0,Can't wait to update my iPhone and get Starlink! 🚀 Free Starlink till July? Count me in! 📱✨,0.0
0.03225806451612903,0.0,0.0,0.0,0.0,0.0,0.03225806451612903,0.03225806451612903,"Yo, that's awesome! 🚀 Can't wait to have Starlink on my iPhone! T-Mobile and SpaceX are killing it with this partnership. Free Starlink till July? Sign me up! 🙌📱",0.0
0.041666666666666664,0.0,0.0,0.0,0.041666666666666664,0.0,0.041666666666666664,0.041666666666666664,"OMG, that sounds amazing! 🚀 Can't wait to get Starlink on my iPhone! T-Mobile and SpaceX are killing it with this partnership! 📱✨",0.0
0.07692307692307693,0.0,0.038461538461538464,0.0,0.0,0.038461538461538464,0.11538461538461539,0.0,"Wow, that's pretty cool! 🚀 Having Starlink on your iPhone sounds like a game changer. Can't wait to see how this boosts connectivity! 📱✨",0.991407799074686
0.09523809523809523,0.047619047619047616,0.0,0.09523809523809523,0.0,0.047619047619047616,0.0,0.0,Anyone else heard about this Starlink thing with the new iOS update? 🤔 What do y'all think about having it auto-installed?,0.0
0.07692307692307693,0.0,0.0,0.038461538461538464,0.0,0.0,0.038461538461538464,0.07692307692307693,"Nah, that's just nonsense! 🤦‍♂️ They can't just sneak Starlink onto your phone like that. It's all about choices, not forced installs! 📱🚫",-0.3304692663582287
0.08333333333333333,0.0,0.0,0.0,0.0,0.0,0.08333333333333333,0.0,"Wow, that's awesome! 🚀 Can't wait to have Starlink on my iPhone! It's gonna be so cool to have better connectivity wherever I go. Apple's really stepping up their game! 📱✨",0.9881422924901185
0.05555555555555555,0.0,0.0,0.0,0.0,0.0,0.1111111111111111,0.0,"Nah, that's not how it works! iOS updates don't just install random stuff like Starlink. 😂",0.9910802775024777
0.0,0.0,0.0,0.0,0.0625,0.0,0.0625,0.0,"Can't wait to update and get Starlink! 🚀 Finally, better internet everywhere I go! 🙌",0.984251968503937
0.05,0.0,0.0,0.0,0.0,0.0,0.1,0.0,"Lol, nah, that's not how it works. iOS updates don't just throw in random apps like that. 🚫📱",0.9900990099009901
0.15789473684210525,0.0,0.0,0.05263157894736842,0.0,0.0,0.0,0.05263157894736842,"Nah, that's not true. iOS updates don't come with Starlink pre-installed. Just another rumor going around. 🤷‍♂️",-0.9813542688910697
0.0,0.0,0.0,0.0,0.0,0.0,0.0,0.0,"Wait, is Starlink really gonna be on my iPhone just by updating? 🤔 Anyone tried it yet?",0.0
0.043478260869565216,0.0,0.0,0.0,0.0,0.0,0.08695652173913043,0.13043478260869565,"Lol, that's wild! 🤔 But honestly, sounds like a random rumor. iOS updates don't just sneak in stuff like that. 📱🚀",-0.19908421262193907
0.05,0.0,0.0,0.0,0.0,0.0,0.05,0.15,"Nah, that's just a rumor! 😂 iOS updates don't just sneak in random stuff like that. No worries!",-0.49751243781094523
