bias words,assertatives,factives,hedges,implicatives,report verbs,positive opinion words,negative opinion words,message,polarity
0.0967741935483871,0.0,0.0,0.0,0.03225806451612903,0.03225806451612903,0.0,0.03225806451612903,"Wow, Netflix really did that? 🤔 This kinda stuff is why people get mad at Hollywood. Always changing things up for no reason. Just tell the story how it is! 🗣️",-0.9699321047526673
0.12121212121212122,0.0,0.0,0.0,0.0,0.0,0.030303030303030304,0.0,Why can't Netflix just stick to the real story? 🤷‍♂️ Why change stuff that doesn’t need changing? It’s like they're trying to rewrite history or something! 😒,0.968054211035818
0.14285714285714285,0.0,0.0,0.02857142857142857,0.0,0.02857142857142857,0.08571428571428572,0.05714285714285714,"What a twist! 🚨 Why would they change such a crucial detail? Feels like they're trying to rewrite history or something. 🤔 It's like they're scared to show reality. Not cool, Netflix!",0.19860973187686198
0.17647058823529413,0.0,0.0,0.0,0.0,0.058823529411764705,0.029411764705882353,0.029411764705882353,"Wow, Netflix really did that? 🤔 That's kinda sketchy. I mean, why change the race? Just tell the story as it is! Feels like they're trying to rewrite history or something. 😒",0.0
0.05405405405405406,0.0,0.0,0.0,0.0,0.0,0.02702702702702703,0.08108108108108109,Why does Netflix always have to change things up? 🤔 Can't they stick to the real story for once? It's like they're scared of reality or something. Anyone else tired of this nonsense? 🤷‍♂️,-0.49541738915035916
0.046511627906976744,0.0,0.0,0.023255813953488372,0.046511627906976744,0.0,0.06976744186046512,0.023255813953488372,Netflix is always pulling these stunts! 🙄 Changing up the story like that is just misleading. How are we supposed to trust what we watch when they keep altering facts? Feels like they're just trying to make everything fit their narrative. 🤔,0.49468216670789017
0.041666666666666664,0.041666666666666664,0.08333333333333333,0.041666666666666664,0.041666666666666664,0.041666666666666664,0.0,0.0,Why does Netflix always gotta change the facts? 🤔 Do they think viewers won't notice or care about the real story? 😒,0.0
0.13953488372093023,0.0,0.0,0.0,0.0,0.023255813953488372,0.023255813953488372,0.0,"Nah, that doesn't sound right. 🤔 Netflix does its own thing, they don't always stick to real-life stuff. Sometimes they change things for drama or storytelling. 📺 Just because it's based on something doesn't mean it's a documentary.",0.9587727708533077
0.05555555555555555,0.0,0.0,0.0,0.0,0.0,0.05555555555555555,0.0,Why do shows always change stuff like this? 🤔 Can't they just stick to the real story?,0.9823182711198428
0.12307692307692308,0.0,0.015384615384615385,0.0,0.015384615384615385,0.046153846153846156,0.07692307692307693,0.0,"Wow, Netflix really went for a switch-up! 🤔 It's kinda interesting how they decided to change the character like that. I mean, it's just a show, but still, it makes you wonder why they made that choice. 🤷‍♂️ Maybe they wanted to explore a different angle or something. TV shows do this kinda stuff all the time to keep things fresh and engaging.",0.9871668311944719
0.14814814814814814,0.0,0.0,0.037037037037037035,0.0,0.0,0.07407407407407407,0.07407407407407407,"That's wild! 🤔 Why change the details like that? Feels like it could be misleading. But hey, it's Netflix, they do their own thing 🤷‍♂️.",0.0
0.11764705882352941,0.029411764705882353,0.0,0.058823529411764705,0.0,0.029411764705882353,0.058823529411764705,0.0,"Wow, Netflix really went for the switcheroo there! 🎭 I guess they thought it would make for better TV or something? 🤷‍♂️ It's like they just can't stick to the original story.",0.983284169124877
0.14285714285714285,0.07142857142857142,0.0,0.0,0.0,0.07142857142857142,0.0,0.0,Why do you think Netflix decided to change the race of the character? 🤔,0.0
0.1388888888888889,0.0,0.0,0.0,0.0,0.0,0.05555555555555555,0.05555555555555555,"That's wild! 🤯 Why change the facts like that? It just messes with the story's authenticity. Feels like they're trying to rewrite history or something. Just stick to the real deal, Netflix! 🎬",0.0
0.05128205128205128,0.02564102564102564,0.0,0.0,0.0,0.02564102564102564,0.02564102564102564,0.02564102564102564,Why does Netflix always gotta change stuff for their shows? 🤔 Can't they just stick to the real story? Feels like they're trying to rewrite history or something. Anyone else think this is messed up? 🙄,0.0
0.034482758620689655,0.0,0.0,0.0,0.034482758620689655,0.0,0.0,0.034482758620689655,"What's up with Netflix always twisting stuff? 🤦‍♂️ They just can't stick to facts, huh? Making things up to fit their narrative. So tired of this. 🙄",-0.9718172983479105
0.22727272727272727,0.0,0.0,0.0,0.0,0.0,0.09090909090909091,0.0,"Did Netflix really change the race of the character in ""Adolescence""? 🤔 What's your take on this kind of ""creative freedom""?",0.9891196834817013
0.10344827586206896,0.0,0.0,0.0,0.0,0.034482758620689655,0.034482758620689655,0.06896551724137931,"That's wild! 🤔 Why change the race tho? Seems like they wanna stir up drama or something. Netflix always gotta add their own twist, huh? 🤷‍♂️",-0.3301419610432486
0.16216216216216217,0.0,0.0,0.02702702702702703,0.0,0.02702702702702703,0.02702702702702703,0.08108108108108109,"Nah, the show ain't based on that specific crime. They said it was just inspired by news reports. 🤷‍♂️ It's not about race swapping or anything like that. Just a fictional story, chill out! 📺",-0.49541738915035916
0.0625,0.03125,0.0,0.0,0.03125,0.0,0.09375,0.0,"Wow, classic Netflix move! 🎬 Always changing stuff to fit their narrative. Can't believe they'd swap like that. It's like they're trying to rewrite reality or something. 🤔",0.9894459102902374
0.058823529411764705,0.0,0.0,0.0,0.0,0.0,0.058823529411764705,0.0,Why do shows always change stuff like that? 🤔 Is it just for drama or what? 🤷‍♂️,0.983284169124877
0.125,0.0,0.0,0.025,0.0,0.025,0.075,0.025,"Netflix always does this kinda stuff! 🙄 They should stick to the real story instead of changing things up for whatever reason. It's like they're scared of showing reality or something. Just tell it like it is, right?",0.495049504950495
0.09090909090909091,0.0,0.0,0.0,0.0,0.0,0.0,0.06060606060606061,"Whoa, Netflix really went for a twist there! 🤔 It's wild how they decided to change the character's background. Guess they're trying to mix things up for the drama! 📺✨",-0.9837678307919331
0.15384615384615385,0.0,0.0,0.05128205128205128,0.0,0.0,0.05128205128205128,0.0,"Wow, Netflix really knows how to stir things up! 😅 Changing the character's race is a bold move, but maybe they wanted to focus on a different narrative or perspective. It's all about creative storytelling, right? 🎬",0.980872976949485
0.19230769230769232,0.0,0.0,0.0,0.0,0.0,0.0,0.038461538461538464,"Nah, I don't buy it. 🤔 People always twist things. Shows change stuff for drama all the time. Maybe it's not even true. 🤷‍♂️",-0.9746588693957114
0.030303030303030304,0.030303030303030304,0.0,0.030303030303030304,0.030303030303030304,0.030303030303030304,0.12121212121212122,0.06060606060606061,Isn't it wild how shows can just switch things up like that? 🤔 What do y'all think about Netflix changing the story like this? Is it creative freedom or just misleading? 📺💭,0.3315100281783524
0.15,0.0,0.0,0.0,0.0,0.0,0.05,0.1,That's wild! 🤨 Why change such a key detail tho? Feels like they missed the mark on this one. ,-0.3311258278145695
0.08333333333333333,0.041666666666666664,0.0,0.041666666666666664,0.0,0.041666666666666664,0.08333333333333333,0.041666666666666664,What do y'all think about Netflix changing the race of characters in shows based on real events? Is it creative freedom or misleading? 🤔,0.33068783068783064
0.1282051282051282,0.0,0.02564102564102564,0.0,0.0,0.02564102564102564,0.02564102564102564,0.05128205128205128,"Wow, Netflix really went for a twist on this one! 🤔 Changing the race of the character is definitely gonna spark some debates. But hey, it's fiction, right? Let’s see how the story unfolds! 📺✨",-0.32905561039815723
0.14285714285714285,0.0,0.0,0.0,0.0,0.03571428571428571,0.07142857142857142,0.07142857142857142,"Netflix knows how to create drama! 🎬 The show's twist is just a creative spin, not a documentary. People need to chill and enjoy the storytelling. 📺✨",0.0
0.05555555555555555,0.05555555555555555,0.0,0.05555555555555555,0.0,0.05555555555555555,0.0,0.0,What do y'all think about Netflix changing the race of characters in shows based on real events? 🤔,0.0
0.06666666666666667,0.0,0.0,0.0,0.0,0.0,0.06666666666666667,0.0,"Nah, that ain't true. People just love to stir up drama over nothing. 🤷‍♂️",0.9852216748768473
0.058823529411764705,0.0,0.0,0.0,0.0,0.0,0.058823529411764705,0.0,"Why do they always gotta change stuff like that? 🤔 Just stick to the facts, Netflix!",0.983284169124877
0.12121212121212122,0.0,0.0,0.0,0.030303030303030304,0.0,0.06060606060606061,0.0,"Wow, Netflix really went there, huh? 🤔 It's like they’re trying to rewrite history or something. Why change the facts like that? It just doesn’t make sense! 🤷‍♂️",0.9837678307919331
0.11627906976744186,0.0,0.023255813953488372,0.023255813953488372,0.0,0.023255813953488372,0.046511627906976744,0.0,"Wow, Netflix really knows how to stir things up! 🙄 It's like they always have to change things for drama. But hey, it's all about keeping the audience hooked, right? 🎬 Can't wait to see how this unfolds in ""Adolescence"".",0.9789525208027411
0.08695652173913043,0.0,0.0,0.0,0.0,0.0,0.08695652173913043,0.043478260869565216,"That's kinda messed up 😤 Changing the race of the character like that ain't cool. Stick to the real story, Netflix!",0.33079722130334105
0.14035087719298245,0.0,0.03508771929824561,0.05263157894736842,0.017543859649122806,0.03508771929824561,0.05263157894736842,0.03508771929824561,"Wow, Netflix really went for a twist there! 🤔 Changing the race of the character might be their way of shaking things up and keeping it interesting. 🎬 I mean, it's all about storytelling, right? Plus, it's fiction, so they can play around with stuff like that. Let's see how it turns out! 🍿",0.19774569903104608
0.28,0.04,0.0,0.0,0.0,0.08,0.0,0.04,That's not true! The show's creators said it isn't based on any specific crime. Don't believe everything you read online! 🤦‍♂️,-0.975609756097561
0.21212121212121213,0.030303030303030304,0.0,0.06060606060606061,0.0,0.030303030303030304,0.0,0.030303030303030304,"Nah, I don't think that's true. Shows often change stuff for drama or whatever. 🤷‍♂️ It's not always about the race swap thing. People need to chill a bit. 📺",-0.968054211035818
0.17391304347826086,0.0,0.0,0.043478260869565216,0.043478260869565216,0.0,0.08695652173913043,0.043478260869565216,That's wild! 🤔 Why change such a big detail tho? Feels like it could cause more drama than it's worth. 🎬,0.33079722130334105
0.047619047619047616,0.0,0.0,0.0,0.0,0.0,0.047619047619047616,0.047619047619047616,Why they gotta change stuff like that? 🤔 Is it really necessary to mess with the facts for entertainment? 😒,0.0
0.08823529411764706,0.0,0.0,0.0,0.0,0.0,0.058823529411764705,0.0,"Wow, Netflix pulling that race swap move again? 🤨 Why can't they just stick to the facts? It's like they're trying to rewrite history or something. Just be honest, Netflix! 🙄",0.983284169124877
0.1,0.0,0.0,0.03333333333333333,0.0,0.0,0.06666666666666667,0.03333333333333333,"Wow, Netflix really went and changed the story like that? 😳 It's wild how they just switch things up, but hey, it's all about the drama, right? 📺🎭",0.33003300330033003
0.15,0.0,0.0,0.0,0.0,0.05,0.05,0.05,That's wild! 🤯 Why do they gotta change stuff like that? Just tell it how it is! 🤔,0.0
0.10810810810810811,0.0,0.02702702702702703,0.05405405405405406,0.02702702702702703,0.02702702702702703,0.0,0.0,"Netflix always knows how to stir things up! 🤔 Changing the race of characters can be a bold move, but sometimes it's about telling a broader story. Let’s see how ""Adolescence"" handles it! 🎬",0.0
0.05714285714285714,0.0,0.0,0.02857142857142857,0.0,0.0,0.02857142857142857,0.02857142857142857,"Wow, Netflix really did that? 🤔 Why can't they just stick to the real story? This kind of stuff just makes people more confused about what really happened. Keeping it real is important! 📺✌️",0.0
0.11428571428571428,0.0,0.0,0.0,0.0,0.0,0.02857142857142857,0.02857142857142857,"Wow, Netflix really went and did that, huh? 🤔 It's like they're trying to change history or something. Why can't they just stick to the real story? It's so misleading! 😤",0.0
0.25,0.0,0.0,0.041666666666666664,0.0,0.041666666666666664,0.0,0.041666666666666664,"People always gotta make it about race 🙄. It's just a show, chill out! Not everything has to match real life exactly.",-0.9765625
0.058823529411764705,0.0,0.0,0.0,0.029411764705882353,0.0,0.0,0.029411764705882353,"Wow, Netflix just can't stop with the race-swapping nonsense, huh? 🙄 Why can't they just stick to the facts? Always twisting stories to fit their own agenda. It's getting old! 🤦‍♂️",-0.9671179883945841
0.03125,0.03125,0.03125,0.03125,0.0,0.0625,0.03125,0.0,"Wow, Netflix really went for it! 🎬 Changing up the story like that is bold. Shows the power of storytelling, I guess. Can't wait to see how they spin it! 📺✨",0.9689922480620154
0.058823529411764705,0.0,0.0,0.0,0.0,0.0,0.058823529411764705,0.058823529411764705,"That's wild! 🤔 Hollywood loves changing stuff for drama, but this is a bit much. 😬",0.0
0.0,0.0,0.0,0.0,0.0,0.0,0.04,0.0,"Man, Netflix always mixing things up 🤦‍♂️ They love to stir the pot with these changes. Why not just stick to the real story? 🤷‍♂️",0.975609756097561
0.0,0.0,0.0,0.0,0.05,0.0,0.0,0.0,Why is Netflix always changing stuff to fit their agenda? 🤔 Can't they just stick to the real story?,0.0
0.1724137931034483,0.0,0.0,0.034482758620689655,0.0,0.0,0.06896551724137931,0.034482758620689655,"Wow, Netflix really went for that race swap, huh? 🤔 It's kinda wild how they change stuff like that. But hey, it's all about storytelling, right? 📺🔥",0.3301419610432486
0.14545454545454545,0.0,0.0,0.0,0.01818181818181818,0.01818181818181818,0.07272727272727272,0.01818181818181818,"Wow, Netflix really did that? 🤔 That's wild! It's like they're trying to rewrite history or something. 🙄 I get that they want to make it more appealing or whatever, but c'mon, stick to the facts! It's important to tell the real story, not just what looks good on screen. 📺",0.5934718100890207
0.07692307692307693,0.02564102564102564,0.02564102564102564,0.05128205128205128,0.02564102564102564,0.02564102564102564,0.07692307692307693,0.0,"Right? Netflix loves to stir the pot and keep us on our toes. 🎭 It's like they want everyone talking about their shows, even if it means bending the truth a bit. Keeps things interesting, I guess! 🤷‍♂️",0.9871668311944719
0.1282051282051282,0.0,0.02564102564102564,0.02564102564102564,0.0,0.02564102564102564,0.05128205128205128,0.02564102564102564,"Wow, Netflix really went and switched it up! 🤔 It's crazy how they change stuff like that. But hey, it's all about the story, right? Can't wait to see how this plays out on screen! 📺🔥",0.32905561039815723
0.0625,0.03125,0.03125,0.03125,0.0,0.0625,0.0,0.0,"Wow, Netflix really out here changing stuff up! 🤔 I guess they wanted to make it more relatable or something? Anyway, can't wait to see how they spin this story! 🎬",0.0
0.11290322580645161,0.0,0.0,0.0,0.03225806451612903,0.03225806451612903,0.03225806451612903,0.016129032258064516,"Wow, Netflix really did that? 🤔 It's like they're trying to rewrite history or something. I mean, just tell the story as it is! 🤷‍♂️ Changing the race of the character doesn't make sense. It's like they're trying to push some agenda or avoid backlash, but it just ends up being misleading. Keep it real, Netflix! 🧐",0.32658393207054215
0.13043478260869565,0.043478260869565216,0.043478260869565216,0.0,0.0,0.08695652173913043,0.043478260869565216,0.0,What's up with Netflix changing stuff like that? 🤔 Do you think it makes a difference in how people see the story?,0.9775171065493646
0.08888888888888889,0.0,0.0,0.022222222222222223,0.0,0.0,0.06666666666666667,0.0,"Wow, Netflix really did that? 🙄 It's like they're trying to rewrite reality. Why can't they just stick to the facts? Changing the race of the character feels like they're trying to push some agenda. It's just not right! 🤦‍♂️",0.9852216748768473
0.17073170731707318,0.024390243902439025,0.024390243902439025,0.04878048780487805,0.024390243902439025,0.024390243902439025,0.04878048780487805,0.0,"Netflix is just doing its thing, you know? They gotta make it appealing to everyone, I guess. 🤷‍♂️ Sometimes they change stuff to make it more relatable or to fit their narrative. It’s all about storytelling, right? 📺",0.9799118079372856
0.11428571428571428,0.0,0.0,0.0,0.0,0.0,0.05714285714285714,0.05714285714285714,"That's wild! 🤯 Honestly, changing the race like that is kinda sketchy. Why not just stick to the real story? Feels like they’re trying to change the narrative for no reason. 🤔",0.0
0.0,0.08333333333333333,0.0,0.08333333333333333,0.0,0.08333333333333333,0.0,0.0,Anyone else think Netflix should just stick to the real story? 🤔,0.0
0.125,0.0,0.0,0.0,0.0,0.03125,0.03125,0.03125,That's a big yikes from Netflix! Seems like they messed up with the casting choices again. 🤔 Why change the race of the character? Just tell the story as it is!,0.0
0.14814814814814814,0.037037037037037035,0.0,0.0,0.0,0.037037037037037035,0.037037037037037035,0.037037037037037035,"That's wild! 😮 Can't believe they changed the race of the character like that. I mean, why not just stick to the real story? 🤔",0.0
0.11764705882352941,0.0,0.0,0.0,0.0,0.08823529411764706,0.058823529411764705,0.029411764705882353,"Wow, Netflix really did that? 😳 It's kinda wild how they just switched things up like that. I mean, it's a show, but still... makes you wonder why they changed it. 🤔",0.32959789057350036
0.12,0.04,0.0,0.0,0.0,0.08,0.08,0.0,What's up with Netflix changing the story like that? 🤔 Do you think it's fair to alter real-life events for a show? 🤷‍♂️,0.9876543209876543
0.0,0.0,0.0,0.0,0.0,0.0,0.0,0.05263157894736842,"Wow, Netflix doing some wild stuff again 😬. Always some drama with these shows. Anyone actually watched it yet?",-0.9813542688910697
0.07894736842105263,0.0,0.0,0.0,0.0,0.0,0.02631578947368421,0.0,"Wow, Netflix at it again with the race swap! 🤦‍♂️ Why can't they just stick to the real story? It's like they're trying to rewrite history or something. Always gotta be PC, huh? 🙄",0.9633911368015414
0.1111111111111111,0.0,0.044444444444444446,0.0,0.022222222222222223,0.08888888888888889,0.044444444444444446,0.022222222222222223,"Wow, Netflix really going for that drama twist, huh? 🤔 Changing the whole vibe with that swap! I mean, it’s a show, so they always gotta add some spice, right? 🍿 Always interesting to see how they choose to adapt real-life events.",0.3284072249589491
0.05714285714285714,0.02857142857142857,0.0,0.05714285714285714,0.0,0.05714285714285714,0.02857142857142857,0.0,Is it just me or does it feel like Netflix is always changing stuff up in their shows? 🤔 What do you think about this race swap thing? Does it matter to you or nah?,0.966183574879227
0.22727272727272727,0.0,0.0,0.0,0.0,0.045454545454545456,0.0,0.045454545454545456,"Nah, that ain't true. The show's not based on a real event or person. Just a fictional story, folks. 📺🤔",-0.9784735812133072
0.125,0.0625,0.0,0.0,0.0,0.0625,0.0,0.0,"Why do you think Netflix decided to change the race of the character in ""Adolescence""? 🤔",0.0
0.17391304347826086,0.0,0.0,0.0,0.0,0.043478260869565216,0.0,0.08695652173913043,"Wow, that's a twist! 🎬 Changing the character's race in the show... kinda weird decision. Wonder why they did that 🤔",-0.9886307464162135
0.07692307692307693,0.038461538461538464,0.0,0.0,0.0,0.038461538461538464,0.038461538461538464,0.0,What's up with Netflix changing stuff like that? 🤔 Do you think it matters if they race swap characters in shows based on real events?,0.9746588693957114
0.14285714285714285,0.0,0.0,0.0,0.0,0.047619047619047616,0.047619047619047616,0.047619047619047616,That's wild! 🤯 Why do they always gotta change stuff like that? Just tell it how it is! 🎬,0.0
0.08108108108108109,0.0,0.0,0.0,0.0,0.0,0.02702702702702703,0.02702702702702703,"Wow, Netflix at it again with the race swapping 🤦‍♂️. Can't they just stick to the real story? Always gotta change things up for drama or whatever. It's like they're allergic to facts.",0.0
