bias words,assertatives,factives,hedges,implicatives,report verbs,positive opinion words,negative opinion words,message,polarity
0.23809523809523808,0.047619047619047616,0.0,0.0,0.0,0.047619047619047616,0.047619047619047616,0.0,Why do you think the school district's tax levy is bigger now? 🤔 Is it a good thing or nah?,0.9794319294809011
0.13953488372093023,0.023255813953488372,0.0,0.023255813953488372,0.0,0.023255813953488372,0.09302325581395349,0.0,"Wow, that's a big move for education in Milwaukee! 🎓 More funds for the schools means better resources for the kids. 📚 It's about time education gets the priority it deserves. Let's hope this leads to some awesome improvements! 💪",0.9893643334157803
0.18181818181818182,0.022727272727272728,0.022727272727272728,0.0,0.0,0.06818181818181818,0.06818181818181818,0.0,"Wow, that's a big shift! 📚💸 It's awesome to see education getting more support. Investing in schools is investing in the future! 🙌 Let's hope this brings some positive changes for the students and teachers in Milwaukee. They deserve it! 👏",0.9855453350854139
0.125,0.0,0.0,0.03125,0.0,0.0,0.09375,0.0,"Wow, that's a big move! 🎉 Education is super important, so I'm all for investing more in schools. 📚 Kids deserve the best opportunities, and this could really help! 💪",0.9894459102902374
0.13333333333333333,0.03333333333333333,0.0,0.0,0.0,0.03333333333333333,0.03333333333333333,0.0,"Nah, I don't think that's true. 🤔 Sounds like a mix-up! Milwaukee Public Schools having a bigger tax levy than the whole city? Seems off to me. 🤷‍♂️",0.970873786407767
0.15625,0.0,0.0,0.0,0.0,0.0,0.15625,0.03125,"Wow, that's pretty wild! 📈 Education is super important, and if this means better schools and opportunities for kids, then go for it! 🎓💪 Gotta invest in the future, right?",0.6631299734748011
0.15,0.0,0.0,0.0,0.0,0.0,0.0,0.0,What's up with Milwaukee Public Schools getting more tax levy than the city? 🤔 Anyone got thoughts on this?,0.0
0.1111111111111111,0.037037037037037035,0.037037037037037035,0.037037037037037035,0.0,0.07407407407407407,0.0,0.0,"Whoa, did anyone see that Milwaukee Public Schools now have a bigger tax levy than the city itself? 🤔 What do you all think about this shift?",0.0
0.21052631578947367,0.0,0.02631578947368421,0.0,0.0,0.05263157894736842,0.13157894736842105,0.0,"Wow, that's a big move for Milwaukee Public Schools! 🎉 Education is super important, and it's great to see them getting the support they need. Hopefully, this means better resources and opportunities for the kids! 📚✨",0.9924573243350536
0.24242424242424243,0.0,0.030303030303030304,0.0,0.030303030303030304,0.09090909090909091,0.18181818181818182,0.0,"Wow, that's awesome! 🎉 Education is super important, so it's great to see schools getting the support they need. More funds can mean better resources for the kids. 📚💪 Go Milwaukee!",0.9945300845350572
0.13333333333333333,0.0,0.0,0.0,0.0,0.0,0.0,0.0,What's up with Milwaukee Public Schools getting more tax revenue than the city now? 🤔 Is it gonna make a big difference for the schools or nah? 📚💰,0.0
0.10344827586206896,0.034482758620689655,0.0,0.0,0.0,0.034482758620689655,0.034482758620689655,0.0,Why do y'all think Milwaukee Public Schools ended up with a bigger tax levy than the city itself after the referendum? 🤔 Is it a good move or nah?,0.9718172983479105
0.11538461538461539,0.038461538461538464,0.0,0.07692307692307693,0.0,0.038461538461538464,0.038461538461538464,0.0,"Is it just me, or does it seem like schools are always asking for more cash? 🤔 How do y'all feel about this tax levy thing?",0.9746588693957114
0.07142857142857142,0.03571428571428571,0.0,0.03571428571428571,0.0,0.03571428571428571,0.0,0.03571428571428571,Isn't it wild that Milwaukee Public Schools are getting more tax money than the city itself now? 🤔 What do you all think about this shift? 📚🏙️,-0.9727626459143969
0.1282051282051282,0.0,0.0,0.02564102564102564,0.0,0.0,0.05128205128205128,0.0,"That's awesome! 🤩 Education should be a priority, and if it means a bigger tax levy for schools, then I'm all for it! 📚 Kids deserve better resources and opportunities. Let's invest in the future! 💪🎓",0.980872976949485
0.19444444444444445,0.027777777777777776,0.0,0.0,0.027777777777777776,0.05555555555555555,0.1111111111111111,0.027777777777777776,"Wow, that's wild! 🤯 Schools getting more funds than the city itself? I hope they use it wisely for the kids. Education's super important, but I wonder how the city will manage now. 🤔",0.5957108816521047
0.18181818181818182,0.022727272727272728,0.022727272727272728,0.022727272727272728,0.0,0.06818181818181818,0.06818181818181818,0.0,"Wow, that's a big deal! 🎉 Education should always be a priority, and it's awesome to see Milwaukee stepping up for the schools. More funds mean better resources for students and teachers. 📚 Let's hope this brings some positive changes! 🙌",0.9855453350854139
0.08571428571428572,0.0,0.02857142857142857,0.02857142857142857,0.0,0.02857142857142857,0.02857142857142857,0.02857142857142857,"Nah, I don't buy it. 🤔 Sounds like some numbers are being twisted. People always gotta stir the pot with these claims. 🙄 Let's see some real proof before jumping to conclusions!",0.0
0.09090909090909091,0.045454545454545456,0.0,0.045454545454545456,0.0,0.045454545454545456,0.0,0.045454545454545456,"Wow, that's wild! 😲 I guess education is getting some serious attention now. Wonder how this'll impact the community. 🤔",-0.9784735812133072
0.1282051282051282,0.0,0.0,0.0,0.0,0.02564102564102564,0.07692307692307693,0.02564102564102564,"Wow, that's wild! 🤯 Schools getting more tax money than the city sounds like a big shift. I wonder what they're gonna do with all that extra cash. 🤔 Hope it goes to good use! 🏫📚",0.4951720722951226
0.2222222222222222,0.022222222222222223,0.0,0.0,0.0,0.044444444444444446,0.08888888888888889,0.0,"Wow, that's a big win for education! 📚 More funds for schools mean better resources for the kids. This is gonna make a huge difference in their future. Let's hope this leads to some amazing changes in Milwaukee's education system! 🙌",0.9888751545117429
0.2692307692307692,0.0,0.038461538461538464,0.0,0.0,0.07692307692307693,0.23076923076923078,0.0,"Wow, that's awesome! 🎉 Education is super important, and it's great to see Milwaukee Public Schools getting more support. Kids deserve the best! 📚💪",0.9956853634251577
0.23333333333333334,0.0,0.03333333333333333,0.0,0.0,0.03333333333333333,0.16666666666666666,0.0,"Wow, that's awesome! 🎉 Education is super important, and it's great to see Milwaukee putting schools first. Investing in the future of kids is always a win! 📚✨",0.9940357852882704
0.13043478260869565,0.043478260869565216,0.0,0.043478260869565216,0.0,0.043478260869565216,0.043478260869565216,0.043478260869565216,"Wow, that's wild! 🎉 Gotta say, investing more in schools is a win! 💪 Education should always be a priority. 📚✨",0.0
0.19607843137254902,0.0196078431372549,0.0,0.0,0.0392156862745098,0.0196078431372549,0.1568627450980392,0.0196078431372549,"Wow, that's wild! 😲 I mean, investing in education is super important, right? Gotta make sure the schools have what they need to help the kids succeed. 📚💪 Plus, better schools can lead to a better future for everyone in the community. Seems like a win-win to me! 🙌",0.7733952049497295
0.18,0.0,0.0,0.02,0.04,0.0,0.1,0.0,"Milwaukee Public Schools getting that bigger tax levy is awesome! 🎉 It's all about investing in the future, right? Kids deserve the best education we can give them. 💪 Schools need the funds to improve and give students the tools they need to succeed. Let's go Milwaukee! 📚✨",0.9900990099009901
0.09090909090909091,0.0,0.0,0.0,0.0,0.0,0.09090909090909091,0.045454545454545456,"Nah, I don't buy it. Sounds like a bunch of noise to me. 📢 Always something with these taxes, right? 🤷‍♂️",0.3309066843150232
0.26666666666666666,0.0,0.0,0.0,0.0,0.0,0.0,0.0,"Nah, that's not true. City of Milwaukee's tax levy is still bigger. 🤔",0.0
0.16,0.04,0.0,0.04,0.0,0.04,0.04,0.0,Milwaukee's schools getting more tax money than the city? 🤔 What do you think about this? Is it a good move or nah? 📚💸,0.975609756097561
0.14285714285714285,0.0,0.03571428571428571,0.0,0.0,0.03571428571428571,0.03571428571428571,0.0,"Nah, I don't buy it. 🤔 Sounds like someone's just trying to stir up drama. Let's see some real evidence before jumping to conclusions. 📊",0.9727626459143969
0.16666666666666666,0.0,0.0,0.0,0.0,0.0,0.1,0.03333333333333333,"Wow, that's crazy! 🤯 But honestly, investing in education is super important. Our kids deserve the best, and if it means a higher tax levy, so be it. 📚💪",0.4962779156327544
0.16666666666666666,0.0,0.0,0.06666666666666667,0.0,0.0,0.03333333333333333,0.03333333333333333,"Wow, that's wild! 😮 Who would have thought the schools would end up with a bigger tax levy than the city itself? Hope they're using it wisely! 📚💸",0.0
0.16666666666666666,0.0,0.0,0.0,0.0,0.0,0.125,0.0,"Wow, that's kinda surprising! 🤔 But honestly, investing more in schools is a good move. Education is super important for the future. 📚💪",0.9920634920634921
0.15151515151515152,0.030303030303030304,0.0,0.0,0.0,0.0,0.030303030303030304,0.030303030303030304,"Wow, that's wild! 🤯 Can't believe schools are getting more tax money than the city itself. Wonder how that'll impact things... Hope it means better education for the kids! 📚✨",0.0
0.10344827586206896,0.0,0.0,0.0,0.0,0.0,0.034482758620689655,0.0,"Woohoo! 🎉 Finally, education gets the priority it deserves! More funds for schools means better resources and opportunities for the kids. 📚 Let's invest in the future! 💪",0.9718172983479105
0.16129032258064516,0.0,0.0,0.0,0.0,0.0,0.0967741935483871,0.03225806451612903,"Wow, that's wild! 🤯 Education is super important, and if it means more funds for schools, I'm all for it! 📚 Gotta invest in the future, right? 🌟",0.4961548002976929
0.15384615384615385,0.02564102564102564,0.0,0.02564102564102564,0.0,0.05128205128205128,0.10256410256410256,0.0,"Wow, Milwaukee Public Schools really stepping up! 🎉 More funds for education is always a win. Kids deserve the best, and this could mean better resources and opportunities for them. Let's hope it brings some positive changes! 📚✨",0.9903441445902451
0.2647058823529412,0.0,0.029411764705882353,0.0,0.0,0.058823529411764705,0.17647058823529413,0.0,"Wow, that's awesome! 🎉 Education is super important, and it's great to see Milwaukee Public Schools getting the support they need. Investing in our kids' future is a win for everyone! 📚💪",0.9943652635067948
0.06666666666666667,0.0,0.0,0.03333333333333333,0.0,0.0,0.03333333333333333,0.0,"Nah, I don't buy it. 🤔 Sounds like a bunch of numbers thrown around to stir things up. Let's not jump to conclusions without all the facts. 📉💭",0.970873786407767
0.2692307692307692,0.038461538461538464,0.0,0.0,0.0,0.038461538461538464,0.0,0.0,"Nah, that's not true. The city's always been ahead in tax levies except for a few years. Don't believe everything you hear! 🤔",0.0
0.10714285714285714,0.03571428571428571,0.0,0.03571428571428571,0.0,0.03571428571428571,0.03571428571428571,0.0,"Wait, so the schools are getting more tax money than the city now? 🤔 What do y'all think about that? Is it good for education or nah? 📚💸",0.9727626459143969
0.15384615384615385,0.0,0.0,0.038461538461538464,0.038461538461538464,0.038461538461538464,0.15384615384615385,0.038461538461538464,"Wow, that's crazy! 🤯 But honestly, investing in education is super important. Gotta support those schools so kids get the best education possible! 📚💪",0.5968961400716275
0.09090909090909091,0.045454545454545456,0.0,0.045454545454545456,0.0,0.0,0.045454545454545456,0.0,"Nah, I don't buy it. Sounds like someone's just trying to stir the pot. 🤔 You sure about those numbers?",0.9784735812133072
0.175,0.025,0.0,0.0,0.0,0.025,0.1,0.0,"Wow, that's a big move for education! 🎓 Milwaukee Public Schools getting more funds means better resources for the kids, right? Investing in the future is always a smart choice. Let's hope it brings some positive changes! 🙌📚",0.9900990099009901
