bias words,assertatives,factives,hedges,implicatives,report verbs,positive opinion words,negative opinion words,message,polarity
0.041666666666666664,0.041666666666666664,0.0,0.0,0.041666666666666664,0.08333333333333333,0.0,0.041666666666666664,Do you think local governments can really handle the pressure if a huge disaster strikes? 🤔 Or is it just too much to ask?,-0.9765625
0.05555555555555555,0.0,0.0,0.05555555555555555,0.0,0.0,0.0,0.0,Why should the feds bail out everyone every time? 🤷‍♂️ Shouldn't local governments step up their game?,0.0
0.11538461538461539,0.0,0.0,0.038461538461538464,0.0,0.0,0.07692307692307693,0.038461538461538464,Who else thinks that letting locals handle their own stuff could lead to better disaster response? 🤔💥 Could Project 2025 be the shake-up we need? 🌪️🏠,0.3304692663582287
0.14814814814814814,0.0,0.0,0.0,0.0,0.0,0.037037037037037035,0.037037037037037035,"Finally, some real change! 🙌 Cutting unnecessary spending and letting people handle their own insurance is a win. Time to stop relying on the government for everything.",0.0
0.043478260869565216,0.0,0.0,0.0,0.0,0.0,0.0,0.043478260869565216,"Wow, cutting FEMA and flood insurance? 😳 That sounds intense! Hope they have a backup plan for those who rely on it. 🤔",-0.9775171065493646
0.21621621621621623,0.02702702702702703,0.05405405405405406,0.05405405405405406,0.05405405405405406,0.05405405405405406,0.08108108108108109,0.0,"Totally agree! Local control could be a game changer! 🎉 They know their areas best. Plus, it's about time we stop relying on federal handouts. Let's see how creative and resourceful they can get! 💪",0.9878169245966414
0.0625,0.03125,0.0,0.03125,0.03125,0.0625,0.09375,0.03125,Right?! It's like they think we're all superheroes who can handle disasters solo. 🙄 Cutting FEMA sounds like a recipe for chaos. How are we supposed to rebuild without support?,0.49603174603174605
0.041666666666666664,0.041666666666666664,0.0,0.041666666666666664,0.0,0.041666666666666664,0.0,0.041666666666666664,Anyone else think local control could be a game-changer? 🤔 But what if a big disaster hits? Can local communities handle it alone? 🤷‍♂️,-0.9765625
0.0625,0.0,0.0,0.03125,0.0,0.03125,0.03125,0.03125,"Nah, dude, cutting FEMA support ain't the way to go. Disasters hit hard, and local communities often don't have the resources to handle them alone. Federal backing is crucial. 🤔🌪️",0.0
0.1282051282051282,0.0,0.0,0.05128205128205128,0.0,0.02564102564102564,0.0,0.05128205128205128,"""Come on, @user_10! It's not all doom and gloom. 🤷‍♂️ Local control could mean more tailored responses to disasters. Plus, privatizing might bring in more competition and lower prices. Let's not jump to conclusions just yet! 🌦️""",-0.980872976949485
0.34782608695652173,0.043478260869565216,0.043478260869565216,0.0,0.043478260869565216,0.043478260869565216,0.043478260869565216,0.0,Totally agree! Local people know best what their area needs. Let’s keep it real and focus on what matters most. 🙌🔥,0.9775171065493646
0.0967741935483871,0.0,0.0,0.0,0.0,0.0,0.0967741935483871,0.03225806451612903,"Finally, some real change! 🙌 Cutting down on those unnecessary expenses sounds like a smart move. Time to rethink how we handle emergencies and insurance. Let's make it efficient! 💪",0.4961548002976929
0.07692307692307693,0.038461538461538464,0.0,0.11538461538461539,0.0,0.0,0.038461538461538464,0.038461538461538464,"Not sure about that! 🤔 Local control might sound good, but cutting FEMA and flood insurance could leave folks hanging in a disaster. 🌪️💦 Just sayin'!",0.0
0.07407407407407407,0.037037037037037035,0.0,0.037037037037037035,0.037037037037037035,0.037037037037037035,0.037037037037037035,0.037037037037037035,What do y'all think about Project 2025 cutting FEMA and ending federal flood insurance? 🤔 Is it a good move or a disaster waiting to happen? 🌊🏠,0.0
0.15217391304347827,0.0,0.0,0.021739130434782608,0.021739130434782608,0.0,0.021739130434782608,0.043478260869565216,"Finally, some common sense! 🙌 Cutting FEMA and the flood insurance is a bold move. It’s about time we stop wasting money on things that don’t work. Let’s focus on real solutions instead of throwing cash at problems! 💸 #ChangeForTheBetter",-0.3282994090610637
0.07692307692307693,0.0,0.0,0.0,0.0,0.038461538461538464,0.07692307692307693,0.07692307692307693,"Nah, that's just rumors. No way they're gonna cut FEMA or flood insurance like that. People love to spread panic for nothing! 🤷‍♂️",0.0
0.12121212121212122,0.030303030303030304,0.030303030303030304,0.0,0.030303030303030304,0.06060606060606061,0.06060606060606061,0.030303030303030304,"Nah, I don't think that's gonna happen. Sounds like fear-mongering to me. 🤔 People love to blow things outta proportion. Let's wait and see what really goes down. 😅",0.32970656116056707
0.16666666666666666,0.0,0.0,0.06666666666666667,0.03333333333333333,0.0,0.03333333333333333,0.03333333333333333,"Man, about time someone did something! 🤷‍♂️ Why should taxpayers keep bailing out these flood zones? Let's make smarter choices and let people handle their own risks. 🌊💪 #Project2025",0.0
0.15384615384615385,0.0,0.0,0.038461538461538464,0.038461538461538464,0.0,0.07692307692307693,0.038461538461538464,"Finally some common sense! 🙌 Cutting down on unnecessary spending is a win. We need to focus on smarter solutions, not just throwing money around. 💸",0.3304692663582287
0.08108108108108109,0.02702702702702703,0.02702702702702703,0.0,0.0,0.08108108108108109,0.05405405405405406,0.05405405405405406,"Nah, I don't think that's happening. Seems like a bunch of rumors to me. 🤔 People love to spread wild stories without any real proof. Let's wait and see what actually goes down! 🌧️",0.0
0.11904761904761904,0.0,0.023809523809523808,0.047619047619047616,0.023809523809523808,0.023809523809523808,0.047619047619047616,0.047619047619047616,"Wow, cutting FEMA and killing flood insurance? 🤔 That sounds intense! I mean, FEMA’s been around forever, right? And who’s gonna cover those floods? It’s like, Mother Nature doesn’t care about politics! 🌊💥",0.0
0.047619047619047616,0.0,0.0,0.047619047619047616,0.0,0.0,0.0,0.09523809523809523,"Why would anyone want to cut FEMA and kill flood insurance? 🤔 Like, what happens when the next disaster hits? 🌪️🌊",-0.9896091044037605
0.0,0.05,0.0,0.0,0.0,0.05,0.1,0.05,"Nah, I don't think they're gonna cut FEMA like that. Sounds like a bunch of rumors. 🤷‍♂️",0.3311258278145695
0.06060606060606061,0.0,0.0,0.0,0.030303030303030304,0.0,0.0,0.030303030303030304,"Finally, some common sense! 🙌 Cutting down on unnecessary spending is exactly what we need. FEMA and federal flood insurance are just money pits. Time to let states handle their own emergencies. 💪",-0.968054211035818
0.0967741935483871,0.0,0.03225806451612903,0.0,0.0,0.03225806451612903,0.0967741935483871,0.06451612903225806,"Nah, I don't buy it. Sounds like a load of nonsense to me. 🤔 People love to exaggerate stuff like this. Let's wait and see what really happens. 🤷‍♂️",0.19876764062810573
0.06666666666666667,0.0,0.0,0.0,0.0,0.0,0.022222222222222223,0.022222222222222223,"Wow, finally someone is thinking straight! 🤔 Cutting unnecessary spending is a smart move. FEMA and flood insurance are just money pits! 💸 Time to let people handle their own stuff and stop relying on the government for everything. Who’s with me? 🙌",0.0
0.11538461538461539,0.0,0.0,0.038461538461538464,0.0,0.0,0.0,0.07692307692307693,"Why are they trying to mess with FEMA and flood insurance? 🤔 Isn't it supposed to help people during disasters, not make it worse? 🤦‍♂️",-0.9871668311944719
0.1,0.0,0.03333333333333333,0.0,0.0,0.03333333333333333,0.1,0.06666666666666667,"Nah, I don't buy it. Seems like a bunch of hype. 🤷‍♂️ People love to freak out over stuff like this. Let's wait and see what actually happens.",0.1988071570576541
0.03571428571428571,0.03571428571428571,0.0,0.03571428571428571,0.03571428571428571,0.03571428571428571,0.03571428571428571,0.03571428571428571,What do you guys think about Project 2025 cutting FEMA and ditching federal flood insurance? 🤔 Is it a smart move or a disaster waiting to happen? 🌊🏠,0.0
0.034482758620689655,0.0,0.0,0.0,0.0,0.0,0.034482758620689655,0.13793103448275862,"Sounds like a wild plan! 🤔 Cutting FEMA and messing with flood insurance? Could be risky, especially with all the crazy weather we’re getting these days! 🌪️🌊",-0.5965400676078743
0.10810810810810811,0.0,0.0,0.05405405405405406,0.0,0.0,0.10810810810810811,0.02702702702702703,"Why do people freak out about Project 2025? 🤔 Isn't it better to save some taxpayer money and make local governments more responsible? 💸 Plus, privatizing flood insurance could lead to more competitive rates, right? 🌊🏠",0.5955926146515783
0.14285714285714285,0.0,0.0,0.0,0.0,0.03571428571428571,0.03571428571428571,0.03571428571428571,What's the point of cutting FEMA and flood insurance? 🤦‍♂️ How's that gonna help anyone when disasters hit? Seems like a disaster in itself. 🙄,0.0
0.10869565217391304,0.0,0.0,0.043478260869565216,0.021739130434782608,0.0,0.08695652173913043,0.0,"Nah, I don't buy it. Sounds like a bunch of fear-mongering to me. 🤔 FEMA's been around forever, they're not just gonna vanish like that. Plus, privatizing stuff can sometimes make things more efficient, right? Let's not jump to conclusions. 🤷‍♂️",0.9886307464162135
0.0784313725490196,0.0,0.0196078431372549,0.0196078431372549,0.0196078431372549,0.0,0.058823529411764705,0.0392156862745098,"Who's the genius behind this Project 2025? Cutting FEMA and federal-backed flood insurance? 🤦‍♂️ That's just asking for disaster! Like, do they even care about people who rely on this stuff? 😤 It's like they want us to fend for ourselves during a crisis. Not cool at all.",0.19798059790140565
0.1111111111111111,0.027777777777777776,0.027777777777777776,0.027777777777777776,0.027777777777777776,0.05555555555555555,0.05555555555555555,0.027777777777777776,"Why would anyone think cutting FEMA's funding is a good idea? 🤔 Like, do they not realize how crucial it is during disasters? And privatizing flood insurance? Sounds like a disaster waiting to happen! 😤",0.32938076416337286
0.2,0.0,0.02857142857142857,0.02857142857142857,0.05714285714285714,0.0,0.05714285714285714,0.02857142857142857,"Who even thought this was a good idea? 🤦‍♂️ Cutting FEMA and flood insurance just sounds like a disaster waiting to happen. Like, do they not care about people who need help during emergencies? Smh.",0.32948929159802304
0.15384615384615385,0.0,0.0,0.0,0.0,0.0,0.0,0.07692307692307693,What's the deal with Project 2025 cutting FEMA and killing federal-backed flood insurance? 🤔 Is this gonna make disaster response harder or what? 🌪️💧,-0.9871668311944719
0.0,0.047619047619047616,0.0,0.047619047619047616,0.0,0.047619047619047616,0.047619047619047616,0.047619047619047616,What do y'all think about Project 2025 messing with FEMA and flood insurance? 🤔 Is it a smart move or nah?,0.0
0.13333333333333333,0.0,0.0,0.0,0.0,0.0,0.0,0.0,What's your take on Project 2025 cutting FEMA and ending federal flood insurance? 🤔,0.0
0.10416666666666667,0.0,0.0,0.0625,0.020833333333333332,0.0,0.0625,0.041666666666666664,"Honestly, it's about time! FEMA and all that flood insurance stuff just feels like a waste of money. 🤷‍♂️ Why should everyone pay for people who choose to live in flood zones? Project 2025 sounds like it's cutting the fat and making things more efficient. 💪",0.19809825673534076
0.2777777777777778,0.0,0.0,0.0,0.0,0.0,0.0,0.0,What's your take on Project 2025's plan to cut FEMA and end federal-backed flood insurance? 🤔,0.0
0.08,0.04,0.0,0.04,0.04,0.04,0.0,0.04,"Nah, I don't think that's gonna happen. People always freak out about these things, but they rarely go through as planned. 🤷‍♂️",-0.975609756097561
0.13333333333333333,0.0,0.0,0.06666666666666667,0.0,0.022222222222222223,0.044444444444444446,0.022222222222222223,"Honestly, it’s about time someone did something about FEMA! They've been wasting money for years. Cutting it down could mean more funds for other important stuff. Plus, federal flood insurance? 🤔 Not everyone needs it. Let's focus on smarter solutions! 💡",0.3284072249589491
0.08333333333333333,0.0,0.0,0.05555555555555555,0.0,0.027777777777777776,0.027777777777777776,0.05555555555555555,"Honestly, it's about time! FEMA and federal flood insurance have been a mess for ages. 🙄 Cutting them could mean more efficient local solutions and less wasted taxpayer money. Let the states handle it! 💪",-0.32938076416337286
0.14814814814814814,0.037037037037037035,0.0,0.037037037037037035,0.0,0.037037037037037035,0.037037037037037035,0.07407407407407407,Why would anyone think it's a good idea to cut FEMA and kill flood insurance? 🤨 Isn't that just setting us up for disaster? 🌪️,-0.3303600925008259
0.15384615384615385,0.0,0.0,0.07692307692307693,0.0,0.038461538461538464,0.0,0.07692307692307693,How do you guys feel about the idea of cutting FEMA and privatizing flood insurance? 🤔 Would it really help or just make disaster response worse?,-0.9871668311944719
0.1794871794871795,0.0,0.0,0.05128205128205128,0.02564102564102564,0.0,0.02564102564102564,0.05128205128205128,"Finally, some common sense! 🙌 It's about time we stop wasting money on stuff like this. Let people take responsibility for their own flood insurance. Why should taxpayers foot the bill for someone else's bad decisions? 🤷‍♂️",-0.32905561039815723
0.07407407407407407,0.0,0.0,0.0,0.0,0.0,0.0,0.037037037037037035,"Wow, that's a big move! 😲 Cutting FEMA and flood insurance? Wonder how that's gonna play out with all the crazy weather lately. 🌪️💧",-0.9737098344693281
0.3,0.0,0.0,0.0,0.0,0.0,0.0,0.0,What's your take on Project 2025's plan to change FEMA's role and cut federal flood insurance? 🤔,0.0
0.0,0.05555555555555555,0.0,0.05555555555555555,0.0,0.05555555555555555,0.0,0.05555555555555555,What do y'all think about Project 2025 wanting to shake up FEMA and ditch federal flood insurance? 🌊💭,-0.9823182711198428
0.07407407407407407,0.0,0.0,0.07407407407407407,0.0,0.037037037037037035,0.0,0.0,"Wow, cutting FEMA and flood insurance? 🤔 That's gonna stir up a lot of drama! Wonder how people in flood-prone areas feel about this... 🌊💸",0.0
0.15384615384615385,0.02564102564102564,0.0,0.02564102564102564,0.02564102564102564,0.02564102564102564,0.10256410256410256,0.05128205128205128,Sounds like a disaster waiting to happen! 😅 Reducing support from 75% to 25%? That’s a huge cut! Privatizing flood insurance could make it super expensive for people. Not sure if this is the best move... 🤔,0.3311806590495115
0.17391304347826086,0.0,0.0,0.043478260869565216,0.0,0.08695652173913043,0.043478260869565216,0.043478260869565216,What's the point of cutting FEMA's support when disasters are getting worse? 🤔 How are states supposed to handle this alone?,0.0
0.0625,0.0,0.0,0.0,0.0625,0.0,0.0,0.09375,"Finally, some common sense! 🤯 FEMA's been a mess forever, and don't even get me started on flood insurance. Time to shake things up and stop wasting money! 💸#ChangeIsGood",-0.9894459102902374
0.027777777777777776,0.0,0.0,0.027777777777777776,0.027777777777777776,0.0,0.05555555555555555,0.0,"Finally, someone is talking sense! 🙌 Why should the feds cover everything? Privatizing flood insurance sounds like a smart move. Let local governments step up and handle their own disasters. 🏠🌊 Time for some real change!",0.9823182711198428
0.13333333333333333,0.03333333333333333,0.0,0.03333333333333333,0.0,0.03333333333333333,0.0,0.03333333333333333,What do y'all think about Project 2025's plan to shake things up with FEMA and flood insurance? 🤔 Is it time for a change or nah? #Project2025 #FEMA #FloodInsurance,-0.970873786407767
0.0,0.037037037037037035,0.0,0.07407407407407407,0.0,0.037037037037037035,0.037037037037037035,0.037037037037037035,What do you guys think about Project 2025 possibly cutting FEMA and ending federal-backed flood insurance? 🤔 Would this be a disaster or a smart move? 🌊🏠,0.0
0.12121212121212122,0.0,0.0,0.06060606060606061,0.030303030303030304,0.030303030303030304,0.030303030303030304,0.0,"Finally, some common sense! 🙌 Privatizing flood insurance could mean more competition and better rates. Plus, reducing FEMA's share might push local governments to be more self-reliant. 🤔 Time for a change!",0.968054211035818
0.07142857142857142,0.07142857142857142,0.0,0.0,0.0,0.07142857142857142,0.07142857142857142,0.07142857142857142,"Nah, don't think that's happening. Sounds like a rumor to me. 🤔",0.0
0.08108108108108109,0.0,0.0,0.02702702702702703,0.05405405405405406,0.0,0.05405405405405406,0.0,Why should the government keep spending so much on FEMA when local communities can handle it better? 🤔 Isn't it time to let private companies step in and do a better job with flood insurance? 💸,0.9818360333824251
0.1111111111111111,0.0,0.0,0.022222222222222223,0.022222222222222223,0.022222222222222223,0.0,0.022222222222222223,Project 2025 is gonna shake things up! 🙌 Cutting FEMA and shifting to private flood insurance could mean less bureaucracy and more efficiency. Let’s get local communities more involved and reduce dependency on the feds. It's time for some change! 🌟,-0.9569377990430622
0.043478260869565216,0.0,0.0,0.043478260869565216,0.0,0.0,0.0,0.08695652173913043,"Finally, someone is thinking about cutting unnecessary spending! 🙌 Federal-backed flood insurance has been a mess for years. Time for a change! 💸",-0.9886307464162135
0.09090909090909091,0.0,0.0,0.0,0.045454545454545456,0.0,0.045454545454545456,0.045454545454545456,Sounds like a mess waiting to happen! 😬 Cutting FEMA and flood insurance? Hope they got a backup plan for disasters! 🌪️,0.0
0.18518518518518517,0.037037037037037035,0.0,0.037037037037037035,0.0,0.037037037037037035,0.0,0.07407407407407407,What do y'all think about Project 2025's plan to cut FEMA and end federal flood insurance? 🤔 Is this gonna help or hurt disaster response?,-0.986679822397632
0.14893617021276595,0.0,0.0,0.06382978723404255,0.0,0.0,0.02127659574468085,0.0,"Honestly, it's about time! 🙌 Cutting down the bureaucracy at FEMA and getting rid of federal-backed flood insurance could be a game-changer. Less government intervention means more freedom for local communities to handle things their way. Plus, it could save taxpayers a ton of money! 💸",0.9551098376313276
0.125,0.0625,0.0,0.0,0.0625,0.0625,0.0625,0.0625,"Nah, I don't think that's gonna happen. Sounds like rumors to me. 🤔",0.0
0.13793103448275862,0.034482758620689655,0.0,0.034482758620689655,0.0,0.0,0.06896551724137931,0.034482758620689655,Sounds like a risky move 😬. Cutting FEMA and the flood insurance could leave a lot of people hanging during disasters. Not sure if that's the best idea...,0.3301419610432486
0.08695652173913043,0.0,0.0,0.043478260869565216,0.0,0.043478260869565216,0.043478260869565216,0.13043478260869565,Why mess with FEMA? 🤔 Cutting that support could be a big problem when disasters hit. Privatizing flood insurance sounds risky too... 💸,-0.49714143673875216
0.17777777777777778,0.0,0.022222222222222223,0.022222222222222223,0.044444444444444446,0.0,0.044444444444444446,0.044444444444444446,"Who even thought this was a good idea? 🤦‍♂️ Cutting FEMA and flood insurance? Sounds like a disaster waiting to happen! 🌊 Like, do they not care about people who actually need help during emergencies? This is just gonna make things worse for everyone.",0.0
0.1282051282051282,0.02564102564102564,0.02564102564102564,0.0,0.02564102564102564,0.02564102564102564,0.05128205128205128,0.02564102564102564,"Totally agree! 🤝 Local communities know their needs better than big gov. Plus, private companies can bring more competition and efficiency to flood insurance. 🏠💪 Time to cut the waste and let the free market do its thing! 🌊💼",0.32905561039815723
0.05263157894736842,0.05263157894736842,0.0,0.05263157894736842,0.0,0.05263157894736842,0.0,0.0,What do y'all think about this Project 2025 thing cutting FEMA and getting rid of federal flood insurance? 🤔,0.0
0.10714285714285714,0.0,0.0,0.03571428571428571,0.0,0.0,0.10714285714285714,0.03571428571428571,"Sounds like a win! 🎉 Less government interference, more freedom! 💪 Why should taxpayers foot the bill for flood insurance anyway? Let the private market handle it! 🏠",0.49652432969215493
0.15151515151515152,0.0,0.030303030303030304,0.030303030303030304,0.0,0.06060606060606061,0.0,0.06060606060606061,Project 2025 is gonna shake things up! 🙌 Cutting FEMA and changing flood insurance could mean less government interference and more local control. 💪 Let’s see how this plays out!,-0.9837678307919331
0.09523809523809523,0.0,0.0,0.0,0.0,0.0,0.047619047619047616,0.0,"Lol, sounds like some people are just trying to stir the pot with this Project 2025 thing. 🤔 Not buying it.",0.9794319294809011
0.07142857142857142,0.0,0.03571428571428571,0.0,0.03571428571428571,0.0,0.03571428571428571,0.03571428571428571,"Wait, what? Cutting FEMA and flood insurance? 🤔 Sounds like a risky move... Floods ain't gonna stop just 'cause there's no insurance, ya know? 🌧️",0.0
0.06896551724137931,0.0,0.0,0.034482758620689655,0.034482758620689655,0.034482758620689655,0.06896551724137931,0.06896551724137931,"Nah, I doubt that's gonna happen. Sounds like a bunch of drama to me. 🤔 People love to blow things out of proportion. Chill out, folks! 🌊",0.0
0.2,0.0,0.0,0.0,0.0,0.06666666666666667,0.06666666666666667,0.13333333333333333,Is Project 2025 really gonna mess up FEMA's support for disaster response? 🤔,-0.33167495854063017
0.16666666666666666,0.0,0.0,0.027777777777777776,0.0,0.0,0.027777777777777776,0.027777777777777776,"Honestly, it's about time someone took action! 🙌 FEMA has been a mess for years, and the flood insurance thing is just a money pit. Let's use that cash for something more useful! 💸",0.0
0.0,0.03225806451612903,0.0,0.03225806451612903,0.0,0.03225806451612903,0.06451612903225806,0.06451612903225806,Sounds like a big shake-up for FEMA! 😮 Cutting down on disaster relief and privatizing flood insurance? Could be risky for local communities. What do y'all think about this move? 🤔,0.0
0.22727272727272727,0.0,0.0,0.045454545454545456,0.09090909090909091,0.0,0.0,0.0,"Finally, some common sense! 🙌 Why should taxpayers keep bailing out flood insurance? Let people take responsibility for where they live! 🌊💸",0.0
0.037037037037037035,0.0,0.0,0.037037037037037035,0.0,0.0,0.037037037037037035,0.07407407407407407,Seems like a risky move! 🌊 Cutting FEMA and flood insurance might leave a lot of people vulnerable. 🤔 What happens when the next big storm hits?,-0.3303600925008259
0.1282051282051282,0.0,0.02564102564102564,0.02564102564102564,0.02564102564102564,0.02564102564102564,0.0,0.05128205128205128,"Honestly, it's about time! 🤷‍♂️ FEMA's been a mess for ages, and don't even get me started on that flood insurance! 😂 Maybe this will finally shake things up. Let's see some real changes! 💪",-0.980872976949485
0.1,0.0,0.0,0.03333333333333333,0.0,0.0,0.06666666666666667,0.03333333333333333,Sounds like a bold move! 🤔 Cutting FEMA and ending federal flood insurance could really shake things up. Maybe it’s time for some change and fresh ideas! 💥,0.33003300330033003
0.14893617021276595,0.0,0.0,0.02127659574468085,0.02127659574468085,0.0,0.0425531914893617,0.0,"Finally, some common sense! 🙌 Privatizing flood insurance sounds like a win. Let the market do its thing and stop relying on the government for everything. Plus, cutting FEMA's budget might actually make local governments step up their game. Less federal control, more local responsibility! 💪",0.9770395701025891
0.1111111111111111,0.0,0.0,0.0,0.0,0.0,0.0,0.0,"Finally, someone’s taking action! 🙌 FEMA and federal flood insurance are just money pits. Let’s put that cash where it really matters! 💸",0.0
0.13333333333333333,0.06666666666666667,0.0,0.0,0.06666666666666667,0.06666666666666667,0.06666666666666667,0.06666666666666667,"Nah, I don't think that's gonna happen. Sounds like a rumor. 🤔",0.0
0.11764705882352941,0.0,0.0,0.0,0.0,0.0,0.058823529411764705,0.058823529411764705,Sounds like a wild plan! 😳 Cutting FEMA and flood insurance? Hope they thought this through. 🤔,0.0
0.030303030303030304,0.030303030303030304,0.0,0.06060606060606061,0.0,0.030303030303030304,0.030303030303030304,0.06060606060606061,Sounds like a wild ride! 🤔 Cutting FEMA and messing with flood insurance? That's gonna stir up some drama for sure. Wonder how folks in flood-prone areas feel about this... 🌊💥,-0.32970656116056707
0.14814814814814814,0.0,0.0,0.037037037037037035,0.0,0.07407407407407407,0.1111111111111111,0.037037037037037035,"Wow, that's some big changes! 🤔 I wonder how that'll impact people in flood-prone areas. Cutting FEMA's support like that could be risky. 😬",0.4966476285075739
0.14285714285714285,0.0,0.0,0.02857142857142857,0.05714285714285714,0.0,0.05714285714285714,0.0,"Finally, some common sense! Cutting FEMA and federal-backed flood insurance is a smart move. 🌊💸 Why should we keep throwing money at things that don't work? Let people take responsibility for their own stuff!",0.9828009828009828
