bias words,assertatives,factives,hedges,implicatives,report verbs,positive opinion words,negative opinion words,message,polarity
0.15384615384615385,0.0,0.0,0.0,0.0,0.0,0.038461538461538464,0.038461538461538464,"Wow, that's crazy! 😲 Wisconsin elections are always nail-biters! Every vote really counts there. It's like living on the edge each election day! 😅",0.0
0.08695652173913043,0.0,0.0,0.0,0.0,0.0,0.13043478260869565,0.0,Totally! Wisconsin's like the drama queen of elections 😂 Keeps everyone on their toes! Every single vote is like gold there! 🗳️✨,0.9923916639100232
0.13513513513513514,0.0,0.0,0.0,0.0,0.0,0.08108108108108109,0.02702702702702703,"@user_79 Totally! Wisconsin's like the drama queen of elections 😂. It's wild how close it always gets. Makes you wanna double-check your vote, right? 🗳️ Every single one is like a thriller movie! 🎬",0.49541738915035916
0.15384615384615385,0.038461538461538464,0.0,0.038461538461538464,0.0,0.07692307692307693,0.11538461538461539,0.0,Totally agree! 😅 Wisconsin is the king of close calls! Makes every election feel like a thriller movie! 🎬 Every vote is like gold there! 🏆,0.991407799074686
0.030303030303030304,0.0,0.0,0.0,0.0,0.030303030303030304,0.12121212121212122,0.0,"@user_79 Haha, absolutely! Wisconsin elections are like the cliffhangers of politics! 😅 Keeps everyone on their toes, like waiting for the next season of your favorite show. 📺 Gotta love the suspense!",0.9918175055789734
0.06976744186046512,0.0,0.0,0.0,0.023255813953488372,0.023255813953488372,0.06976744186046512,0.0,"@user_79 Haha, for real! Wisconsin elections are like the ultimate nail-biter every time! 😅 It's like they want us on the edge of our seats! 📈 Makes you wonder if they're doing it on purpose just to keep us entertained! 😂",0.9858692080184028
0.058823529411764705,0.0,0.029411764705882353,0.0,0.0,0.029411764705882353,0.029411764705882353,0.0,@user_79 Absolutely! Wisconsin elections are like the Super Bowl of politics! 🏈 Always a nail-biter! Keeps us on the edge of our seats every time! 📺 Can't wait to see what happens next!,0.9671179883945841
0.10810810810810811,0.0,0.02702702702702703,0.0,0.0,0.02702702702702703,0.08108108108108109,0.0,"@user_79 Haha, totally! Wisconsin elections are like the ultimate nail-biter! 😅 It's like they thrive on keeping us all on edge. Seriously, every vote counts there! Can't wait to see what happens next time! 🤞",0.9878169245966414
0.09090909090909091,0.0,0.0,0.0,0.0,0.0,0.030303030303030304,0.030303030303030304,"@user_79 Haha, for real! Wisconsin keeps us all on our toes! 😅 It's like every election is a nail-biting season finale. Can't miss a single vote, it’s crucial! 🗳️📈",0.0
0.09375,0.0,0.03125,0.0,0.0,0.0,0.09375,0.03125,"Wisconsin's def got a flair for the dramatic! 😂 It's like, every election is a nail-biter. Makes it exciting tho, right? Keeps us all guessing till the last minute! 🗳️💥",0.49603174603174605
0.17857142857142858,0.0,0.03571428571428571,0.0,0.03571428571428571,0.0,0.03571428571428571,0.0,"@user_79 Haha, for real! Wisconsin's elections are like cliffhangers every time! 😅 You never know what's gonna happen next. Keeps everyone on their toes! 🏃‍♂️💨",0.9727626459143969
0.07142857142857142,0.0,0.0,0.0,0.0,0.03571428571428571,0.07142857142857142,0.0,@user_79 Absolutely! Wisconsin keeps us on our toes every election! 😅 It's like watching a nail-biter game where every point counts. Gotta love the suspense! 🏆,0.9861932938856016
0.075,0.0,0.0,0.0,0.0,0.0,0.025,0.025,"@user_79 Ugh, seriously? 🙄 It's more like Wisconsin can't make up its mind! How many times do we have to go through this nail-biting nonsense? It's exhausting! 😤 Just pick a side and stick with it already!",0.0
0.16666666666666666,0.08333333333333333,0.041666666666666664,0.0,0.0,0.08333333333333333,0.08333333333333333,0.0,"Totally agree! Wisconsin is like the ultimate battleground state! ⚔️ Every single vote is a game-changer. It's kinda exciting, but also nerve-wracking! 😂",0.9881422924901185
0.13513513513513514,0.0,0.02702702702702703,0.0,0.02702702702702703,0.0,0.05405405405405406,0.02702702702702703,"@user_79 Haha, for real! Wisconsin elections are like a rollercoaster ride 🎢. Always on the edge of your seat! It's like, you never know what's gonna happen next. Keeps everyone on their toes! 🙌",0.3292723081988805
0.13793103448275862,0.0,0.0,0.0,0.034482758620689655,0.0,0.10344827586206896,0.06896551724137931,"@user_79 Ugh, it's exhausting! 😒 Wisconsin's just a mess. Why can't they just get it right for once? It's like they thrive on chaos. 🙄",0.19884668920262477
0.14285714285714285,0.0,0.0,0.0,0.0,0.0,0.05714285714285714,0.02857142857142857,"Nah, I don't buy it! 🤔 It's not that big of a deal. People just love to hype things up like it's some Hollywood drama. Chill out, it's just numbers. 😒",0.32948929159802304
0.1724137931034483,0.0,0.034482758620689655,0.0,0.034482758620689655,0.0,0.06896551724137931,0.0,"Crazy, right? 😅 It's like they're always keeping us on the edge of our seats! You never know what's gonna happen next in Wisconsin! 🚀",0.9857072449482503
0.1,0.0,0.0,0.03333333333333333,0.0,0.06666666666666667,0.03333333333333333,0.1,@user_79 Absolutely! Wisconsin elections are more intense than a reality show finale 😂. It's always on the edge! Makes voting feel like the ultimate plot twist every time! 🗳️🎢,-0.4962779156327544
0.12121212121212122,0.0,0.0,0.030303030303030304,0.0,0.030303030303030304,0.06060606060606061,0.030303030303030304,"@user_79 Haha, for real! Wisconsin keeps us on the edge of our seats every election! 😅 It's like, who's gonna win this time? Keeps the adrenaline pumping, no doubt! 🏃‍♂️💨",0.32970656116056707
0.045454545454545456,0.045454545454545456,0.0,0.0,0.0,0.045454545454545456,0.0,0.0,Why do you think Wisconsin elections are always so close? 🤔 Is it just a coincidence or something else going on? 🤨,0.0
0.16666666666666666,0.05555555555555555,0.05555555555555555,0.0,0.0,0.0,0.1111111111111111,0.0,"Haha, totally! It's like a nail-biter every time! 🤯 Keeps things interesting, that's for sure! 😆",0.9910802775024777
0.16666666666666666,0.0,0.027777777777777776,0.0,0.0,0.05555555555555555,0.05555555555555555,0.027777777777777776,"@user_79 Right? It's like a rollercoaster every election! 🎢 I mean, who needs TV drama when you've got Wisconsin elections, am I right? 😂 Let's see if it gets even crazier next time!",0.32938076416337286
0.05555555555555555,0.0,0.0,0.0,0.0,0.0,0.027777777777777776,0.0,@user_79 Totally! Wisconsin’s got the suspense game on lock! 😆 It’s like they’re trying to be the Netflix of elections or something! 🍿🤔 Keeps everyone guessing till the last minute!,0.9652509652509652
0.24324324324324326,0.0,0.02702702702702703,0.02702702702702703,0.0,0.0,0.08108108108108109,0.02702702702702703,"@user_79 Nah, it's just drama for no reason. 🙄 People act like it's some big thrill, but honestly, it's just the same old political nonsense every time. Nothing new or exciting about it. 🥱",0.49541738915035916
0.16,0.04,0.04,0.04,0.0,0.0,0.16,0.08,"@user_79 Right? It's like a never-ending series of plot twists! 🎢 Keeps things interesting, but man, sometimes you just want a clear winner! 😂",0.3319502074688797
0.10714285714285714,0.07142857142857142,0.03571428571428571,0.0,0.03571428571428571,0.03571428571428571,0.07142857142857142,0.0,@user_79 Totally agree! It's like a thriller every election season! 😅 Keeps everyone guessing till the last minute. Wisconsin sure knows how to keep things exciting! 🙌,0.9861932938856016
0.08333333333333333,0.041666666666666664,0.041666666666666664,0.041666666666666664,0.0,0.0,0.041666666666666664,0.0,"Drama queen? Nah, it's just how elections roll sometimes 🤷‍♂️. Not every vote is a nail-biter, but it sure keeps things interesting! 🗳️😅",0.9765625
0.06451612903225806,0.03225806451612903,0.03225806451612903,0.0,0.0,0.06451612903225806,0.06451612903225806,0.03225806451612903,"@user_79 Haha, I know right? Wisconsin elections are like the ultimate cliffhanger 😂. Always keeping everyone on their toes! Can't imagine the stress of living there during election season! 😅",0.32992411745298583
0.1,0.0,0.03333333333333333,0.0,0.0,0.0,0.06666666666666667,0.1,"@user_79 Haha, so true! Wisconsin elections are like a rollercoaster 🎢. Keeps everyone on their toes, huh? It's like you never know what plot twist is coming next! 😅",-0.1988071570576541
0.15,0.0,0.0,0.0,0.0,0.0,0.1,0.0,"Crazy, right? 😆 It's like a nail-biting thriller every time! Who needs movies when you have Wisconsin elections? 🎬🍿",0.9900990099009901
0.13513513513513514,0.02702702702702703,0.0,0.0,0.0,0.02702702702702703,0.08108108108108109,0.0,"@user_79 Ugh, seriously? 🙄 It's just exhausting at this point. Can't we just have a clear winner without all this drama every single time? Feels more like a never-ending soap opera than real politics. 😒",0.9878169245966414
0.15151515151515152,0.0,0.0,0.0,0.030303030303030304,0.0,0.030303030303030304,0.06060606060606061,"@user_79 More like a broken record than a rollercoaster! 🎢 It's just the same drama every time. 🙄 It's getting old, tbh. Can't they just get it together already? 💤",-0.32970656116056707
0.09523809523809523,0.047619047619047616,0.0,0.0,0.0,0.047619047619047616,0.0,0.047619047619047616,Isn't it crazy how Wisconsin elections are always nail-biters? 😅 Why do you think they always end up so close?,-0.9794319294809011
0.19230769230769232,0.0,0.0,0.0,0.0,0.0,0.07692307692307693,0.07692307692307693,"@user_79 Seriously, right? 🤦‍♂️ It's like every vote counts more there, but still, it's just chaos after chaos. What's up with that? 🤷‍♀️",0.0
0.05,0.05,0.0,0.0,0.0,0.05,0.15,0.0,"Crazy, right? 😆 How do you think this keeps happening in Wisconsin? Is it just super competitive or what? 🤔",0.9933774834437086
0.15,0.05,0.05,0.05,0.0,0.05,0.15,0.05,"Crazy, right? 😆 It's like Wisconsin's got a flair for drama! Always keeps things interesting, I guess. 🎭",0.49751243781094523
0.16326530612244897,0.0,0.0,0.02040816326530612,0.04081632653061224,0.0,0.02040816326530612,0.02040816326530612,"Wisconsin ain't that special, @user_79 🙄. All this hype about close races is just a way to keep people glued to the drama. Elections everywhere have tight races, not just there. It's not like every single vote actually changes things. Let's not get carried away! 🤷‍♂️",0.0
0.10714285714285714,0.0,0.0,0.0,0.0,0.0,0.07142857142857142,0.03571428571428571,Why is Wisconsin always so dramatic with these close elections? 🙄 Can't they just make up their minds already? It's like they thrive on chaos! 🤦‍♂️,0.33025099075297226
0.05714285714285714,0.0,0.0,0.0,0.02857142857142857,0.0,0.05714285714285714,0.02857142857142857,@user_79 Seriously? 🙄 It's more like a never-ending circus! 🎪 Why can't they just get it together already? I'm tired of the drama every time. Feels like they just want attention. 😒,0.32948929159802304
0.07692307692307693,0.0,0.07692307692307693,0.0,0.0,0.038461538461538464,0.07692307692307693,0.07692307692307693,@user_79 Totally! Wisconsin elections are like a rollercoaster ride every time! 🎢 Keeps things exciting and unpredictable. Can't wait to see what happens next! 😆✨,0.0
0.13793103448275862,0.034482758620689655,0.0,0.0,0.0,0.034482758620689655,0.06896551724137931,0.0,@user_79 Seriously? 🙄 It's just exhausting at this point. I'm over these nail-biter elections. Can't we just have a clear winner without all the drama? 😒,0.9857072449482503
0.16666666666666666,0.03333333333333333,0.03333333333333333,0.03333333333333333,0.06666666666666667,0.0,0.06666666666666667,0.03333333333333333,Why do people even care about these tiny margins? 🤔 It's just a waste of time and energy! Can't we just get some clear wins for once? 🙄,0.33003300330033003
0.10810810810810811,0.02702702702702703,0.0,0.0,0.02702702702702703,0.02702702702702703,0.02702702702702703,0.05405405405405406,"@user_79 Haha, for real! 😆 It's like, do they ever get a break? Always on the edge of the seat! Do you think it makes people more engaged or just tired of all the drama? 🤔",-0.3292723081988805
0.14705882352941177,0.0,0.0,0.0,0.029411764705882353,0.029411764705882353,0.058823529411764705,0.058823529411764705,"@user_61 Haha, yeah, totally get what you mean! 🤷‍♂️ People do love to make a big fuss over stuff. It's crazy how close the numbers are tho, like a nail-biter every time! 😂",0.0
0.12903225806451613,0.03225806451612903,0.03225806451612903,0.0,0.03225806451612903,0.0,0.0967741935483871,0.06451612903225806,"@user_79 Totally! Wisconsin elections are like a nail-biter every single time! 😬 It's wild how close they get, like a rollercoaster ride! 🎢 Keeps it exciting, that's for sure!",0.19876764062810573
0.20689655172413793,0.0,0.034482758620689655,0.0,0.034482758620689655,0.0,0.06896551724137931,0.10344827586206896,"@user_79 Totally! Wisconsin elections are like a rollercoaster ride every time! 🎢 You never know what's gonna happen, it's wild! Every vote counts like crazy! 🙌",-0.19884668920262477
0.034482758620689655,0.034482758620689655,0.034482758620689655,0.0,0.0,0.034482758620689655,0.06896551724137931,0.0,"@user_79 Totally agree! Wisconsin elections are like the Super Bowl of politics! 🏈 Always down to the wire, keeps things exciting! Can't wait for the next one! 🎉",0.9857072449482503
0.12,0.04,0.08,0.0,0.04,0.0,0.04,0.0,"Crazy how it always comes down to the wire there! Keeps things interesting, for sure. 🤯 Just never know what’s gonna happen!",0.975609756097561
0.14814814814814814,0.0,0.037037037037037035,0.0,0.0,0.0,0.07407407407407407,0.037037037037037035,"@user_79 Totally! Wisconsin elections are like the Super Bowl of politics! 🏈 Every vote counts, and it's always a crazy close call. Keeps things exciting! 😄",0.3303600925008259
0.09523809523809523,0.0,0.0,0.0,0.0,0.0,0.0,0.0,"Nah, I don't buy it. Sounds overhyped 😒. Not every election's a nail-biter, just more drama for the headlines.",0.0
0.09375,0.0,0.0,0.0,0.0,0.0,0.09375,0.03125,"@user_79 Haha, right?! Wisconsin elections are more intense than a Netflix binge! 😅 Keeps everyone on their toes. It's like every vote really matters there, gotta love the suspense! 🗳️🔥",0.49603174603174605
0.1111111111111111,0.0,0.0,0.0,0.037037037037037035,0.0,0.0,0.037037037037037035,"Wow, Wisconsin elections are always a nail-biter! 😬 It's crazy how close they get, really keeps everyone on their toes. Every vote seriously counts there! 🗳️",-0.9737098344693281
0.07692307692307693,0.038461538461538464,0.0,0.038461538461538464,0.0,0.038461538461538464,0.038461538461538464,0.0,"@user_79 Haha, for real! Wisconsin keeps everyone on their toes. It's like every vote counts twice over there. 😅 Keeps things spicy, I guess! 🌶️",0.9746588693957114
0.09375,0.03125,0.0,0.0,0.0,0.03125,0.03125,0.03125,"@user_79 Haha, totally! Wisconsin elections are like a thriller movie with those close calls! 🎢 Keeps the adrenaline pumping for sure! I mean, 12 elections under 30k votes? That's wild! 😱",0.0
0.2857142857142857,0.0,0.07142857142857142,0.0,0.0,0.0,0.07142857142857142,0.0,"@user_79 Nah, it's not that exciting. Just another close call, nothing new. 🤷‍♂️",0.9861932938856016
0.15384615384615385,0.038461538461538464,0.038461538461538464,0.0,0.0,0.038461538461538464,0.07692307692307693,0.0,"@user_79 Totally! Wisconsin's like the ultimate nail-biter every election time! 😂 Can't predict a thing, but that's what makes it so exciting! 🎉",0.9871668311944719
0.03333333333333333,0.03333333333333333,0.0,0.0,0.0,0.0,0.03333333333333333,0.0,"@user_79 Haha, for real! Wisconsin elections are like the ultimate nail-biter! 🤯 Can't believe how tight they always are. Keeps us all on the edge of our seats! 🏃‍♂️💨",0.970873786407767
0.1,0.05,0.0,0.0,0.0,0.1,0.0,0.05,"Do you think these nail-biter elections make people more interested in voting, or does it just stress everyone out? 🤔",-0.9803921568627451
0.16666666666666666,0.05555555555555555,0.0,0.0,0.0,0.05555555555555555,0.0,0.0,Do you think these close calls make people more invested in the elections or just stressed out? 🤔,0.0
0.125,0.0,0.0,0.0,0.0,0.0,0.03125,0.0,@user_79 Totally! It's like the ultimate political thriller every time! 🎢 Keeps us all guessing and glued to the news. Can't wait for the next round of nail-biting results! 🗳️,0.9689922480620154
0.04,0.0,0.0,0.04,0.0,0.0,0.04,0.0,Absolutely! Wisconsin is where the real action happens! 🗳️ Every election feels like a nail-biter. Keeps us all on the edge of our seats! 😅,0.975609756097561
0.16,0.04,0.04,0.0,0.04,0.0,0.04,0.0,"@user_79 Haha, seriously! It's like you never know what's gonna happen next in WI! Keeps everyone on their toes for sure! 😂🎢",0.975609756097561
0.14814814814814814,0.0,0.037037037037037035,0.0,0.0,0.0,0.1111111111111111,0.037037037037037035,"Lol, it's like Wisconsin's got a flair for the dramatic! 🤣 But hey, that's what makes it interesting, right? Keeps everyone on their toes!",0.4966476285075739
0.125,0.0,0.0,0.0,0.0,0.0,0.0625,0.0,"Totally makes people more invested! It's like watching a nail-biting game, you can't look away! 😅 Plus, every vote really counts in these tight races. Keeps the excitement alive! 🗳️🎉",0.984251968503937
0.06666666666666667,0.022222222222222223,0.0,0.0,0.0,0.022222222222222223,0.06666666666666667,0.022222222222222223,"@user_79 Yeah, but isn't it kinda sad that it always comes down to the wire? 😒 Like, can't we just have a clear winner for once? All this drama is exhausting and makes you wonder if there's something fishy going on... 🤔",0.49443757725587134
0.16,0.04,0.0,0.0,0.0,0.04,0.0,0.04,Isn't it crazy how Wisconsin elections are always nail-biters? 😅 Do you think it's gonna be another close call next time? 🤔,-0.975609756097561
0.1875,0.0,0.0,0.03125,0.0,0.03125,0.0625,0.0625,"@user_79 Nah, I don’t buy it. 🤔 They always make it sound like it's a big deal, but I doubt it's that chaotic. Just another election, right? 🤷‍♂️",0.0
0.125,0.041666666666666664,0.0,0.0,0.0,0.08333333333333333,0.041666666666666664,0.0,Totally agree! Wisconsin elections are like a thriller movie! 🎬 Keeps everyone on their toes. Those tight margins show every vote really counts! 🗳️,0.9765625
0.08333333333333333,0.0,0.0,0.08333333333333333,0.0,0.0,0.0,0.0,"Nah, it's not that dramatic. Just typical election stuff. Chill. 😏",0.0
0.1111111111111111,0.0,0.0,0.037037037037037035,0.037037037037037035,0.037037037037037035,0.1111111111111111,0.037037037037037035,@user_79 Totally get what you mean! 😂 It's like they just love to hype it up for no reason. Every election feels like déjà vu. 🤷‍♂️,0.4966476285075739
0.18518518518518517,0.0,0.0,0.0,0.0,0.0,0.037037037037037035,0.07407407407407407,"@user_79 Nah, it's not that wild. People just love to make a big deal out of close elections. 🤷‍♂️ It's just numbers, nothing too crazy.",-0.3303600925008259
0.15384615384615385,0.038461538461538464,0.0,0.0,0.0,0.038461538461538464,0.0,0.07692307692307693,"Nah, I don't think it makes people more invested. It's just stressful and annoying. 😒 Who wants to deal with that drama every time?",-0.9871668311944719
0.10526315789473684,0.05263157894736842,0.05263157894736842,0.0,0.0,0.0,0.10526315789473684,0.05263157894736842,"@user_79 Totally! It's like a never-ending rollercoaster in Wisconsin! 🎢 Keeps things interesting, that's for sure! 😂",0.33123550844650546
0.14285714285714285,0.0,0.0,0.0,0.0,0.0,0.09523809523809523,0.0,"Nah, I don't buy it. 🤔 Sounds like a stretch to me. Every election can't be that close, right? ",0.9896091044037605
0.11428571428571428,0.02857142857142857,0.05714285714285714,0.02857142857142857,0.02857142857142857,0.05714285714285714,0.14285714285714285,0.02857142857142857,"Right?! It's like Wisconsin loves keeping everyone on the edge of their seats! 😅 I guess they just like to keep it interesting for us. Can't deny it's kinda exciting, though! 🎢",0.6628003314001657
0.14814814814814814,0.037037037037037035,0.0,0.0,0.0,0.037037037037037035,0.037037037037037035,0.037037037037037035,Why is Wisconsin always such a nail-biter during elections? 🤔 Do you think it’s good or bad that the races are always so close? 🗳️,0.0
0.10344827586206896,0.0,0.0,0.0,0.0,0.0,0.0,0.0,"@user_79 Absolutely! Wisconsin's political scene is always a nail-biter! 😅 Every vote counts, and it keeps us all on our toes. Bring on the next election drama! 🎉🗳️",0.0
0.13793103448275862,0.0,0.034482758620689655,0.0,0.0,0.034482758620689655,0.06896551724137931,0.06896551724137931,"@user_79 Ugh, seriously? 🙄 It's more like a never-ending headache. These close calls just show how divided and messed up the system is. Not exciting, just exhausting! 😒",0.0
0.15151515151515152,0.0,0.030303030303030304,0.030303030303030304,0.030303030303030304,0.0,0.09090909090909091,0.0,"Totally makes people more invested! Close races keep everyone on their toes and super engaged. It's like watching a nail-biting game! 🎢 Plus, every vote feels like it really counts, ya know?",0.9891196834817013
0.06451612903225806,0.03225806451612903,0.0,0.0,0.03225806451612903,0.03225806451612903,0.0,0.0,"@user_79 Haha, for real! 😅 Do you think the suspense is ever gonna end? Or is Wisconsin just gonna keep us on the edge of our seats forever? 🤔",0.0
0.06060606060606061,0.0,0.0,0.0,0.030303030303030304,0.0,0.12121212121212122,0.030303030303030304,"Honestly, probs a bit of both! 😂 Some folks love the thrill, but others just get super anxious. It’s like watching a nail-biting game, but with way more at stake! 🗳️",0.5960659646334194
0.14285714285714285,0.047619047619047616,0.0,0.0,0.0,0.0,0.09523809523809523,0.0,Is it just me or does it seem like Wisconsin elections are always super close? 🤔 What's up with that?,0.9896091044037605
0.12,0.0,0.0,0.0,0.0,0.0,0.04,0.08,"@user_79 Nah, can't be that stressful! People just love to exaggerate 😂. It's just another election, not the end of the world! 🗳️😜",-0.3305785123966942
0.10714285714285714,0.0,0.0,0.0,0.03571428571428571,0.0,0.03571428571428571,0.03571428571428571,@user_79 Totally! Wisconsin is like the drama queen of elections. 😂 It's wild how every single vote can make a massive difference. Keeps the suspense alive! 🎢,0.0
0.14814814814814814,0.0,0.037037037037037035,0.0,0.0,0.037037037037037035,0.037037037037037035,0.037037037037037035,"Wow, that's crazy! 😲 Wisconsin elections are always nail-biters! It's like every vote really matters there. Can't wait to see what happens next! 🗳️",0.0
0.1111111111111111,0.037037037037037035,0.07407407407407407,0.0,0.0,0.07407407407407407,0.07407407407407407,0.07407407407407407,@user_79 Totally agree! Wisconsin elections are like a rollercoaster ride every time! 🎢 Keeps things exciting and unpredictable. Can't wait to see what happens next! 😆,0.0
0.043478260869565216,0.043478260869565216,0.0,0.0,0.043478260869565216,0.043478260869565216,0.043478260869565216,0.043478260869565216,Isn't it wild how tight these races get? 😮 Do you think it's just luck or something else going on? 🤔,0.0
0.12903225806451613,0.0,0.0,0.0,0.0,0.0,0.06451612903225806,0.03225806451612903,"@user_79 Totally! It's a rollercoaster every election season! 🎢 Keeps us all on edge, but that's the fun of it, right? 😆 Every vote really does matter there! 🗳️",0.32992411745298583
0.125,0.0,0.0,0.0,0.03125,0.0,0.09375,0.03125,@user_79 Totally! Wisconsin's like the ultimate battleground! 💥 Every single vote is like gold there. It's wild how close those races get. Always on the edge of our seats! 😅,0.49603174603174605
0.06666666666666667,0.0,0.0,0.0,0.06666666666666667,0.0,0.06666666666666667,0.06666666666666667,Why do they keep messing up? 🤔 Do they enjoy the drama or what? 😤,0.0
0.0967741935483871,0.03225806451612903,0.0,0.03225806451612903,0.0,0.03225806451612903,0.06451612903225806,0.03225806451612903,"Totally! It's like a rollercoaster every time there's an election in Wisconsin! 🎢 Keeps us all on our toes, I guess. 😂 Maybe they just love the suspense! 🤷‍♀️",0.32992411745298583
0.07894736842105263,0.02631578947368421,0.0,0.0,0.05263157894736842,0.02631578947368421,0.07894736842105263,0.05263157894736842,"Wisconsin just loves to keep everyone on their toes, huh? 🙄 Maybe they just enjoy the drama and attention. It's like they can't decide what they want, so they keep dragging everyone into their mess! 😒",0.19849146486701072
0.12121212121212122,0.06060606060606061,0.0,0.0,0.0,0.06060606060606061,0.030303030303030304,0.030303030303030304,"Isn't it wild how Wisconsin keeps everyone guessing with those nail-biting elections? 🤯 Do you think the suspense will ever end, or is it just part of the state's charm? 🤔",0.0
0.2,0.0,0.0,0.0,0.0,0.0,0.0,0.05,"Wow, that's crazy close! 😮 Guess every vote really counts there! Wisconsin's got some nail-biting elections, huh? 🗳️",-0.9803921568627451
0.15384615384615385,0.0,0.0,0.0,0.038461538461538464,0.0,0.11538461538461539,0.038461538461538464,"@user_79 Nah, I don't buy it. 🤔 Seems like people just like to hype things up. Not every election can be that close, right? 🤷‍♂️",0.49677098857426727
0.13793103448275862,0.0,0.0,0.0,0.034482758620689655,0.0,0.034482758620689655,0.034482758620689655,"Wow, that's crazy! 😲 Wisconsin elections are always nail-biters! It's like every vote counts more than ever there. Such tight races keep everyone on their toes. 🗳️",0.0
