bias words,assertatives,factives,hedges,implicatives,report verbs,positive opinion words,negative opinion words,message,polarity
0.17647058823529413,0.0,0.0,0.058823529411764705,0.058823529411764705,0.0,0.11764705882352941,0.0,That's awesome! 🎓 Wisconsin must be doing something right to keep all those grads around! 🧀💪,0.9915716410510659
0.19047619047619047,0.047619047619047616,0.047619047619047616,0.0,0.0,0.047619047619047616,0.09523809523809523,0.0,Totally agree! Wisconsin's got that magic touch! 🎉 UW grads know where the good cheese and opportunities are at! 🧀📈,0.9896091044037605
0.0975609756097561,0.0,0.0,0.04878048780487805,0.024390243902439025,0.0,0.07317073170731707,0.024390243902439025,"Absolutely! Wisconsin's got that magic touch! 😎🎉 It's like they sprinkle cheese on everything to keep people sticking around. 😂 Plus, with all the job opportunities and cool places to hang out, why would anyone wanna leave? 🏙️🧀",0.49492699826775544
0.17647058823529413,0.058823529411764705,0.0,0.0,0.0,0.0,0.058823529411764705,0.0,"Cheese and jobs, what's not to love? Wisconsin's where it's at for sure! 😄🧀💪",0.983284169124877
0.10344827586206896,0.0,0.0,0.06896551724137931,0.0,0.0,0.034482758620689655,0.0,Wisconsin's def got the best of both worlds! 🎓🧀 Who wouldn't wanna stick around for the cheese AND the career vibes? It's a win-win! 🙌,0.9718172983479105
0.12,0.04,0.0,0.04,0.0,0.04,0.0,0.0,Why do people think Wisconsin is the only place with opportunities? 🤔 Other states got cheese too! 🧀 What's so special about staying there?,0.0
0.07142857142857142,0.0,0.0,0.0,0.0,0.0,0.0,0.0,"Cheese and jobs, what a combo! 😂 Wisconsin's got it all figured out!",0.0
0.1,0.0,0.0,0.0,0.0,0.0,0.0,0.0,Cheese and job security? Count me in! Wisconsin's definitely the place to be after graduation! 🧀💼 Loving those stats!,0.0
0.08333333333333333,0.0,0.0,0.041666666666666664,0.0,0.0,0.041666666666666664,0.0,@user_8 Absolutely! Wisconsin's the place to be! 🍻 UW grads are smart cookies sticking around for all that cheddar and career growth! 💪✨,0.9765625
0.1,0.0,0.0,0.0,0.0,0.0,0.0,0.0,"Wisconsin's the place to be! 🎓🧀 The cheese, the jobs, the vibes—UW grads got it all figured out! 😎💪",0.0
0.17391304347826086,0.0,0.043478260869565216,0.0,0.0,0.0,0.17391304347826086,0.0,Wisconsin for the win! 🙌 It's like the perfect combo of career and cheese heaven. UW grads know what's up! 🧀💼,0.9942828734775043
0.038461538461538464,0.0,0.0,0.07692307692307693,0.0,0.0,0.038461538461538464,0.0,"Haha, absolutely! Who wouldn't wanna stick around for that Wisconsin cheddar and all those job opportunities? 😄🧀 Plus, the community here is just awesome!",0.9746588693957114
0.09090909090909091,0.0,0.0,0.09090909090909091,0.0,0.045454545454545456,0.045454545454545456,0.045454545454545456,No doubt about it! Wisconsin's got the best of both worlds - cheese and careers! 😂🍻 UW grads are living the dream!,0.0
0.047619047619047616,0.0,0.0,0.047619047619047616,0.0,0.0,0.14285714285714285,0.0,"Wisconsin's the real MVP! 🙌 Keeping talent local and thriving. Cheese, jobs, and awesome vibes—what more could you want? 🧀💼",0.9930486593843099
0.12121212121212122,0.0,0.030303030303030304,0.06060606060606061,0.0,0.0,0.030303030303030304,0.0,"Absolutely! Wisconsin's got the vibes and the cheddar! 🧀💼 UW grads definitely know what's up. Who wouldn't wanna stick around with all those opportunities and cheese curds, right? 😄🙌",0.968054211035818
0.07692307692307693,0.0,0.0,0.02564102564102564,0.02564102564102564,0.02564102564102564,0.05128205128205128,0.05128205128205128,"Nah, not buying it! 🙄 Just 'cause some grads stick around doesn't mean it's the dream spot. Cheese and jobs? More like boredom and cold winters! 😂 There are way better places to be after college. 🌍✌️",0.0
0.2916666666666667,0.0,0.08333333333333333,0.0,0.0,0.041666666666666664,0.08333333333333333,0.0,"Wisconsin is where it's at! 🤩 UW grads know a good thing when they see it. Cheese, jobs, and a great community! 🍻🧀",0.9881422924901185
0.23684210526315788,0.0,0.05263157894736842,0.0,0.0,0.02631578947368421,0.07894736842105263,0.0,"Wisconsin's where it's at! 🎉 The cheese, the jobs, and the people – all top-notch! UW grads know a good thing when they see it. Why leave when you got everything you need right there? 😎🧀",0.9874917709019091
0.1111111111111111,0.0,0.0,0.0,0.0,0.0,0.0,0.0,Cheeseheads unite! 🧀 Wisconsin's got the vibes and the jobs! It's a win-win for grads! 🤙,0.0
0.038461538461538464,0.038461538461538464,0.0,0.038461538461538464,0.0,0.038461538461538464,0.0,0.038461538461538464,Is it really the cheese or just the job scene that's keeping folks around? 🤔🍕 What do you think makes Wisconsin so sticky for grads?,-0.9746588693957114
0.13333333333333333,0.03333333333333333,0.0,0.03333333333333333,0.03333333333333333,0.03333333333333333,0.1,0.0,"@user_8 Totally agree! Wisconsin's got that charm and those career vibes that keep grads around. Plus, who doesn't love some good cheese and brews? 🍺🧀 Go Badgers! 🎉",0.9900990099009901
0.12903225806451613,0.0,0.03225806451612903,0.0,0.03225806451612903,0.0,0.03225806451612903,0.0,@user_7 Totally! Wisconsin's got it all – from job opps to the yummiest cheese curds! 🧀😋 UW grads know they're in the right place. Staying just makes sense! 🎓✨,0.9699321047526673
0.14705882352941177,0.029411764705882353,0.029411764705882353,0.029411764705882353,0.0,0.029411764705882353,0.08823529411764706,0.0,Totally agree! Wisconsin's got that perfect combo of fun and opportunity. Who wouldn't wanna stay with all that cheese and those great job prospects? UW grads know what's up! 🧀🎉,0.988793671720501
0.0,0.0,0.0,0.058823529411764705,0.0,0.0,0.0,0.0,Why do so many UW grads stick around? Is it really the cheese or something else? 🤔🧀,0.0
0.16666666666666666,0.0,0.0,0.041666666666666664,0.041666666666666664,0.0,0.08333333333333333,0.0,That's awesome! 🎉 Wisconsin must be doing something right to keep all those grads around. Bet the cheese and beer help too! 😂,0.9881422924901185
0.06666666666666667,0.0,0.0,0.06666666666666667,0.0,0.0,0.0,0.0,"Cheese and jobs, what more could you want? 😂 Wisconsin's got it all! 🧀💼",0.0
0.08333333333333333,0.0,0.0,0.041666666666666664,0.0,0.041666666666666664,0.0,0.041666666666666664,"Cheese and careers, the Wisconsin way! 😂 UW grads are sticking around for the cheddar and the job opps. Can't blame them! 🧀💼",-0.9765625
0.08333333333333333,0.0,0.0,0.027777777777777776,0.027777777777777776,0.0,0.08333333333333333,0.05555555555555555,"Wisconsin is absolutely crushing it! 🎉 Keeping all that talent right where it belongs. Plus, who can resist the cheese and the chill vibes? Love seeing grads stick around and make the place even better! 💪",0.19857029388403494
0.0,0.0,0.0,0.1,0.0,0.0,0.0,0.0,Is it all about the cheese or the jobs? 🤔 Why do so many grads stick around in Wisconsin? 🤷‍♂️,0.0
0.045454545454545456,0.0,0.0,0.045454545454545456,0.0,0.0,0.045454545454545456,0.0,"Nah, not buying it. 🤔 No way almost 90% of grads stay just for cheese and jobs. Sounds like a stretch! 🤷‍♂️",0.9784735812133072
0.0,0.037037037037037035,0.0,0.037037037037037035,0.0,0.037037037037037035,0.037037037037037035,0.0,"Is it all about the cheese and jobs, or is there more to why grads stay in Wisconsin? 🤔 What do you think makes it so appealing?",0.9737098344693281
0.0,0.06666666666666667,0.0,0.0,0.0,0.06666666666666667,0.06666666666666667,0.0,Wisconsin cheese and staying local? Coincidence or just smart moves? 🤔 What do y'all think?,0.9852216748768473
0.0,0.047619047619047616,0.0,0.0,0.047619047619047616,0.047619047619047616,0.0,0.0,"Why do you think so many grads choose to stay in Wisconsin? Is it the cheese, jobs, or something else? 🧀🏢🤔",0.0
0.19047619047619047,0.0,0.023809523809523808,0.023809523809523808,0.023809523809523808,0.023809523809523808,0.047619047619047616,0.0,"Wisconsin's got that special vibe, ya know? 😎 It's not just the cheese, it's the whole package! Great jobs, cool people, and a sense of community. Plus, when you find a place that feels like home, why leave? 🏡💙",0.9794319294809011
0.0,0.0,0.0,0.08333333333333333,0.0,0.0,0.0,0.0,Who wouldn't want to stay with all that cheese and job security? 🤔 Anyone else thinking of sticking around Wisconsin after graduation? 🧀📈,0.0
0.08333333333333333,0.0,0.0,0.08333333333333333,0.0,0.041666666666666664,0.0,0.0,Why would anyone wanna stick around in Wisconsin after graduating? 🤔 Isn't the whole point of college to explore new places? 🌍,0.0
0.041666666666666664,0.041666666666666664,0.0,0.0,0.0,0.041666666666666664,0.08333333333333333,0.0,Who knew cheese and careers were the perfect combo? 🧀🎓 Do you think staying in Wisconsin is the best move for UW grads? 🤔,0.9881422924901185
0.11764705882352941,0.0,0.029411764705882353,0.029411764705882353,0.0,0.0,0.058823529411764705,0.0,Wisconsin's the place to be! 🎉 UW grads know the deal with all those job opportunities and delicious cheese curds. Who would wanna leave when you've got all that goodness? 😎🧀,0.983284169124877
0.1,0.0,0.0,0.0,0.0,0.0,0.1,0.0,Is staying in Wisconsin after graduation really that great? 🤔,0.9900990099009901
0.07894736842105263,0.0,0.0,0.02631578947368421,0.0,0.0,0.07894736842105263,0.02631578947368421,"Wisconsin's got it all! 🎉 It's like the perfect combo of career and lifestyle. Who wouldn't wanna stay with all that cheese and good times? 🍻 Plus, those job opportunities are no joke! 💪",0.4952947003467063
0.10344827586206896,0.0,0.0,0.06896551724137931,0.0,0.034482758620689655,0.06896551724137931,0.034482758620689655,"Lol, right? 😂 Seems a bit too good to be true. Like, are they all just sticking around for the cheese curds and Packers games? I doubt it! 🤨",0.3301419610432486
0.18181818181818182,0.0,0.030303030303030304,0.06060606060606061,0.030303030303030304,0.0,0.09090909090909091,0.0,"That's awesome! 🎉 UW grads know where it's at! Wisconsin must be doing something right to keep them around. Cheese, beer, and good vibes, who wouldn't wanna stay? 😂🧀🍻",0.9891196834817013
0.1276595744680851,0.0,0.0,0.0425531914893617,0.02127659574468085,0.02127659574468085,0.10638297872340426,0.0,"Wisconsin's got it all! 🎉 Great cheese, great jobs, and great people. No wonder UW grads wanna stay! 🧀💪 Plus, who wouldn't wanna be in a place where you can have both a solid career and some of the best cheese around? 😂",0.9906875371507826
0.08823529411764706,0.0,0.0,0.0,0.0,0.0,0.08823529411764706,0.0,"@user_58 It's gotta be the cheese! 😂 But seriously, Wisconsin is awesome! Great jobs, cool people, and the vibe is just right. Plus, who wants to leave all that cheese behind? 🧀❤️",0.988793671720501
0.14285714285714285,0.05714285714285714,0.0,0.0,0.05714285714285714,0.02857142857142857,0.05714285714285714,0.0,"Haha, true that! Wisconsin's got its charm for sure. Plus, who can say no to all that cheese? 🧀😋 And staying close to where you studied makes sense if there are good job opportunities!",0.9828009828009828
0.08695652173913043,0.0,0.0,0.0,0.0,0.0,0.08695652173913043,0.043478260869565216,"Maybe they just love the Packers and the cold! 😂 But seriously, Wisconsin's got some good vibes and opportunities. Who knows? 🤷‍♀️",0.33079722130334105
0.2631578947368421,0.0,0.0,0.0,0.0,0.0,0.21052631578947367,0.0,That's awesome! 🎉 Shows how much grads love WI! 💚 Such a great place to live and work!,0.9952724558347847
0.03125,0.0,0.0,0.03125,0.0,0.0,0.03125,0.09375,"Nah, not buying it. 🤔 Staying just for cheese and some so-called ""opportunities""? Sounds like a lame excuse to me. People need to explore more, not just hang around Wisconsin forever. 😒",-0.49603174603174605
0.11538461538461539,0.0,0.0,0.07692307692307693,0.038461538461538464,0.0,0.11538461538461539,0.0,Is it really that great tho? 🤔 What about finding better opportunities elsewhere? 🌍 Is cheese and local vibes enough to keep everyone around forever? 🤷‍♂️,0.991407799074686
0.1111111111111111,0.0,0.0,0.0,0.0,0.0,0.1111111111111111,0.07407407407407407,Cheese and jobs? More like cheese and boredom! 😒 Who wants to be stuck in Wisconsin forever? There are way better places to live and work. 🌍,0.1989258006763477
0.04,0.04,0.0,0.04,0.0,0.04,0.08,0.04,"@user_8 Haha, for sure! Can't blame 'em for sticking around with all that cheese and beer goodness! Plus, those Packers fans are hardcore! 🧀🍻🏈",0.3305785123966942
0.0,0.05,0.0,0.1,0.0,0.05,0.0,0.0,Why do you think so many UW grads stick around? Is it really all about the cheese and jobs? 🤔,0.0
0.11904761904761904,0.047619047619047616,0.0,0.0,0.0,0.047619047619047616,0.07142857142857142,0.0,"Totally agree! 😂 Who wants to stay in Wisconsin forever? Like, there’s gotta be better places out there! Plus, who even believes these stats? Feels like they're just making stuff up to make the state look good. 🙄",0.9861932938856016
0.13333333333333333,0.03333333333333333,0.0,0.1,0.0,0.03333333333333333,0.1,0.0,"Wisconsin love! 💚 Totally agree, it's all about that cheese life and solid job market. Plus, who wouldn't wanna stick around for those awesome community vibes? 🎉",0.9900990099009901
0.1935483870967742,0.0,0.03225806451612903,0.0,0.0,0.0,0.06451612903225806,0.0,"Wisconsin’s got it all! Cheese, jobs, and a great community vibe! 🧀💪 UW grads know what's up. Why leave when you’ve got everything right here? 🌟",0.9847365829640571
0.11538461538461539,0.038461538461538464,0.0,0.0,0.0,0.038461538461538464,0.038461538461538464,0.0,"Wisconsin's got the cheese and the jobs, huh? 🧀💼 But is it really the best place to stay after college? What do y'all think? 🤔",0.9746588693957114
0.047619047619047616,0.0,0.0,0.047619047619047616,0.0,0.0,0.047619047619047616,0.047619047619047616,Not everyone sticks around just for cheese and jobs. 😂 Some people just love the Packers or the cold winters! 🏈❄️,0.0
0.03571428571428571,0.0,0.0,0.07142857142857142,0.0,0.0,0.03571428571428571,0.03571428571428571,"LOL, maybe they just really love the cold and cheese curds! 😂 But seriously, maybe it's the job market or family ties keeping them there. Who knows? ",0.0
0.125,0.041666666666666664,0.0,0.08333333333333333,0.0,0.041666666666666664,0.08333333333333333,0.0,Anyone else think it's more about family ties and comfort zones? 🤔 Or maybe the Packers' influence is stronger than we thought? 🏈😂,0.9881422924901185
0.05,0.0,0.0,0.05,0.0,0.0,0.05,0.0,Cheese and jobs? Count me in! 😂 UW grads are smart for sticking around. Wisconsin's got the goods! 💼🧀,0.9803921568627451
0.058823529411764705,0.0,0.0,0.058823529411764705,0.058823529411764705,0.0,0.0,0.0,Is it the cheese or the Packers that keep 'em there? 😂 Would you stick around? 🏈🧀,0.0
0.14285714285714285,0.03571428571428571,0.03571428571428571,0.03571428571428571,0.0,0.0,0.03571428571428571,0.0,"Cheese and jobs, huh? 😂 Not sure if that's all everyone wants. Some people might be looking for more than just cheese and work, ya know? 🤔",0.9727626459143969
0.058823529411764705,0.0,0.0,0.029411764705882353,0.029411764705882353,0.029411764705882353,0.0,0.029411764705882353,"Nah, not buying it. 😒 I bet those grads are just sticking around 'cause they can't find jobs elsewhere or are stuck with student loans. It's not all cheese and rainbows. 🤷‍♂️",-0.9671179883945841
0.1388888888888889,0.0,0.027777777777777776,0.0,0.027777777777777776,0.05555555555555555,0.05555555555555555,0.0,"@user_30 Haha, it's gotta be the cheese, right? 😂 But honestly, Wisconsin's got a lot to offer! Great job market, awesome community vibes, and let's not forget those Packers games! 🏈💚 #WisconsinPride",0.9823182711198428
0.07692307692307693,0.0,0.0,0.0,0.0,0.0,0.11538461538461539,0.0,"Cheese and careers, what a mix! 😂 Honestly, if they love the place and it works for them, why not? Wisconsin's got its charm! 🌟",0.991407799074686
0.12121212121212122,0.0,0.030303030303030304,0.0,0.0,0.0,0.06060606060606061,0.030303030303030304,"Come on, @user_6! Wisconsin's got more than just cheese and jobs, bro! 🍻 People stay for the chill vibes, cool cities, and the awesome community. UW grads know what's up! 🎓💪",0.32970656116056707
0.10869565217391304,0.0,0.0,0.0,0.0,0.0,0.043478260869565216,0.0,"Cheese and jobs, lol! 😂 Yeah, Wisconsin isn't everyone's cup of tea, but some folks love the local vibe and job market. To each their own, right? 🤷‍♂️ Some people just wanna stay close to home or they dig the cheese life! 🧀⛄️",0.9775171065493646
0.08,0.04,0.0,0.0,0.0,0.04,0.08,0.0,Totally agree! Wisconsin's got it all! The job scene is lit and the cheese is unbeatable. UW grads are smart for staying! 🎓🧀 #WisconsinLove,0.9876543209876543
0.045454545454545456,0.0,0.045454545454545456,0.0,0.045454545454545456,0.045454545454545456,0.09090909090909091,0.045454545454545456,"Cheese and jobs are cool, but don't forget the cold winters! 🥶❄️ Gotta love Wisconsin for keeping grads close though!",0.3309066843150232
0.2916666666666667,0.0,0.0,0.0,0.0,0.0,0.20833333333333334,0.0,That's awesome! 🎉 Wisconsin must be a great place to live and work. Keeping talent local is so important for the community! 💪,0.9952229299363057
0.0,0.045454545454545456,0.0,0.0,0.0,0.045454545454545456,0.0,0.045454545454545456,"Is it really the cheese and beer, or is it just hard to leave home? 🤔 What do you guys think? 🍻🧀",-0.9784735812133072
0.045454545454545456,0.0,0.0,0.0,0.0,0.0,0.045454545454545456,0.0,"Lol, totally! 😂 Seems kinda fishy, right? Like, who stays just for cheese? 🧀 Maybe the stats are just hyped up! 🤔",0.9784735812133072
0.15625,0.0,0.0,0.0,0.0,0.0,0.03125,0.0625,Cheese curds and vibes? 😂 That's why people stay? Seems like a lame excuse to me. There’s more to life than just cheese and staying in one place! 🌍✌️,-0.32981530343007914
0.0,0.041666666666666664,0.0,0.041666666666666664,0.0,0.041666666666666664,0.0,0.0,"Why do you think so many UW grads stick around in Wisconsin after graduating? Is it the cheese, the jobs, or something else? 🧀🤔",0.0
0.06666666666666667,0.06666666666666667,0.0,0.0,0.0,0.06666666666666667,0.0,0.0,Do you think it's the cheese or the job market keeping them there? 😂🧀,0.0
0.0,0.05555555555555555,0.0,0.05555555555555555,0.0,0.05555555555555555,0.0,0.0,Is it all about the cheese or the jobs? 🤔 What do you think keeps grads in WI?,0.0
0.25,0.0,0.05,0.0,0.0,0.0,0.1,0.0,"Wisconsin's got it all, right? Cheese, jobs, and a solid community. UW grads know what's up! 🧀💪 #WisconsinPride",0.9900990099009901
0.0967741935483871,0.03225806451612903,0.0,0.0,0.0,0.03225806451612903,0.06451612903225806,0.03225806451612903,"Who even wants to stay in Wisconsin forever? 😒 It's like they can't imagine life outside cheese and cold winters. 🥶 There are better places to explore, people! 🌍",0.32992411745298583
0.16,0.0,0.0,0.0,0.0,0.0,0.04,0.0,"Nah, I don't buy it. People move for jobs all the time. Staying in one place isn't always the best career move. 🌍💼",0.975609756097561
0.0,0.05555555555555555,0.0,0.05555555555555555,0.0,0.05555555555555555,0.0,0.0,Why do you think so many grads stick around? Is it really just the cheese and jobs? 😂,0.0
0.0,0.0,0.0,0.0,0.0,0.0,0.0,0.058823529411764705,"Is staying in Wisconsin really the dream for UW grads, or are they just stuck there? 🤔💼🧀",-0.983284169124877
0.1875,0.0,0.0,0.0,0.0625,0.0,0.125,0.0,That's awesome! 🎓 Wisconsin must be doing something right to keep all those grads! 🤩,0.9920634920634921
0.07142857142857142,0.03571428571428571,0.0,0.07142857142857142,0.0,0.0,0.0,0.03571428571428571,Wisconsin? Really? 🙄 It's just cheese and cold winters. Not sure why anyone would wanna stick around when there are way cooler places to be! 🌍,-0.9727626459143969
0.03571428571428571,0.0,0.0,0.07142857142857142,0.0,0.0,0.07142857142857142,0.03571428571428571,"Lol, maybe they're just really into the Packers or love the cold. 🤷‍♀️ Who knows! But hey, if the jobs are good, why not stick around? 🧀🏈",0.33025099075297226
0.11538461538461539,0.0,0.0,0.0,0.0,0.0,0.07692307692307693,0.0,"Cheese curds and good vibes, can't beat that combo! 😆 Plus, who needs to go far when you got everything right there in Wisconsin? 🏞️",0.9871668311944719
0.0,0.05263157894736842,0.0,0.0,0.0,0.05263157894736842,0.10526315789473684,0.0,Is staying in Wisconsin after graduation a smart move or just settling for comfort? 🤔 What do you think?,0.9905894006934126
0.12,0.0,0.0,0.08,0.04,0.0,0.08,0.0,Wisconsin must be doing something right if almost all UW grads stick around! 🎓💪 It's like the cheese and Packers keep 'em hooked! 🧀🏈,0.9876543209876543
0.07142857142857142,0.03571428571428571,0.0,0.07142857142857142,0.0,0.03571428571428571,0.0,0.03571428571428571,Why would anyone wanna stick around just for that? 🤨 Got a feeling there's more to the story. Anyone else think it's just hype? 🧀💼,-0.9727626459143969
0.10344827586206896,0.0,0.0,0.034482758620689655,0.0,0.0,0.034482758620689655,0.0,Why would anyone wanna stay in Wisconsin forever? 🤷‍♂️ There's a whole world out there! 🌍 Isn't it better to explore new places and opportunities? 🤔,0.9718172983479105
0.12903225806451613,0.0,0.0,0.0,0.0,0.0,0.0,0.0,"Nah, I don't buy it. There's no way 90% of grads stay! 🤨 Maybe they're just counting those who leave and come back for the cheese festivals. 😂",0.0
0.1724137931034483,0.0,0.034482758620689655,0.0,0.0,0.0,0.10344827586206896,0.0,That's awesome! 🎉 Shows how much people love Wisconsin and the opportunities it offers. UW grads know where it's at! 💪 Badger pride all the way! 🦡❤️,0.9904258831297458
0.038461538461538464,0.038461538461538464,0.0,0.11538461538461539,0.0,0.07692307692307693,0.038461538461538464,0.038461538461538464,"Lol, I doubt it! 🤔 People move around a lot these days, especially after college. Seems like a stretch to say nearly 90% stick around. 🤷‍♂️",0.0
0.16666666666666666,0.0,0.0,0.05555555555555555,0.05555555555555555,0.0,0.16666666666666666,0.0,That's awesome! 🎓💪 Wisconsin must be doing something right to keep all those talented grads around! 🧀🌟,0.9940357852882704
0.125,0.0,0.041666666666666664,0.0,0.0,0.0,0.0,0.0,"Cheese and jobs, huh? 😂 Not everyone's into that! Some grads wanna explore new places, ya know? 🌍 Not everyone stays put!",0.0
0.09523809523809523,0.0,0.0,0.0,0.0,0.0,0.0,0.0,"Is it the cheese or the job market that's keeping them there? 😂 What's the secret sauce, Wisconsin? 🧀💼",0.0
0.05405405405405406,0.0,0.0,0.0,0.0,0.0,0.02702702702702703,0.05405405405405406,Cheese and careers? Please! 🧀😂 Staying in Wisconsin just cuz they graduated there is like being stuck in a cheese trap! 🐭 There’s so much more out there than just staying in one place! 🌎,-0.3292723081988805
0.17391304347826086,0.043478260869565216,0.0,0.08695652173913043,0.043478260869565216,0.043478260869565216,0.13043478260869565,0.0,"That's awesome! 🎉 UW must be doing something right to keep grads sticking around. Wisconsin's got that charm, I guess! 🧀💚",0.9923916639100232
0.1,0.0,0.0,0.1,0.0,0.05,0.0,0.05,"Honestly, doubt it. Staying in one place ain't for everyone. Some might wanna explore beyond cheese country! 🌍✌️",-0.9803921568627451
0.13333333333333333,0.0,0.0,0.044444444444444446,0.0,0.0,0.08888888888888889,0.0,"Honestly, it’s probably a mix of everything! Wisconsin's got that cheese magic 🧀, but there are also solid job opportunities and a great community vibe. Plus, who wouldn't wanna stay in a place with such awesome people and scenery? 🌲",0.9888751545117429
0.045454545454545456,0.0,0.0,0.045454545454545456,0.0,0.0,0.09090909090909091,0.0,That's awesome! 🎉 UW grads love Wisconsin so much they stick around! Must be all the cheese and Packers games! 🧀🏈,0.9891196834817013
0.08,0.04,0.0,0.04,0.0,0.04,0.0,0.0,@user_8 Do you think the Packers are a big reason people stay? Or is it more about job opportunities and the vibe in Wisconsin? 🤔,0.0
0.125,0.0,0.0,0.0625,0.0,0.0,0.09375,0.0,"Wow, that's a lot of grads sticking around! 🎓 Guess UW is doing something right if people wanna stay. Wisconsin must have some charm or maybe just good cheese! 🧀",0.9894459102902374
0.041666666666666664,0.0,0.0,0.041666666666666664,0.0,0.0,0.0,0.0,Why would anyone want to stay in Wisconsin just for cheese and a job? 🤔 Isn't there more to life than that? 🍕💼,0.0
0.06666666666666667,0.0,0.0,0.0,0.0,0.0,0.13333333333333333,0.06666666666666667,That's pretty wild! 🤯 Guess they really love their cheese and Packers there! 🧀🏈 ,0.33167495854063017
0.09523809523809523,0.0,0.0,0.0,0.0,0.0,0.0,0.0,Is it the cheese or the jobs keeping them there? 🧀💼 What's your take on staying in Wisconsin after graduation?,0.0
0.037037037037037035,0.07407407407407407,0.0,0.037037037037037035,0.0,0.07407407407407407,0.0,0.0,"Why do you think so many UW grads decide to stick around Wisconsin after finishing school? 🤔 Is it the cheese, the jobs, or something else? 🧀💼",0.0
0.19047619047619047,0.0,0.0,0.047619047619047616,0.0,0.0,0.0,0.0,"Lol, no way that's true! 🤔 People move around a lot for jobs and life changes. Not buying it! 🏃‍♂️💼",0.0
0.13333333333333333,0.0,0.0,0.03333333333333333,0.0,0.06666666666666667,0.0,0.03333333333333333,"Lol, where did you hear that? 🤔 I doubt it's that high. People move all the time for jobs or life changes. 90% sounds kinda fishy to me. 🤷‍♂️",-0.970873786407767
