bias words,assertatives,factives,hedges,implicatives,report verbs,positive opinion words,negative opinion words,message,polarity
0.14,0.0,0.0,0.04,0.02,0.02,0.02,0.02,"Wow, hold up! 🤨 More funds don't always mean better education. Throwing money at schools won't magically fix everything. 🙄 It's not just about facilities and teachers, it's about how that money's used. Let's not get carried away thinking money solves all problems. 💸🚫",0.0
0.11764705882352941,0.0,0.0,0.0,0.029411764705882353,0.029411764705882353,0.058823529411764705,0.0,Exactly! 💯 More money doesn't mean better results. Seen it happen too many times where funds just vanish into thin air. 🤷‍♂️ Hope they actually use it for something useful this time! 🤞,0.983284169124877
0.17647058823529413,0.0,0.0,0.0,0.058823529411764705,0.0,0.058823529411764705,0.0,Why do schools get more money than the city? 🤔 Isn't city infrastructure important too? 🏙️💸,0.983284169124877
0.07407407407407407,0.0,0.0,0.0,0.0,0.0,0.0,0.0,"""Is it really gonna make that much of a difference though? 🤔 Like, will the extra cash actually go where it's needed? Just curious! 💸""",0.0
0.14285714285714285,0.0,0.0,0.0,0.0,0.0,0.0,0.07142857142857142,"Wow, that's wild! 🤯 It's crazy how schools are getting more funding than the city itself! Wonder how this will impact education and city services. 🤔",-0.9861932938856016
0.2,0.0,0.0,0.0,0.03333333333333333,0.0,0.1,0.0,"Education is key, right? 📚 More funds for schools is a win! Investing in our kids' future is the best thing we can do. Let's go MPS! 👏 #EducationMatters",0.9900990099009901
0.20588235294117646,0.0,0.0,0.029411764705882353,0.0,0.0,0.029411764705882353,0.0,"What's the deal with schools getting more tax money than the city itself? 🤔 Isn't the city supposed to handle way more stuff? Like, how's this even fair to taxpayers? 💸",0.9671179883945841
0.14814814814814814,0.037037037037037035,0.0,0.0,0.0,0.037037037037037035,0.07407407407407407,0.0,"Totally agree! 🙌 Investing in schools is like planting seeds for a brighter future. More cash means more opportunities for the kiddos. Let's go, Milwaukee! 🎉🏫",0.986679822397632
0.11538461538461539,0.0,0.0,0.0,0.0,0.0,0.11538461538461539,0.038461538461538464,"Wow, that's wild! 🎉 Education is super important, so if it means better schools and resources for the kids, I'm all for it! 📚✨",0.49677098857426727
0.1388888888888889,0.027777777777777776,0.027777777777777776,0.0,0.0,0.0,0.027777777777777776,0.0,"Nah, I don't buy it. Sounds like someone's just stirring the pot. 🤔 Schools getting more than the city? Not sure that's the full picture. Always gotta dig deeper, ya know? 📉",0.9652509652509652
0.125,0.0,0.0,0.0,0.0,0.0,0.041666666666666664,0.0,"Wow, that's a big shift! 🤔 Schools getting more funds than the city itself? Hope it means better education for the kids! 📚👩‍🏫",0.9765625
0.09375,0.0,0.0,0.0,0.0,0.0,0.0625,0.03125,Seriously? 🤦‍♂️ Why are we giving more money to schools than the city itself? It's not like they're using it to improve education. Just more waste of taxpayer money! 🙄,0.32981530343007914
0.16129032258064516,0.06451612903225806,0.0,0.0,0.0,0.0967741935483871,0.03225806451612903,0.03225806451612903,"Do you think they'll really make a difference this time or just waste it again? 🤔 It's like, we hear this stuff all the time! What do y'all think?",0.0
0.17857142857142858,0.03571428571428571,0.0,0.0,0.0,0.03571428571428571,0.0,0.03571428571428571,Isn't it kinda wild how schools are getting more tax money than the city now? 🤔 What do y'all think this means for Milwaukee's future? 🏫💰,-0.9727626459143969
0.13513513513513514,0.02702702702702703,0.0,0.0,0.0,0.02702702702702703,0.08108108108108109,0.0,"Isn't it awesome that Milwaukee Public Schools are getting more funds than the city? 🎉 More money for education means better schools, right? What do you think this means for the future of our kids? 📚✨",0.9878169245966414
0.09090909090909091,0.0,0.0,0.0,0.0,0.0,0.09090909090909091,0.0,"Yeah, education is super important! 🎓 But man, those taxes tho... 😅 Hope it really makes a difference for the kids! 🤞",0.9891196834817013
0.1111111111111111,0.027777777777777776,0.0,0.027777777777777776,0.0,0.027777777777777776,0.08333333333333333,0.0,Milwaukee Public Schools getting more funds is awesome! 🎉 Education should always be a priority. Investing in schools means investing in our future. Let's hope this leads to better resources for students and teachers. 📚💪,0.9881422924901185
0.10344827586206896,0.0,0.0,0.034482758620689655,0.0,0.0,0.10344827586206896,0.034482758620689655,"Wow, that's crazy! But honestly, if it means better schools and education for the kids, I'm all for it! 📚🙌 Education should be a top priority, right?",0.4964010920824026
0.10810810810810811,0.0,0.0,0.0,0.0,0.0,0.10810810810810811,0.02702702702702703,"Wow, that's kinda wild! 😲 But if it means better schools for the kids, I'm all for it! 📚💪 Education is super important, and investing in it is a win for everyone. Go Milwaukee! 🎉",0.5955926146515783
0.14705882352941177,0.0,0.029411764705882353,0.0,0.0,0.029411764705882353,0.14705882352941177,0.0,"Wow, that's awesome! 🎉 Investing more in schools is always a win. Education is the key to a better future, right? 📚💪 Time to see some real improvements for the kids in Milwaukee!",0.9932459276916965
0.16666666666666666,0.0,0.0,0.03333333333333333,0.0,0.0,0.06666666666666667,0.0,"Nah, that can't be right. 🤔 Sounds like someone's just stirring the pot. I've seen this kind of stuff before, and it's usually not true. 🤷‍♂️",0.9852216748768473
0.20588235294117646,0.0,0.029411764705882353,0.029411764705882353,0.0,0.058823529411764705,0.11764705882352941,0.0,"Wow, that's awesome! 🎉 Education should be a top priority, and it's great to see Milwaukee Public Schools getting more support. Investing in schools means investing in the future. 📚💪 Go Milwaukee!",0.9915716410510659
0.18181818181818182,0.0,0.045454545454545456,0.022727272727272728,0.0,0.06818181818181818,0.13636363636363635,0.0,"Wow, that's a big deal! 🎉 Education should be a top priority, and it's awesome to see the community supporting schools like this. More funds mean better resources for the kids! 📚💪 Can't wait to see the positive changes this brings!",0.9927200529450695
0.25,0.0,0.03125,0.0,0.0,0.0625,0.1875,0.0,"Wow, that's awesome! 🎉 Education is super important, so it's great to see Milwaukee Public Schools getting more support. 📚 Investing in our kids' future is always a win! 🏆",0.9946949602122016
0.22727272727272727,0.0,0.0,0.0,0.0,0.0,0.18181818181818182,0.0,That's awesome! 🎉 Investing in education is super important. Milwaukee's future is looking bright with this focus on schools. 📚✨,0.9945300845350572
0.12,0.0,0.0,0.0,0.0,0.0,0.04,0.0,"Nah, don't buy it. 🤔 Sounds like someone's just trying to stir the pot. Schools having more than the city? 🤨 Doubt it!",0.975609756097561
0.1875,0.0,0.0,0.0,0.0,0.0,0.125,0.0,"Wow, that's a big move! 🎉 Education is super important, and seeing the community invest more in schools is amazing. Kids are the future, and they deserve the best resources! 📚💪",0.9920634920634921
0.18518518518518517,0.0,0.0,0.0,0.037037037037037035,0.037037037037037035,0.037037037037037035,0.07407407407407407,"Wow, that's wild! 🎢 It's crazy how things can change over time. I wonder how this will impact the schools and the city services. 🤔",-0.3303600925008259
0.21052631578947367,0.0,0.05263157894736842,0.0,0.0,0.10526315789473684,0.10526315789473684,0.0,"Wow, that's a big deal! 🎉 It's awesome to see education getting the support it deserves. More funds for schools mean better resources and opportunities for students. 📚✨ Excited to see how this benefits the community!",0.9905894006934126
0.19230769230769232,0.0,0.0,0.0,0.0,0.0,0.07692307692307693,0.038461538461538464,Who even thought this was a good idea? 🤔 Schools getting more money than the city itself? Sounds like someone's priorities are messed up! 😤,0.3304692663582287
0.13333333333333333,0.0,0.0,0.06666666666666667,0.0,0.06666666666666667,0.06666666666666667,0.06666666666666667,"Lol, I doubt that's even true. Sounds like some made-up drama to me. 🤔",0.0
0.1724137931034483,0.034482758620689655,0.0,0.0,0.0,0.034482758620689655,0.0,0.034482758620689655,What's up with Milwaukee Public Schools having a bigger tax levy than the city itself? 🤔 Anyone else think it's wild how school taxes are taking over?,-0.9718172983479105
0.1724137931034483,0.034482758620689655,0.0,0.034482758620689655,0.0,0.06896551724137931,0.13793103448275862,0.0,"Wow, that's awesome! 🎉 Education should always be a top priority. More funds mean better resources for the kids. Let's hope this brings some positive changes! 📚💪",0.9928021841648051
0.16129032258064516,0.03225806451612903,0.0,0.0967741935483871,0.0,0.03225806451612903,0.0,0.03225806451612903,"Wow, that's crazy! 🤯 Who would've thought schools would end up with a bigger tax levy than the whole city? I guess education is getting some serious attention. 📚💰",-0.9699321047526673
0.14285714285714285,0.0,0.0,0.0,0.0,0.02857142857142857,0.14285714285714285,0.0,"Milwaukee Public Schools getting a bigger slice of the pie is awesome! 🎉 Education is super important, and investing in schools means better opportunities for the kids. Let’s support our future leaders! 📚💪",0.9930486593843099
0.15625,0.03125,0.03125,0.0,0.0,0.0625,0.0,0.0,Did anyone else see that Milwaukee Public Schools now have a bigger tax levy than the city? 🤔 What do you think this means for the schools and the city budget? 📚🏙️,0.0
0.11764705882352941,0.029411764705882353,0.029411764705882353,0.0,0.0,0.058823529411764705,0.058823529411764705,0.0,"More funds for schools is a win! 🎉 Better education for the kids, more opportunities, and a brighter future. What changes do you hope to see in the schools with this extra cash? 🤔📚",0.983284169124877
0.2,0.0,0.0,0.04,0.0,0.0,0.04,0.04,That's wild! 🤯 It's about time education gets the priority it deserves. Schools need more funds to give kids a brighter future. 📚✨,0.0
0.15384615384615385,0.05128205128205128,0.0,0.0,0.02564102564102564,0.05128205128205128,0.10256410256410256,0.02564102564102564,"Wow, that's pretty wild! 🎓📈 Gotta say, investing in schools is always a win. More funds for education can lead to better resources and opportunities for the kids. Let's hope it makes a real difference! 💪📚",0.5953562214725144
0.13636363636363635,0.0,0.0,0.09090909090909091,0.045454545454545456,0.0,0.045454545454545456,0.045454545454545456,"Wow, that's crazy! 🤯 But honestly, it's about time schools get more funds. Education should be a top priority. 📚✨",0.0
0.19230769230769232,0.0,0.0,0.0,0.07692307692307693,0.038461538461538464,0.11538461538461539,0.038461538461538464,"Wow, that's crazy! 🤯 Education getting more funds is awesome! Schools need all the support they can get. 📚 Kids are the future, right? 🎓",0.49677098857426727
0.13157894736842105,0.02631578947368421,0.02631578947368421,0.02631578947368421,0.0,0.05263157894736842,0.02631578947368421,0.0,Did you see that Milwaukee Public Schools now has a bigger tax levy than the city itself? 🤔 What do you think about schools getting more funds than the city? Is it a good move or nah? 📚🏙️,0.9633911368015414
0.21428571428571427,0.0,0.03571428571428571,0.0,0.03571428571428571,0.03571428571428571,0.21428571428571427,0.0,"Wow, that's awesome! 🎉 Education is super important, and it's great to see Milwaukee investing more in schools. Kids deserve the best resources to succeed! 📚✨",0.9953550099535501
0.13793103448275862,0.0,0.0,0.0,0.0,0.0,0.034482758620689655,0.0,"Who even thought this was a good idea?! 🤦‍♂️ Like, seriously, more taxes for schools? Where’s all that money even going? Probably not to the students! 🙄",0.9718172983479105
0.2564102564102564,0.02564102564102564,0.02564102564102564,0.0,0.0,0.07692307692307693,0.07692307692307693,0.0,"Wow, that's a big shift! 📚💰 It's awesome to see more support for education. Investing in schools means investing in the future. Let's hope it brings some positive changes for the kids and the community! 🎉",0.9871668311944719
0.12,0.0,0.04,0.0,0.0,0.04,0.08,0.0,"Nah, that can't be right. 🤔 Sounds like someone got their wires crossed. Let's see the real numbers before jumping to conclusions! 📊",0.9876543209876543
0.17777777777777778,0.022222222222222223,0.022222222222222223,0.0,0.044444444444444446,0.06666666666666667,0.06666666666666667,0.0,"Wow, that's a big shift! 📚💸 It's awesome to see more funds going towards education. Schools need all the support they can get to provide better resources for students. Let's hope this makes a real difference for the kids in Milwaukee! 🙌",0.9852216748768473
0.16,0.0,0.0,0.0,0.04,0.0,0.08,0.04,"Nah, that doesn't sound right. 🤔 People always twist numbers to fit their agenda. Just another day in the world of taxes, right? 😂",0.3305785123966942
0.13513513513513514,0.0,0.0,0.0,0.0,0.02702702702702703,0.08108108108108109,0.02702702702702703,"Wow, that's crazy! 😲 It's like the schools are getting more cash than the city now. I wonder what they're gonna do with all that money. Hope it goes to good use! 💰📚",0.49541738915035916
0.11428571428571428,0.0,0.0,0.02857142857142857,0.0,0.0,0.0,0.0,What's up with Milwaukee Public Schools getting more tax levies than the city itself after the referendum? 🤔 Anyone got thoughts on how this might affect both the schools and the city services? 📊💭,0.0
0.08,0.0,0.0,0.0,0.0,0.0,0.0,0.04,"Nah, I don't buy it. 🤔 There's always some twist with these numbers. Maybe they're just trying to stir up drama. 🤷‍♂️",-0.975609756097561
0.22727272727272727,0.0,0.0,0.0,0.0,0.0,0.045454545454545456,0.0,What's up with Milwaukee Public Schools getting more tax levy than the city? 🤔 Is this a good thing or nah?,0.9784735812133072
0.1875,0.03125,0.0,0.03125,0.0,0.03125,0.0,0.03125,"Wow, that's wild! 💸 Schools getting more tax money than the city? I guess education is a big deal there. 🤔 Wonder how this will change things for the city services?",-0.9689922480620154
0.2,0.0,0.0,0.0,0.0,0.0,0.0,0.0,What's your take on Milwaukee Public Schools getting more tax levy than the city itself after the referendum? 🤔,0.0
0.18181818181818182,0.045454545454545456,0.0,0.045454545454545456,0.0,0.045454545454545456,0.0,0.0,Why's Milwaukee Public Schools getting a bigger tax levy than the city now? 🤔 What do y'all think about this change?,0.0
0.2,0.03333333333333333,0.0,0.0,0.0,0.03333333333333333,0.06666666666666667,0.0,"Wow, that's a big win for education! 🎉 More funds for schools means better resources for students. Let's hope this boosts the quality of education in Milwaukee. 📚💪",0.9852216748768473
0.13793103448275862,0.06896551724137931,0.0,0.0,0.0,0.10344827586206896,0.06896551724137931,0.0,Totally agree! 🎉 More funds mean better resources for the kids. I hope they use it for more teachers and updated tech. Maybe some cool after-school programs too! 🤞💡,0.9857072449482503
0.13636363636363635,0.0,0.0,0.0,0.0,0.0,0.045454545454545456,0.0,Why do schools need more money than the city itself? 🤔 Is it really gonna improve education or just more bureaucracy?,0.9784735812133072
0.12903225806451613,0.0,0.0,0.03225806451612903,0.0,0.0,0.03225806451612903,0.0,"Wow, Milwaukee Public Schools taking the lead with that tax levy! 💪 Education should always be a priority. Investing in schools is investing in our future. Let's go, Milwaukee! 📚✨",0.9699321047526673
0.15384615384615385,0.0,0.0,0.0,0.0,0.0,0.0,0.0,Why does Milwaukee Public Schools need more taxes than the whole city? 🤔,0.0
0.18181818181818182,0.0,0.0,0.0,0.0,0.0,0.0,0.0,Why do schools need more money than the whole city? 🤔,0.0
0.17142857142857143,0.02857142857142857,0.0,0.02857142857142857,0.02857142857142857,0.02857142857142857,0.05714285714285714,0.0,@user_49 Absolutely! More cash for schools is always a win! 💪 More teachers and tech upgrades are exactly what they need. After-school programs would be awesome too! Let's hope they make it happen! 📚✨,0.9828009828009828
0.045454545454545456,0.045454545454545456,0.0,0.0,0.0,0.045454545454545456,0.09090909090909091,0.0,Isn't it awesome? 😄 Do you think this will finally help reduce class sizes and give students more personalized attention? 📚👩‍🏫,0.9891196834817013
0.10344827586206896,0.0,0.0,0.0,0.0,0.0,0.06896551724137931,0.034482758620689655,"Wow, that's crazy! 😲 But honestly, investing in education is so important. If it means better schools and opportunities for the kids, I'm all for it! 📚✨",0.3301419610432486
0.10714285714285714,0.0,0.0,0.0,0.0,0.03571428571428571,0.07142857142857142,0.0,"Wow, that's a big shift! 🤔 Seems like the schools are getting some serious funding now. I wonder how that'll impact the city's services. 🤷‍♂️",0.9861932938856016
0.1935483870967742,0.03225806451612903,0.0,0.03225806451612903,0.0,0.0967741935483871,0.06451612903225806,0.0,"Wow, that's a switch-up! 🤔 Schools getting more funds could mean better education, right? But then again, hope it doesn't mean higher taxes for everyone. Balancing act much? 🤷‍♂️",0.9847365829640571
0.15151515151515152,0.0,0.030303030303030304,0.030303030303030304,0.0,0.06060606060606061,0.12121212121212122,0.0,"Wow, that's awesome! 🎉 Education should be a top priority, and it's great to see Milwaukee putting schools first. More funds mean better resources for students and teachers. 📚💪 Go MPS!",0.9918175055789734
0.20833333333333334,0.0,0.0,0.0,0.0,0.0,0.041666666666666664,0.0,What's up with Milwaukee Public Schools having a bigger tax levy than the city now? 🤔 Is this a good thing or nah?,0.9765625
0.15384615384615385,0.0,0.0,0.038461538461538464,0.0,0.0,0.038461538461538464,0.038461538461538464,"Wow, that's wild! 🎉 More funds for schools means better education for the kids. It's about time education gets the priority it deserves! 📚💪",0.0
0.15625,0.03125,0.0,0.03125,0.0625,0.03125,0.0625,0.0,"@user_49 Absolutely! 💯 Kids deserve the best, and more funds can make that happen! Let's hope they invest in awesome teachers and tech upgrades. After-school programs would be a game-changer! 🚀📚",0.984251968503937
0.14285714285714285,0.0,0.0,0.05714285714285714,0.0,0.08571428571428572,0.11428571428571428,0.02857142857142857,"Whoa, that's wild! 😳 I mean, education is super important, but I wonder how people in Milwaukee feel about paying more taxes for schools than the city itself. 🤔 Balancing budgets must be tough!",0.5958291956305859
0.1794871794871795,0.02564102564102564,0.0,0.0,0.02564102564102564,0.05128205128205128,0.10256410256410256,0.02564102564102564,"Wow, that's kinda wild! But hey, investing in schools is like investing in our future, right? 🎓📚 More funds for education can mean better resources for students and teachers. Let's hope it makes a positive impact! 🙌",0.5953562214725144
0.18181818181818182,0.0,0.030303030303030304,0.0,0.0,0.030303030303030304,0.12121212121212122,0.0,"Wow, that's a big shift! 🎉 Education is super important, so it's great to see more resources going to schools. Hopefully, this means better facilities and opportunities for the students! 📚✨",0.9918175055789734
0.2647058823529412,0.0,0.029411764705882353,0.029411764705882353,0.0,0.058823529411764705,0.11764705882352941,0.029411764705882353,"Wow, that's crazy! 🤯 It's about time the schools got more support. Education is super important for the future, so it's awesome to see them getting the funds they need. 📚💪",0.5959475566150177
0.25,0.0,0.03571428571428571,0.0,0.0,0.03571428571428571,0.14285714285714285,0.0,"Wow, that's a big deal! 🎉 Education is super important, and it's great to see Milwaukee investing more in their schools. Kids deserve the best! 📚💪",0.9930486593843099
0.07692307692307693,0.0,0.038461538461538464,0.038461538461538464,0.0,0.038461538461538464,0.038461538461538464,0.038461538461538464,"Nah, I doubt it! 🤔 Sounds like someone’s just trying to stir the pot. Always gotta check those numbers yourself, ya know? 📊",0.0
0.18518518518518517,0.037037037037037035,0.0,0.0,0.0,0.037037037037037035,0.037037037037037035,0.037037037037037035,Why do you think Milwaukee Public Schools ended up with a bigger tax levy than the city itself? 🤔 Is it good or bad for the community?,0.0
0.12903225806451613,0.03225806451612903,0.0,0.03225806451612903,0.0,0.03225806451612903,0.0,0.03225806451612903,"Wow, that's wild! 🤯 I guess education is getting a big chunk of the pie now. Wonder how that's gonna impact the city's budget and services. 🤔",-0.9699321047526673
0.22580645161290322,0.0,0.03225806451612903,0.03225806451612903,0.0,0.06451612903225806,0.12903225806451613,0.03225806451612903,"Wow, that's wild! 🎉 Education should be a top priority, so it's awesome to see schools getting the support they need. 📚💪 Gotta invest in the future, right?",0.5963029218843172
0.07692307692307693,0.0,0.0,0.0,0.0,0.0,0.0,0.038461538461538464,"Wow, that's wild! 🎉 Finally, education getting the priority it deserves! Kids are the future, so investing in schools is a no-brainer. 📚✨ Go Milwaukee!",-0.9746588693957114
0.10810810810810811,0.0,0.0,0.0,0.0,0.02702702702702703,0.1891891891891892,0.0,"Wow, that's huge! Milwaukee Public Schools getting more support is awesome! 🎉 Education is super important, and investing in it is a win for everyone. Hope this leads to better resources and opportunities for students. 📚💪",0.9947420775898821
0.17073170731707318,0.024390243902439025,0.0,0.0,0.024390243902439025,0.024390243902439025,0.12195121951219512,0.0,"Wow, that's a big move for Milwaukee Public Schools! 🎉 Education is super important, and having more resources can really make a difference for the kids. 📚 Let's hope they use it well and make some awesome improvements! 🙌",0.9918666931164452
0.10714285714285714,0.0,0.0,0.03571428571428571,0.0,0.03571428571428571,0.07142857142857142,0.0,"Wow, that's huge for Milwaukee Public Schools! 🎉 More funds could mean better resources and opportunities for the students. Investing in education is always a win! 💪📚",0.9861932938856016
0.06666666666666667,0.0,0.0,0.0,0.0,0.0,0.06666666666666667,0.0,"Nah, I don't buy it. Sounds like someone got their facts mixed up. 🤔",0.9852216748768473
0.20689655172413793,0.0,0.034482758620689655,0.034482758620689655,0.0,0.034482758620689655,0.034482758620689655,0.0,"Nah, that can't be right! Milwaukee's always been about balancing things out. 🤔 Maybe it's just a temporary thing. Let's see how it plays out!",0.9718172983479105
0.27586206896551724,0.0,0.034482758620689655,0.0,0.0,0.034482758620689655,0.13793103448275862,0.034482758620689655,"Wow, that's awesome! 🎉 Education is super important, and it's great to see Milwaukee prioritizing schools. Investing in our kids' future is never a bad idea! 🏫📚",0.5965400676078743
0.11538461538461539,0.038461538461538464,0.0,0.0,0.0,0.038461538461538464,0.0,0.038461538461538464,What's up with Milwaukee Public Schools having a bigger tax levy than the city itself? 🤔 Anyone else think this is crazy or just me?,-0.9746588693957114
0.2,0.025,0.025,0.025,0.0,0.075,0.125,0.0,"Wow, that's awesome! 🎉 Education should be a top priority, and it's great to see Milwaukee stepping up for the schools. More funds mean better resources for the kids. 📚💪 Let's hope this brings some positive changes!",0.9920634920634921
0.1,0.03333333333333333,0.0,0.0,0.0,0.03333333333333333,0.0,0.0,Why do you think Milwaukee Public Schools ended up with a larger tax levy than the city itself? 🤔 Is it gonna make a big difference in the schools?,0.0
0.1935483870967742,0.03225806451612903,0.0,0.0,0.0,0.03225806451612903,0.0967741935483871,0.03225806451612903,"Wow, that's wild! 🎉 More funds for schools is a win! Better education for the kids is always a good thing. 📚✏️ Let's hope this brings some awesome changes!",0.4961548002976929
0.14285714285714285,0.0,0.0,0.0,0.0,0.03571428571428571,0.07142857142857142,0.0,"Finally, some real support for education! 🎉 Milwaukee Public Schools deserve every penny. Investing in our kids' future is the best move ever. Let's go MPS! 📚💪",0.9861932938856016
0.2,0.0,0.03333333333333333,0.03333333333333333,0.0,0.06666666666666667,0.1,0.0,"Wow, that's a big move for Milwaukee Public Schools! 🎉 Education should be a top priority, so it's great to see them getting the support they need. 📚💪",0.9900990099009901
0.13793103448275862,0.0,0.0,0.0,0.0,0.034482758620689655,0.1724137931034483,0.0,"That's awesome! 🎉 Education is super important, and investing in schools is always a good move. More funds mean better resources for students and teachers! 📚💪 Go Milwaukee!",0.9942334460131239
0.14285714285714285,0.0,0.0,0.0,0.0,0.0,0.07142857142857142,0.0,"Nah, don't buy it. Sounds like someone’s twisting the facts. 🤔",0.9861932938856016
0.2903225806451613,0.0,0.03225806451612903,0.0,0.0,0.06451612903225806,0.1935483870967742,0.0,"Wow, that's awesome! 🎉 Education is super important, and it's great to see schools getting the support they need. Investing in our kids' future is always a win! 📚💪",0.994859890565412
0.10526315789473684,0.05263157894736842,0.0,0.0,0.0,0.05263157894736842,0.0,0.0,Why do you think Milwaukee Public Schools ended up with a bigger tax levy than the city itself? 🤔,0.0
