bias words,assertatives,factives,hedges,implicatives,report verbs,positive opinion words,negative opinion words,message,polarity
0.12903225806451613,0.03225806451612903,0.0,0.03225806451612903,0.0,0.06451612903225806,0.06451612903225806,0.06451612903225806,Sounds like a big shake-up! 🤔 Cutting FEMA’s support could really impact disaster response. Privatizing flood insurance? That’s a risky move. What do y’all think?,0.0
0.09090909090909091,0.0,0.0,0.0,0.0,0.0,0.030303030303030304,0.030303030303030304,"Finally! Project 2025 is making moves! 🙌 Cutting FEMA and getting rid of federal-backed flood insurance is a bold step towards reducing unnecessary government spending. Let people handle their own insurance, right? 💪",0.0
0.14583333333333334,0.0,0.020833333333333332,0.08333333333333333,0.0,0.020833333333333332,0.0625,0.020833333333333332,"Honestly, it's about time we shake things up with FEMA and flood insurance! 🤔 Privatizing could make things more efficient and less reliant on federal funds. Plus, local governments should step up more, right? 🌟 Let's see how Project 2025 could bring some fresh changes! 🚀",0.4940711462450594
0.1,0.0,0.0,0.03333333333333333,0.0,0.0,0.03333333333333333,0.03333333333333333,"Finally, someone's doing something about all that waste! 🙌 Cutting FEMA and federal flood insurance is a step in the right direction. More accountability and less government spending! 💸",0.0
0.17391304347826086,0.0,0.0,0.043478260869565216,0.0,0.0,0.0,0.043478260869565216,Why would anyone want to cut FEMA and kill flood insurance? 🤔 How's that gonna help when natural disasters hit? 🌪️🏠,-0.9775171065493646
0.13636363636363635,0.0,0.0,0.045454545454545456,0.0,0.045454545454545456,0.09090909090909091,0.18181818181818182,"Sounds like a mess! 😅 Cutting FEMA's support could really mess up disaster response. Privatizing flood insurance? Idk, sounds risky. 🤔",-0.3321155762205248
0.16666666666666666,0.0,0.0,0.027777777777777776,0.027777777777777776,0.0,0.027777777777777776,0.05555555555555555,"Finally, some common sense! 🙌 It's about time we cut back on wasteful spending. FEMA and federal-backed flood insurance have been a drain for too long. Let's put those resources to better use! 💪",-0.32938076416337286
0.04,0.0,0.04,0.0,0.04,0.0,0.04,0.04,"Sounds like a mess! Cutting FEMA and flood insurance? 🤔 Hope they know what they're doing, 'cause disasters ain't gonna wait! 🌊",0.0
0.06451612903225806,0.03225806451612903,0.0,0.03225806451612903,0.0,0.03225806451612903,0.03225806451612903,0.06451612903225806,"Wow, that's a big deal! Cutting FEMA and flood insurance? 🤔 Sounds like a risky move, especially with all the crazy weather lately. 🌪️💧 What do y'all think about this?",-0.32992411745298583
0.15384615384615385,0.0,0.0,0.038461538461538464,0.038461538461538464,0.038461538461538464,0.07692307692307693,0.038461538461538464,"Nah, that's not gonna happen. People love to spread rumors like that. FEMA's been around forever, and it's not going anywhere. 💁‍♂️",0.3304692663582287
0.16666666666666666,0.041666666666666664,0.0,0.041666666666666664,0.041666666666666664,0.08333333333333333,0.0,0.041666666666666664,"Nah, I don't think that's gonna happen. People always worry about these things, but they rarely end up being true. 🤷‍♂️",-0.9765625
0.07894736842105263,0.0,0.0,0.07894736842105263,0.02631578947368421,0.02631578947368421,0.0,0.0,"Wow, that's a bold move! 🤔 Cutting FEMA and federal flood insurance could have big consequences. Natural disasters ain't going anywhere, and people might feel the heat if they can't get help when needed. 🌊💸",0.0
0.1794871794871795,0.0,0.0,0.02564102564102564,0.0,0.0,0.05128205128205128,0.02564102564102564,"Honestly, it's about time we rethink how we're spending money! 💸 Project 2025 sounds like a smart move to cut unnecessary costs. Federal-backed flood insurance? Maybe it's time for people to take more personal responsibility. 🙌",0.32905561039815723
0.1,0.05,0.0,0.1,0.0,0.05,0.05,0.05,"What do y'all think about this Project 2025 thing? Cutting FEMA and federal flood insurance seems kinda wild, right? 🌊🤔",0.0
0.09090909090909091,0.045454545454545456,0.0,0.0,0.045454545454545456,0.09090909090909091,0.13636363636363635,0.045454545454545456,"Nah, I don't think that's gonna happen. People love to spread rumors like this without any solid proof. 🤷‍♂️",0.4972650422675285
0.09090909090909091,0.0,0.0,0.0,0.045454545454545456,0.0,0.045454545454545456,0.045454545454545456,Sounds like a mess waiting to happen! 🌊 Cutting FEMA and flood insurance? Hope they have a backup plan for disasters! 🤔,0.0
0.16,0.04,0.0,0.0,0.0,0.0,0.04,0.04,"Wow, that's wild! 😮 Cutting FEMA and flood insurance? Not sure how that's gonna work out for people in flood-prone areas. 🌊🤔",0.0
0.0,0.041666666666666664,0.0,0.041666666666666664,0.0,0.041666666666666664,0.0,0.0,"Wait, so are they really gonna cut FEMA and ditch federal flood insurance? 🤔 What do you guys think about this move? 🌊💸",0.0
