bias words,assertatives,factives,hedges,implicatives,report verbs,positive opinion words,negative opinion words,message,polarity
0.13793103448275862,0.0,0.0,0.034482758620689655,0.0,0.0,0.10344827586206896,0.06896551724137931,Who cares? 🤷‍♂️ People need to stop whining about paid leave. Just work hard and you'll be fine. It's not like the world owes you anything! 💪,0.19884668920262477
0.1875,0.0,0.0,0.03125,0.0,0.0,0.03125,0.03125,"Absolutely! It's crazy how behind the US is on this. New parents deserve time to bond with their babies without stressing about work. It's 2023, time for a change! 👶❤️",0.0
0.1875,0.0,0.0,0.0,0.0625,0.0,0.03125,0.0625,Absolutely! It's crazy how behind the US is on this. New parents need that time to adjust and enjoy those first moments. Let's get loud and make it happen! 💪👶,-0.32981530343007914
0.18421052631578946,0.0,0.0,0.0,0.0,0.0,0.02631578947368421,0.02631578947368421,"Nah, I don't buy it. It's not that simple. Things are different everywhere, and the U.S. has its own way of doing stuff. Maybe it's not perfect, but it's not all bad either. 🤷‍♂️",0.0
0.08333333333333333,0.0,0.0,0.027777777777777776,0.0,0.0,0.027777777777777776,0.027777777777777776,"It's crazy that the US is so behind on this! 😤 New parents deserve some time off without stressing about money. Other countries got it right with paid leave. Time to catch up, America! 🍼🇺🇸",0.0
0.16129032258064516,0.0,0.03225806451612903,0.06451612903225806,0.0,0.0,0.0,0.0,I don't know if that's really true 🤔. Maybe there's more to it than just that. People always have different opinions about how things should be done. 🤷‍♂️,0.0
0.08695652173913043,0.0,0.0,0.0,0.08695652173913043,0.043478260869565216,0.043478260869565216,0.0,Why is the US so behind on this? 🤔 New parents deserve all the support they can get! Time for a change! 💪👶,0.9775171065493646
0.20689655172413793,0.034482758620689655,0.0,0.0,0.034482758620689655,0.034482758620689655,0.06896551724137931,0.0,"Totally agree! 🙌 Some states are stepping up and making it happen. It's not perfect, but there's progress. Let's give credit where it's due! 💪",0.9857072449482503
0.041666666666666664,0.08333333333333333,0.0,0.0,0.0,0.08333333333333333,0.0,0.0,Why do you think the U.S. is so behind on this? 🤔 Do you think more states will step up and make changes? 🍼💪,0.0
0.16129032258064516,0.0,0.0,0.0,0.0,0.0,0.0,0.03225806451612903,"Nah, I don't buy it. 🤔 There's gotta be more to the story. Maybe it's not as bad as it sounds or there's some catch. 🤷‍♂️",-0.9699321047526673
0.11428571428571428,0.0,0.0,0.02857142857142857,0.0,0.0,0.02857142857142857,0.02857142857142857,"Nah, the US ain't changing anytime soon. 🤦‍♂️ They love being ""unique"" with their backward policies. It's all about the money, not the people. 💸 Don't hold your breath waiting for change!",0.0
0.16666666666666666,0.03333333333333333,0.0,0.03333333333333333,0.0,0.03333333333333333,0.03333333333333333,0.03333333333333333,Totally agree! It's wild how other countries are nailing it with paid leave. New parents deserve that time without stressin' about work. We seriously need to catch up! 💪👶,0.0
0.15625,0.03125,0.0,0.0,0.0,0.03125,0.09375,0.0625,"It's crazy, right?! 😤 Can't believe the US is still lagging behind on this. New parents deserve better support! Time to catch up with the rest of the world. 🌍👶",0.1987281399046105
0.2,0.0,0.0,0.0,0.03333333333333333,0.0,0.0,0.03333333333333333,"Wait, so the US doesn't have paid leave for new parents? 😳 That's wild! How do people manage with a new baby and no paid time off? 🤔",-0.970873786407767
0.0,0.043478260869565216,0.0,0.043478260869565216,0.043478260869565216,0.043478260869565216,0.08695652173913043,0.0,Why should we settle for less when other countries can do better? 🤷‍♂️ Why can't the U.S. guarantee paid leave nationwide? 💸,0.9886307464162135
0.13636363636363635,0.0,0.0,0.0,0.0,0.045454545454545456,0.09090909090909091,0.09090909090909091,It's crazy how the US is lagging behind on this! 😤 New parents deserve better support. Time for a change! 🍼💪,0.0
0.15789473684210525,0.0,0.0,0.0,0.0,0.0,0.02631578947368421,0.0,"Nah, that's not true! The US has FMLA, which gives unpaid leave. It's not perfect, but it's something. 🤷‍♂️ Some states have their own paid leave laws too. It's not just black and white!",0.9633911368015414
0.1,0.0,0.0,0.0,0.0,0.0,0.0,0.03333333333333333,That's wild! 😮 It's 2023 and still no paid leave for parents in the US? Other countries are way ahead on this. We gotta catch up! 💼👶,-0.970873786407767
0.10526315789473684,0.0,0.0,0.0,0.0,0.0,0.0,0.0,What's your take on the U.S. being one of the few countries without guaranteed paid parental leave? 🤔,0.0
0.09523809523809523,0.0,0.0,0.047619047619047616,0.0,0.0,0.047619047619047616,0.0,Why should the U.S. change its system just cuz other countries do it differently? 🤔 Isn't unpaid leave enough? 🤷‍♂️,0.9794319294809011
0.2222222222222222,0.0,0.037037037037037035,0.037037037037037035,0.0,0.037037037037037035,0.07407407407407407,0.0,"Right on! 🙌 It's about time we see some positive changes. Those states are setting a great example! Hopefully, the rest will catch up soon. 🤞",0.986679822397632
0.2222222222222222,0.027777777777777776,0.0,0.0,0.0,0.027777777777777776,0.027777777777777776,0.027777777777777776,"It's crazy how the U.S. still doesn't guarantee paid leave for new parents! 🤯 Like, come on, it's 2023! Other countries are way ahead on this. It's time for a change! 💪",0.0
0.030303030303030304,0.0,0.0,0.06060606060606061,0.0,0.0,0.030303030303030304,0.030303030303030304,"Ugh, here we go again 🙄... People always whining about this. Maybe it's not perfect, but hey, it is what it is. Not everything is about keeping up with other countries. 🤷‍♂️",0.0
0.0,0.0,0.0,0.0,0.0,0.0,0.0,0.0,Why is the U.S. so behind on paid parental leave when so many other countries have it sorted? 🤔,0.0
0.125,0.0,0.0,0.0,0.0,0.08333333333333333,0.041666666666666664,0.08333333333333333,"Totally wild! 😤 So many countries got this figured out already. New parents need support, not stress. Let's step it up, US! 🚀",-0.33068783068783064
0.0625,0.0625,0.0,0.0,0.0,0.0625,0.0,0.0,Why do you think the US is still behind on paid leave for new parents? 🤔,0.0
0.125,0.0,0.0,0.0,0.0,0.0,0.03125,0.03125,"That sucks, right? 😕 It's 2023, and still no guaranteed paid leave for new parents? Like, come on, US, step up your game! Other countries got this sorted ages ago. 🤷‍♂️",0.0
0.26666666666666666,0.0,0.0,0.0,0.0,0.0,0.0,0.0,"Nah, that's not true. There's no way the US is that behind. 🤔",0.0
0.08695652173913043,0.043478260869565216,0.0,0.0,0.0,0.0,0.0,0.08695652173913043,That’s wild! 😳 Can't believe they're still lagging behind on this. So many other countries got it sorted. 🤷‍♂️,-0.9886307464162135
0.0,0.08333333333333333,0.0,0.0,0.0,0.08333333333333333,0.0,0.0,Why do you think the U.S. is so behind on this? 🤔,0.0
0.13513513513513514,0.0,0.0,0.05405405405405406,0.0,0.02702702702702703,0.05405405405405406,0.08108108108108109,"It's crazy how the U.S. is lagging behind on this! 🤯 New parents need that time to bond with their babies and not stress about work. Other countries got it right, and we should too! 💪👶",-0.1985308715505261
0.09090909090909091,0.0,0.0,0.0,0.0,0.0,0.0,0.030303030303030304,"That's crazy! 😡 It's 2023, and still no paid leave for new parents in the US? Get with the program, America! Other countries are doing it, why can't we? 🤷‍♂️",-0.968054211035818
0.11538461538461539,0.0,0.0,0.0,0.0,0.0,0.038461538461538464,0.0,"Nah, that's not totally true. Some states have their own paid family leave systems. It's not like the whole U.S. is ignoring it! 🤷‍♂️",0.9746588693957114
0.23333333333333334,0.0,0.0,0.0,0.03333333333333333,0.03333333333333333,0.03333333333333333,0.03333333333333333,"That's so messed up! 😡 How can such a developed country not support new parents? It's 2023, time to catch up with the rest of the world! 🌍",0.0
0.19230769230769232,0.0,0.0,0.0,0.0,0.07692307692307693,0.07692307692307693,0.0,"Nah, that's not totally true. Some states do have paid leave, and companies offer it too. It's not like there's zero support. 🤷‍♂️",0.9871668311944719
0.1951219512195122,0.024390243902439025,0.0,0.0,0.0,0.024390243902439025,0.04878048780487805,0.024390243902439025,"That's so messed up! 😡 Can't believe the U.S. still doesn't have paid leave for new parents. Like, come on, it's 2023! Other countries are way ahead. We need to catch up and support families better! 🍼💪",0.32883919763235775
0.16279069767441862,0.0,0.0,0.023255813953488372,0.0,0.023255813953488372,0.046511627906976744,0.023255813953488372,"It's crazy how the US doesn't have paid leave for new parents! 🤯 Like, come on, it's 2023! Other countries have figured it out, why can't we? It's about time we catch up and support families better. 🍼💼",0.3286230693394676
0.14705882352941177,0.0,0.0,0.029411764705882353,0.0,0.0,0.058823529411764705,0.029411764705882353,"Honestly, it's crazy, right? 😤 Like, how are we still debating this? Other countries have had this figured out forever. It's about time the U.S. catches up and supports new parents! 👶💪",0.32959789057350036
0.15789473684210525,0.0,0.0,0.02631578947368421,0.0,0.0,0.02631578947368421,0.02631578947368421,"It's crazy that the US is so behind on this! 😤 New parents deserve some time to bond with their babies without stressing about money. Other countries got it right, it's time for a change! 🍼💪",0.0
0.23529411764705882,0.0,0.0,0.0,0.029411764705882353,0.029411764705882353,0.058823529411764705,0.029411764705882353,"It's crazy, right? 😤 Like, come on, US! Get with the program! New parents need that support! Other countries are doing it, why can't we? Let's make it happen! 💪 #PaidLeaveNow",0.32959789057350036
0.16666666666666666,0.0,0.0,0.0,0.0,0.03333333333333333,0.03333333333333333,0.03333333333333333,"It's crazy how the US is so behind on this! 🤔 Like, come on, new parents need support! Other countries got it figured out, why can't we? 🤷‍♂️",0.0
0.05555555555555555,0.0,0.0,0.0,0.0,0.0,0.05555555555555555,0.0,"Who cares if the U.S. is an ""outlier""? 🤷‍♂️ We've got other priorities, like keeping the economy strong! 💪 Besides, not everyone wants or needs paid leave. Let's focus on what really matters! 🤑",0.9823182711198428
0.0,0.0625,0.0,0.0,0.0,0.0625,0.0,0.0,Why do you think the US hasn't caught up with other countries on this? 🤔,0.0
0.11904761904761904,0.023809523809523808,0.0,0.047619047619047616,0.0,0.023809523809523808,0.09523809523809523,0.0,"Who cares? 🤷‍♂️ People should just plan better and save up for their leave. Not the government's job to pay for everything! Plus, companies should be free to decide their policies. If you don't like it, work somewhere else. 💼",0.9896091044037605
0.0,0.058823529411764705,0.0,0.0,0.0,0.058823529411764705,0.0,0.0,Why do you think the U.S. is so behind on paid leave compared to other countries? 🤔,0.0
0.09523809523809523,0.0,0.0,0.0,0.023809523809523808,0.0,0.023809523809523808,0.023809523809523808,"It's crazy, right? 😤 Like, how is it 2023 and the US still can't get it together on this? New parents need time to adjust and bond with their babies! Other countries figured it out, why can't we? 🤔",0.0
0.1388888888888889,0.05555555555555555,0.0,0.0,0.0,0.05555555555555555,0.0,0.027777777777777776,Totally agree! 🎉 It's crazy that we're so behind on this. Those states are showing everyone how it's done! Let's hope the rest of the U.S. gets with the program soon! 👶✨,-0.9652509652509652
0.12903225806451613,0.0,0.0,0.03225806451612903,0.0,0.03225806451612903,0.0967741935483871,0.03225806451612903,"It's crazy how the US is so behind on this! 😡 New parents deserve better. More countries should follow the lead and support families. Time to step up, America! 🍼💪",0.4961548002976929
0.19230769230769232,0.0,0.0,0.0,0.0,0.0,0.038461538461538464,0.07692307692307693,"It's crazy, right? 😤 Like, come on, US! Time to catch up with the rest of the world. New parents deserve a break too! 🍼✨",-0.3304692663582287
0.0,0.05263157894736842,0.0,0.0,0.0,0.05263157894736842,0.0,0.0,Why do you think the U.S. is so behind on paid leave? 🤔 Shouldn't it be a priority?,0.0
0.15789473684210525,0.0,0.0,0.02631578947368421,0.0,0.02631578947368421,0.05263157894736842,0.05263157894736842,"Wow, it's crazy how the U.S. is still lagging behind on this! 😤 It's about time we catch up with the rest of the world and support new parents with paid leave. Families deserve better! 💪👶",0.0
0.1891891891891892,0.02702702702702703,0.0,0.02702702702702703,0.0,0.0,0.02702702702702703,0.05405405405405406,That's wild! 😲 Can't believe the U.S. is still lagging behind on this. Paid leave is so important for new parents! It's about time they catch up with the rest of the world. 🍼💼,-0.3292723081988805
0.08333333333333333,0.0,0.0,0.0,0.0,0.0,0.027777777777777776,0.05555555555555555,"It's wild that the US is still lagging behind on this! 😡 New parents deserve time to bond with their babies without stressing over money. Other countries got it right, why can't we? 🤔",-0.32938076416337286
0.06451612903225806,0.0,0.0,0.0,0.0,0.0,0.0,0.0967741935483871,"It's crazy how the US is lagging behind on this! 🤯 So many other countries have figured it out. Parents deserve a break! 💪 Time to catch up, America! 🍼",-0.9897723523589574
0.11627906976744186,0.0,0.0,0.023255813953488372,0.023255813953488372,0.0,0.0,0.06976744186046512,"It's crazy how the US is lagging behind on this! 🤯 Like, come on, new parents deserve some time off without worrying about their paycheck. Other countries are doing it, why can't we? Let's get with the program, America! 🇺🇸💪",-0.9858692080184028
0.20512820512820512,0.0,0.0,0.05128205128205128,0.02564102564102564,0.02564102564102564,0.05128205128205128,0.02564102564102564,"Seriously, it's about time the U.S. catches up with the rest of the world on this! 😤 New parents deserve better support and time with their babies without worrying about their finances. Let's make it happen! 🍼💪",0.32905561039815723
0.17142857142857143,0.0,0.0,0.02857142857142857,0.0,0.02857142857142857,0.05714285714285714,0.02857142857142857,It's wild that the US still doesn't have paid leave for new parents! 😤 Other countries are way ahead on this. It's about time we catch up and support families better! 👶💪,0.32948929159802304
0.07407407407407407,0.0,0.0,0.0,0.0,0.037037037037037035,0.07407407407407407,0.037037037037037035,"It's wild how the US is so behind on this! 😤 New parents deserve better support. Other countries are doing it, why can't we? 🤷‍♀️",0.3303600925008259
0.18421052631578946,0.0,0.0,0.02631578947368421,0.0,0.02631578947368421,0.05263157894736842,0.02631578947368421,It's wild that the US is so behind on this! 🤯 New parents deserve better support. It's about time we catch up with the rest of the world and give families the help they need! 💪👶,0.32916392363396973
0.16666666666666666,0.0,0.0,0.0,0.0,0.0,0.047619047619047616,0.0,"Nah, that's not true at all. The U.S. has some states with paid leave policies, so it's not like there's nothing. Plus, every country does it differently, so it's not fair to call the U.S. an outlier. 🤷‍♂️",0.9794319294809011
0.07407407407407407,0.037037037037037035,0.0,0.0,0.0,0.0,0.0,0.07407407407407407,"That's wild! 😳 Can't believe the US is still lagging behind on this. So many countries have figured it out, but here we are. 🤔",-0.986679822397632
0.0,0.0,0.0,0.0,0.0,0.0,0.0,0.07692307692307693,Why is the U.S. still lagging behind on paid leave for parents? 🤔,-0.9871668311944719
0.06976744186046512,0.0,0.0,0.06976744186046512,0.0,0.0,0.046511627906976744,0.06976744186046512,"Who cares about paid leave? 🤷‍♂️ People should just work harder and stop whining about needing time off. We've been doing fine without it for years! 💪 If other countries wanna waste money on that, let them. Not our problem! 🙄",-0.198294665873488
0.0967741935483871,0.03225806451612903,0.0,0.0,0.0,0.06451612903225806,0.0,0.03225806451612903,Why is the U.S. so behind on paid leave for new parents? 🤔 It's crazy that only a few states offer it! What do you think needs to change? 🍼💼,-0.9699321047526673
0.13559322033898305,0.0,0.0,0.03389830508474576,0.0,0.0,0.06779661016949153,0.01694915254237288,"Who cares about paid leave? 🤷‍♂️ People should just plan better and save up if they want to have kids. The US has bigger problems to deal with than giving out free money for people to stay home. If other countries wanna do it, good for them, but we don’t need to follow their lead. 🙄",0.593002569677802
0.0967741935483871,0.0,0.0,0.0,0.03225806451612903,0.03225806451612903,0.0967741935483871,0.03225806451612903,"It's crazy, right?! 😡 Like, how can the US be so behind on this? New parents deserve better support! Other countries are doing it, why can't we? 🤔 #WakeUpAmerica",0.4961548002976929
0.09090909090909091,0.0,0.0,0.030303030303030304,0.0,0.0,0.030303030303030304,0.12121212121212122,"It's crazy that the US is still lagging behind on this! 😡 New parents deserve some chill time without worrying about money. Other countries got it right, why can't we? 🤷‍♂️",-0.5960659646334194
0.14285714285714285,0.0,0.0,0.0,0.0,0.02857142857142857,0.05714285714285714,0.02857142857142857,"It's crazy how the US is so behind on this! 🤯 New parents deserve better support. Other countries are doing it, so why can't we? It's time for a change, seriously! 🙌",0.32948929159802304
0.0,0.058823529411764705,0.0,0.0,0.0,0.058823529411764705,0.0,0.0,Why do you think the US is so behind on paid leave compared to other countries? 🤔,0.0
0.10810810810810811,0.02702702702702703,0.0,0.0,0.0,0.0,0.0,0.05405405405405406,"Wow, that's kinda wild! 😲 Can't believe the US is lagging behind on this. Like, it's 2023 and they still don't have paid leave for new parents everywhere? Get it together, America! 🍼📉",-0.9818360333824251
0.1935483870967742,0.06451612903225806,0.0,0.03225806451612903,0.0,0.03225806451612903,0.06451612903225806,0.03225806451612903,"That's crazy, right? 😲 You'd think a big country like the US would have something in place for new parents. Other countries seem to have figured it out. 🤔",0.32992411745298583
0.0,0.06666666666666667,0.0,0.0,0.0,0.06666666666666667,0.0,0.0,Why do you think the US is so behind on paid leave for parents? 🤔,0.0
0.1111111111111111,0.0,0.0,0.0,0.0,0.0,0.0,0.0,"Why is the U.S. so behind on paid leave for new parents? 🤔 Like, even some smaller countries got it sorted! What’s the deal? 🍼💼",0.0
0.12903225806451613,0.0,0.0,0.0,0.0,0.0,0.06451612903225806,0.06451612903225806,"It's crazy, right? 😤 How's the US still lagging behind in paid leave? New parents deserve better! 💪 Time to catch up with the rest of the world! 🌍",0.0
0.17142857142857143,0.0,0.0,0.0,0.02857142857142857,0.0,0.02857142857142857,0.02857142857142857,"It's crazy, right? 😡 Like, seriously, how can the US not have paid leave for new parents? It's 2023, c'mon! Other countries are way ahead on this. 🤔 Time for a change! 🍼",0.0
0.07692307692307693,0.0,0.0,0.05128205128205128,0.0,0.0,0.05128205128205128,0.05128205128205128,"Why are people always whining about this? 🤦‍♂️ Just work hard and save up! The US is doing fine without all these handouts. If you want paid leave, maybe move to another country that offers it. Problem solved! 🙄",0.0
0.16666666666666666,0.03333333333333333,0.0,0.0,0.0,0.0,0.03333333333333333,0.06666666666666667,"That's wild! 😲 Can't believe the US is still lagging behind on this. Other countries are way ahead with paid leave. About time they catch up, right? 🤔",-0.33003300330033003
0.15384615384615385,0.038461538461538464,0.0,0.0,0.0,0.0,0.0,0.07692307692307693,"That's wild! 😮 Can't believe the U.S. is lagging behind on this. It's 2023, come on! Other countries got it figured out. 🤷‍♂️",-0.9871668311944719
0.08888888888888889,0.0,0.0,0.044444444444444446,0.0,0.0,0.0,0.0,"Who even needs paid leave anyway? 🤷‍♂️ People should just save up for it if they want time off. Not everything needs to be handed out! 🙄 Plus, there are already some states doing their own thing. Why should the whole country change for this?",0.0
0.15,0.0,0.0,0.05,0.0,0.0,0.025,0.05,"It's crazy, right? 😤 Like, how is the US still behind on this? New parents deserve some time off without worrying about their paycheck! 💸 It's about time we catch up with the rest of the world! 🌍",-0.3289473684210526
0.15625,0.0,0.0,0.0,0.0,0.03125,0.0625,0.0625,"It's crazy how the US is still lagging behind on this! 🤯 New parents deserve better support. It's 2023, time to catch up with the rest of the world! 🌍💪",0.0
0.09090909090909091,0.030303030303030304,0.0,0.030303030303030304,0.030303030303030304,0.0,0.030303030303030304,0.06060606060606061,"It's kinda wild that the U.S. is lagging behind on this. Like, how are new parents supposed to manage without paid leave? 🤔 Other countries seem to have it figured out better.",-0.32970656116056707
0.1111111111111111,0.0,0.0,0.0,0.0,0.0,0.0,0.027777777777777776,"It's crazy that the US still doesn't have paid leave for new parents! 😤 So many other countries have figured it out, why can't we? It's 2023, time to catch up! 🕒",-0.9652509652509652
0.0,0.0,0.0,0.0,0.0,0.0,0.0,0.0,Why is the U.S. so behind on paid parental leave compared to other countries? 🤔,0.0
0.17647058823529413,0.029411764705882353,0.0,0.0,0.0,0.029411764705882353,0.029411764705882353,0.058823529411764705,"That's crazy! 😤 Can't believe the US is still lagging behind on this. It's 2023! New parents need that support, it's a no-brainer. Come on, America, catch up already! 🇺🇸🤦‍♂️",-0.32959789057350036
0.18,0.02,0.0,0.0,0.0,0.06,0.04,0.08,"It's insane that the US still doesn't guarantee paid leave for new parents! 😤 Like, come on, it's 2023! Other countries are way ahead on this, and it's embarrassing that we're lagging behind. New parents need support, not stress. Let's fix this already! 🍼👶",-0.3305785123966942
0.0,0.058823529411764705,0.0,0.0,0.0,0.058823529411764705,0.0,0.0,Why do you think the US is so behind on paid leave compared to other countries? 🤔,0.0
0.10526315789473684,0.0,0.0,0.0,0.0,0.02631578947368421,0.05263157894736842,0.02631578947368421,"It's crazy how the US is still behind on this! 🤯 New parents deserve better support and time with their babies. Other countries are doing it, why can't we? Let's catch up already! 💪 #PaidLeaveNow",0.32916392363396973
0.10344827586206896,0.0,0.0,0.0,0.0,0.034482758620689655,0.10344827586206896,0.06896551724137931,"It's wild that the US is still lagging on this! 😤 New parents deserve better support. Other countries are doing it right, so why can't we? 🤷‍♂️",0.19884668920262477
0.03125,0.0,0.0,0.03125,0.03125,0.0,0.0,0.03125,"Yeah, the U.S. is kinda slacking on this one. 😅 Like, why is it so hard to get paid leave? 13 states have it, but come on, it should be everywhere! 🤷‍♂️",-0.9689922480620154
0.06976744186046512,0.0,0.023255813953488372,0.0,0.023255813953488372,0.0,0.046511627906976744,0.046511627906976744,"It's crazy how the US is lagging behind on this! 😤 New parents deserve better, like c’mon, it’s 2023! Other countries are way ahead when it comes to taking care of families. Time to catch up, America! 🇺🇸👶",0.0
0.075,0.0,0.0,0.0,0.0,0.0,0.0,0.025,Why is the U.S. so behind on offering paid leave for new parents? 🤔 It's crazy that only a few states have mandatory systems! Why can't we catch up with the rest of the world on this? 🤷‍♂️,-0.9615384615384615
0.0,0.05555555555555555,0.0,0.0,0.0,0.05555555555555555,0.0,0.0,Why do you think the U.S. hasn't caught up with other countries on paid parental leave? 🤔,0.0
0.0625,0.0625,0.0,0.0,0.0,0.0625,0.0,0.0,Why do you think the U.S. is so behind on paid leave for new parents? 🤔,0.0
0.12,0.04,0.0,0.0,0.0,0.0,0.0,0.08,"That's wild! 😳 Can't believe the US is lagging behind on this. Other countries got it figured out, what's the hold-up? 🤔",-0.9876543209876543
0.13333333333333333,0.0,0.0,0.0,0.0,0.03333333333333333,0.06666666666666667,0.06666666666666667,"It's wild how the US is still lagging behind on this! 🤯 New parents deserve better support. Other countries are way ahead, and we need to catch up! 💪",0.0
0.05,0.0,0.0,0.0,0.0,0.0,0.0,0.05,Why is the U.S. lagging behind so many other countries when it comes to paid leave for new parents? 🤔,-0.9803921568627451
0.16279069767441862,0.0,0.0,0.023255813953488372,0.0,0.023255813953488372,0.046511627906976744,0.046511627906976744,"It's crazy, right?! 🤯 Like, how are we still lagging behind on this? New parents need that support and time with their babies! Other countries are doing it, so why can't we? It's about time the US steps up! 💪🇺🇸",0.0
0.07407407407407407,0.0,0.0,0.0,0.037037037037037035,0.0,0.0,0.037037037037037035,Isn't it wild that the US is one of the few places without guaranteed paid leave for new parents? 🤔 How do people even manage that?,-0.9737098344693281
0.0625,0.0,0.0,0.0,0.0,0.0,0.0625,0.0625,"Who needs paid leave anyway? 🙄 Just another excuse to slack off. If you want time with your kid, plan better, save up! The U.S. is doing just fine without it. 💪",0.0
