bias words,assertatives,factives,hedges,implicatives,report verbs,positive opinion words,negative opinion words,message,polarity
0.07692307692307693,0.02564102564102564,0.0,0.02564102564102564,0.0,0.02564102564102564,0.0,0.07692307692307693,"Totally agree! It's crazy that the U.S. is still lagging behind on this 😤. New parents deserve some chill time with their babies without stressing about money! Other countries are doing it, so why can't we? 🤔",-0.9871668311944719
0.15625,0.0,0.0,0.03125,0.0,0.03125,0.0625,0.0625,It's crazy how the US is lagging behind on this! 😤 New parents deserve better support. It's about time they catch up with the rest of the world! 🌍 #PaidLeaveNow,0.0
0.10344827586206896,0.0,0.0,0.0,0.0,0.0,0.0,0.06896551724137931,"It's crazy how the U.S. is lagging behind in paid leave for new parents! 😕 Like, come on, other countries got this sorted. Time to catch up! 🙄",-0.9857072449482503
0.0967741935483871,0.0,0.0,0.0,0.0,0.0,0.0,0.03225806451612903,"It's crazy how the US still doesn't have paid leave for new parents! 😤 Like, come on, even other countries got that sorted. Time to catch up, America! 🍼🇺🇸",-0.9699321047526673
0.16666666666666666,0.0,0.0,0.0,0.0,0.03333333333333333,0.0,0.0,"Nah, that's not entirely true! 🤔 Some companies in the US offer paid leave, but yeah, it's not a nationwide thing. It's a mixed bag, really. 🇺🇸",0.0
0.05128205128205128,0.0,0.0,0.0,0.02564102564102564,0.02564102564102564,0.0,0.05128205128205128,"It's crazy how the US is so behind on this! 😤 Like, how hard is it to offer paid leave for new parents? Seriously, get with the program! Other countries figured it out, why can't we? 🤷‍♂️",-0.980872976949485
0.10256410256410256,0.0,0.0,0.02564102564102564,0.0,0.02564102564102564,0.02564102564102564,0.02564102564102564,"It's so crazy that the US still doesn't offer guaranteed paid leave for new parents! 😡 So many other countries have figured this out, and it's about time the US catches up. Parents deserve better! 💪👶",0.0
0.13043478260869565,0.0,0.0,0.0,0.0,0.0,0.0,0.043478260869565216,That's wild! 😱 It's 2023 and still no paid leave in the US? Other countries are way ahead on this. 🤔,-0.9775171065493646
0.0625,0.0,0.0,0.0,0.0,0.0,0.0625,0.0,Why is the US so behind on paid leave? 🤔 Seems like such a basic need!,0.984251968503937
0.20833333333333334,0.041666666666666664,0.0,0.0,0.0,0.041666666666666664,0.08333333333333333,0.08333333333333333,"That's wild! 😮 Can't believe the U.S. is still lagging behind on this. It's 2023, and parents need better support! 🍼💼",0.0
0.15151515151515152,0.0,0.030303030303030304,0.0,0.0,0.030303030303030304,0.030303030303030304,0.0,"Nah, that's not true. The U.S. has some policies in place, even if they aren't perfect. Plus, every country handles it differently. Can't compare apples to oranges, ya know? 🤷‍♂️",0.968054211035818
0.125,0.041666666666666664,0.0,0.041666666666666664,0.0,0.041666666666666664,0.0,0.0,What do y'all think about the U.S. not having guaranteed paid leave for new parents? 🤔 Is it time for a change or nah?,0.0
